category,datetime,headline,id,image,related,source,summary,url
company,1776898311,"Casey's General Stores: A Great Business, But The Valuation Doesn't Cut It",139857132,https://static.seekingalpha.com/cdn/s3/uploads/getty_images/1689015930/image_1689015930.jpg?io=getty-c-w1536,CASY,SeekingAlpha,Casey's General Stores is a vertically integrated convenience retailer with a strong rural moat and a leading U.S. pizza business. Read why CASY stock is a Hold.,https://finnhub.io/api/news?id=3693d9725ca40a09fd093aa92caabba65391a79b4754f90a3bec9ed2347c044b
company,1776887400,Casey’s Opens Applications for 2026 Innovation Summit,139853196,https://s.yimg.com/rz/stage/p/yahoo_finance_en-US_h_p_finance_2.png,CASY,Yahoo,"ANKENY, Iowa, April 22, 2026--Casey’s, the third largest convenience store and fifth largest pizza chain, is opening applications for its 2026 Innovation Summit. The annual event focuses on discovering brands with innovative products to potentially distribute across the retailer’s 2900-plus stores in 19 states.",https://finnhub.io/api/news?id=5fc96542099dba49dbbfc3cbbfc0e24bf246b486317752ef4dafa9932e05d3d7
company,1776886560,Convenience Store Stocks Are Rare. Yesway is the Newest.,139853197,https://s.yimg.com/rz/stage/p/yahoo_finance_en-US_h_p_finance_2.png,CASY,Yahoo,"If you’ve already tried a Wawa hoagie and a Casey’s pizza, it’s time to put a  Yesway  deep-fried burrito on your list.  While convenience stores are one of the fastest-growing areas of U.S. retail, there aren’t many ways for investors to get it on the growth, as some big players like Wawa and Buccee’s are privately held.  Shares were initially priced at $20, raising more than $280 million, and the company’s Chairman and CEO Thomas Trkla, spoke with Barron’s after he rang the opening bell at the  Wednesday morning.",https://finnhub.io/api/news?id=a2cd4f1dfd142b8ce66153bc2d0aa0593e9fc9bc70d7882f45b430dc79d7ced2
company,1776879075,"Yesway Prices $280 Million IPO At $20, Valuation Near $1.2 Billion",139851950,https://s.yimg.com/rz/stage/p/yahoo_finance_en-US_h_p_finance_2.png,CASY,Yahoo,Convenience store operator sells 14 million shares at the bottom of its $20 to $23 marketed range.,https://finnhub.io/api/news?id=cb01de03c74c416951623a72a16c393f5664506b8446eda22f6686035a3cfc48
company,1776861459,"Convenience store owner Yesway is stealing customers from fast-food chains, CEO says",139851111,https://image.cnbcfm.com/api/v1/image/108295486-1776873706328-gettyimages-2271939992-YESWAY_IPO.jpeg?v=1776873783&w=1920&h=1080,CASY,CNBC,"Yesway made its public market debut on Wednesday, trading on the Nasdaq Stock Exchange under ""YSWY."" ",https://finnhub.io/api/news?id=4701ae91cb461cdb6d83a06dcc76d020444a04897f33a085a1f49adda90e9220
company,1776858600,5 Stocks to Buy as Retail Sales Soar Amid Ongoing Geopolitical Tensions,139848660,https://s.yimg.com/rz/stage/p/yahoo_finance_en-US_h_p_finance_2.png,CASY,Yahoo,"Retail sales surge lifts FIVE, JD, TPR, LEVI, CASY as strong spending, rising oil prices, and online demand boost outlook.",https://finnhub.io/api/news?id=ebf4cb903c6035a7e33e3a6227a091ab968d2e8a381be7445bf2004960d71e2f
company,1776856739,Are consumers finally cracking under the weight of $4 gas?,139847132,https://s.yimg.com/rz/stage/p/yahoo_finance_en-US_h_p_finance_2.png,CASY,Yahoo,The warning signals from the consumer mount.,https://finnhub.io/api/news?id=fd6db32393a7c20d23d072a3543981d517f621e95e06c7eb0f28288cf688a18b
