category,datetime,headline,id,image,related,source,summary,url
company,1776895203,Why ConocoPhillips (COP) Outpaced the Stock Market Today,139858214,https://s.yimg.com/rz/stage/p/yahoo_finance_en-US_h_p_finance_2.png,COP,Yahoo,"The latest trading day saw ConocoPhillips (COP) settling at $122.6, representing a +1.95% change from its previous close.",https://finnhub.io/api/news?id=42aff2dc02f53e4375cc9b7a30ba8c2c8b14a77f1a88ae48defe1dc7b6675975
company,1776874860,Brock Group Relocates Headquarters to Houston's Energy Corridor,139851693,https://s.yimg.com/rz/stage/p/yahoo_finance_en-US_h_p_finance_2.png,COP,Yahoo,"The Brock Group, a North American industrial specialty services contractor, has relocated its headquarters to North Eldridge Parkway in Houston's Energy Corridor District. The move positions the company at the center of one of the nation's leading energy and industrial hubs, reinforcing its alignment with the markets it serves.",https://finnhub.io/api/news?id=b25afd6381fdbb0ab0869de31c010057cca59921abf8b5a5a663c72e3cd6271a
company,1776874260,Important Factors to Watch Ahead of BP's Q1 Earnings Release,139851694,https://s.yimg.com/rz/stage/p/yahoo_finance_en-US_h_p_finance_2.png,COP,Yahoo,"BP to report Q1 2026 on April 28, with consensus at 85 cents per ADS and $57.6 billion revenue after recent beats and stronger refining margins.",https://finnhub.io/api/news?id=27d422269b63423d028252eb91ccecac39115c74656eb3e3758a4b80a704998e
company,1776871560,Is Eni Positioned to Capitalize on Rising LNG & Power Demand?,139851695,https://s.yimg.com/rz/stage/p/yahoo_finance_en-US_h_p_finance_2.png,COP,Yahoo,"E expands LNG and gas portfolio to tap rising demand for cleaner fuels, targeting more than 20 MTPA contracts by 2030.",https://finnhub.io/api/news?id=60d750dc16add40b6b92dab91dcf684b266fa59cbd5fe25bb21cedbb0b3e4f16
company,1776864798,Proxy advisor ISS urges ConocoPhillips shareholders to vote for independent board chair,139851263,,COP,Finnhub,"Proxy advisor ISS on Wednesdayrecommended that ConocoPhillips shareholders vote infavor of a proposal calling for an independent board chair,citing the need for stronger oversight of management. ...",https://finnhub.io/api/news?id=ab9610fb25da7dae4f935ab0aae7626117ce394248b903c51c27a11a00de31fc
company,1776862915,ISS urges ConocoPhillips shareholders vote for shareholder proposal to require independent board chair,139850690,,COP,Finnhub,Proxy advisor ISS: Proxy advisor ISS recommends ConocoPhillips shareholders vote for shareholder proposal to require independent board chair...,https://finnhub.io/api/news?id=a33539d9ccc984dc03bfb096b88e74b51cbc5ecc125bee43ce10341e958ca77a
company,1776859159,"Scotiabank Maintains Sector Perform on ConocoPhillips, Raises Price Target to $125",139865046,,COP,Benzinga,Scotiabank  analyst Betty Zhang   maintains ConocoPhillips (NYSE:COP) with a Sector Perform and raises the price target from $100 to $125.,https://finnhub.io/api/news?id=a36bda110daefd7b5a36d161e1c64a74aef4f3939ae7f039888eeb9242876fe7
company,1776844475,Why the confusion around the Iran situation could get worse. How to profit anyway,139851012,https://image.cnbcfm.com/api/v1/image/108294300-1776727602856-gettyimages-2270655444-AFP_A7L27VT.jpeg?v=1776858679&w=1920&h=1080,COP,CNBC,"Brian Sullivan's sources tell him it is not clear who is actually ""running"" Iran, which Trump essentially confirmed Tuesday night.",https://finnhub.io/api/news?id=cf6881a8063157656dcf7b51ea1ab8f606feee04dc447e8f4e0577f82f045d36
