category,datetime,headline,id,image,related,source,summary,url
company,1776894732,Chevron Corporation (CVX) Expands Stakes in Venezuela Oil Operations,139854641,https://s.yimg.com/rz/stage/p/yahoo_finance_en-US_h_p_finance_2.png,CVX,Yahoo,"Chevron Corporation (NYSE:CVX) is one of the top S&P 500 stocks by index weight. On April 14, Chevron Corporation (NYSE:CVX) reached an asset swap agreement with Petroleos de Venezuela, S.A. and its subsidiaries. The agreement expands the US energy giant’s stake in Venezuelan heavy oil operations. The agreement is poised to expand Chevron’s heavy oil […]",https://finnhub.io/api/news?id=0e4ae16e617ab5752372ad4d826e3983f1817f09a955e48decd14cb9ea08f917
company,1776879410,CDL: A Surprisingly Solid Dividend Growth Complement To SCHD,139854321,https://static.seekingalpha.com/cdn/s3/uploads/getty_images/2208568228/image_2208568228.jpg?io=getty-c-w1536,CVX,SeekingAlpha,"VictoryShares US Large Cap High Dividend Volatility-Weighted ETF (CDL) emerges as a top dividend growth ETF pick for its stable, low-volatility, large-cap US stock selection. Read more here.",https://finnhub.io/api/news?id=44f12a5ca11f2c941e580b586ae9bba95d463367fca0117a3f3f81671e0702af
company,1776871200,RRC Q1 Earnings Surpass Estimates on Higher Price Realizations,139851573,https://s.yimg.com/rz/stage/p/yahoo_finance_en-US_h_p_finance_2.png,CVX,Yahoo,Range Resources beats Q1 2026 estimates on higher production and natural gas prices. Revenues top $1B with improved price realizations boosting earnings.,https://finnhub.io/api/news?id=456ed588043fd26c993899b016d1f60e4cc090dbf2721c01e22299ab28aaf071
company,1776864180,HELLENiQ Upstream Joins the 10th Balkans Energy Summit 2026 as Silver Sponsor,139848378,https://s.yimg.com/rz/stage/p/yahoo_finance_en-US_h_p_finance_2.png,CVX,Yahoo,"A landmark partnership reinforcing Greece's position at the forefront of Southeast Europe's upstream energy landscapeLondon, United Kingdom--(Newsfile Corp. - April 22, 2026) - (IN-VR Limited) - The Energy Circle and The Net-Zero Circle by IN-VR are proud to announce HELLENiQ Upstream S.A. as an official Silver Sponsor of the 10th Balkans Energy Summit 2026, taking place on 19-20 May 2026 at the Marriott Hotel, Athens, Greece.A cornerstone of Greece's upstream oil and gas sector, HELLENiQ...",https://finnhub.io/api/news?id=53811979e0467b414a4826ab6f063447a2c60a5964b5fbeeb6e8919985674e66
company,1776858337,"Scotiabank Maintains Sector Perform on Chevron, Raises Price Target to $187",139855187,,CVX,Benzinga,Scotiabank  analyst Paul Cheng   maintains Chevron (NYSE:CVX) with a Sector Perform and raises the price target from $168 to $187.,https://finnhub.io/api/news?id=f2bc2d514dee9ce14593b9b03917284c474ad7918f27f26e3e1a164718b3fd7d
company,1776856499,Chevron’s Venezuela Opening And Hormuz Shock Reframe Valuation Debate,139847131,https://s.yimg.com/rz/stage/p/yahoo_finance_en-US_h_p_finance_2.png,CVX,Yahoo,"Chevron (NYSE:CVX) is facing a reshaped risk profile as a U.S.-led move removes Venezuela’s president, clearing the way for higher production from its Venezuelan operations. At the same time, Iran’s closure of the Strait of Hormuz is disrupting global oil trade routes and pushing energy prices higher. These events are increasing the importance of Chevron’s assets outside the Middle East and its role as a key U.S. operator in Venezuela. Chevron sits at the center of global oil and gas, with...",https://finnhub.io/api/news?id=de82d02a76358e12e6854c0bae9e16d3dae59de8bcbd3ce0a97eb0f8cf71c809
company,1776844475,Why the confusion around the Iran situation could get worse. How to profit anyway,139851012,https://image.cnbcfm.com/api/v1/image/108294300-1776727602856-gettyimages-2270655444-AFP_A7L27VT.jpeg?v=1776858679&w=1920&h=1080,CVX,CNBC,"Brian Sullivan's sources tell him it is not clear who is actually ""running"" Iran, which Trump essentially confirmed Tuesday night.",https://finnhub.io/api/news?id=cf6881a8063157656dcf7b51ea1ab8f606feee04dc447e8f4e0577f82f045d36
company,1776839820,Chevron Corporation (CVX): Among the Best Crude Oil Stocks to Buy According to Analysts,139845182,https://s.yimg.com/rz/stage/p/yahoo_finance_en-US_h_p_finance_2.png,CVX,Yahoo,"Chevron Corporation (NYSE:CVX) is among the 13 Best Crude Oil Stocks to Buy According to Analysts. On April 17, BNP Paribas upgraded Chevron Corporation (NYSE:CVX) to Outperform from Neutral with a $174 price target. The firm argued that collapsing oil and product inventories amid the Iran war could trigger an extended upside cycle in crude prices. […]",https://finnhub.io/api/news?id=adac86642227d949f4d10a7ea8a64904bd804b56f5385f36471460b7466edd1c
