category,datetime,headline,id,image,related,source,summary,url
company,1776896104,General Dynamics (GD) Stock Slides as Market Rises: Facts to Know Before You Trade,139858262,https://s.yimg.com/rz/stage/p/yahoo_finance_en-US_h_p_finance_2.png,GD,Yahoo,"General Dynamics (GD) closed the most recent trading day at $320.74, moving 1.47% from the previous trading session.",https://finnhub.io/api/news?id=13ca4a5fd11eb64753e7a36bdb0c752019ee34a1bcd9c1839cb394ac84f1b8a3
company,1776888840,"Top Analyst Reports for Exxon Mobil, IBM & Citigroup",139858175,https://s.yimg.com/rz/stage/p/yahoo_finance_en-US_h_p_finance_2.png,GD,Yahoo,"Exxon Mobil's production growth, Guyana success, and low-carbon push highlight why XOM stands out in today's top analyst research reports.",https://finnhub.io/api/news?id=5da16ec1c3ef815e47820d9bc47ca9fd2bb3d87be799859c53ce652548868c63
company,1776874202,Why General Dynamics (GD) is Poised to Beat Earnings Estimates Again,139851745,https://s.yimg.com/rz/stage/p/yahoo_finance_en-US_h_p_finance_2.png,GD,Yahoo,General Dynamics (GD) has an impressive earnings surprise history and currently possesses the right combination of the two key ingredients for a likely beat in its next quarterly report.,https://finnhub.io/api/news?id=0def98d66774310e5f2ae43a97493ef74fe16952fb76222b826a936778d2488c
company,1776872220,"Boeing's Q1 Loss Narrower Than Estimates, Revenues Increase Y/Y",139851669,https://s.yimg.com/rz/stage/p/yahoo_finance_en-US_h_p_finance_2.png,GD,Yahoo,"BA Q1 loss narrower than estimates. Revenues top estimates as sales jump 14% and backlog swells to $694.7B, signaling strong demand momentum.",https://finnhub.io/api/news?id=00de0d9e9a1e46aaef64dcd4984415fd9f8f9c93c998ccfd6b315a53def82b7e
company,1776870720,"Teledyne's Q1 Earnings & Revenues Beat Estimates, '26 EPS View Raised",139851718,https://s.yimg.com/rz/stage/p/yahoo_finance_en-US_h_p_finance_2.png,GD,Yahoo,TDY beats Q1 estimates as sales rise 7.6% to $1.56B and EPS climbs 17%. The company also lifts its full-year 2026 adjusted EPS outlook.,https://finnhub.io/api/news?id=03d885c9b88aed5d635eb1f44354fb0b593039f76767d0e2bbaf597653252ea2
company,1776866410,General Dynamics (GD) Reports Next Week: Wall Street Expects Earnings Growth,139849948,https://s.yimg.com/rz/stage/p/yahoo_finance_en-US_h_p_finance_2.png,GD,Yahoo,General Dynamics (GD) possesses the right combination of the two key ingredients for a likely earnings beat in its upcoming report. Get prepared with the key expectations.,https://finnhub.io/api/news?id=fadb1e016be3875680b2010924c93aafa7f95e2b326b08601c365631222e09a1
company,1776862802,These 2 Aerospace Stocks Could Beat Earnings: Why They Should Be on Your Radar,139849773,https://s.yimg.com/rz/stage/p/yahoo_finance_en-US_h_p_finance_2.png,GD,Yahoo,Finding stocks expected to beat quarterly earnings estimates becomes an easier task with our Zacks Earnings ESP.,https://finnhub.io/api/news?id=5197376a1c2542bbcbbe1205f560d71665184a5895e6df6daa921755e77b8794
