category,datetime,headline,id,image,related,source,summary,url
company,1776881219,Does GM’s EV Slowdown and Truck Pivot Reshape the Bull Case for General Motors (GM)?,139853116,https://s.yimg.com/rz/stage/p/yahoo_finance_en-US_h_p_finance_2.png,GM,Yahoo,"In recent days, General Motors’ board approved record compensation for CEO Mary Barra, authorized a one-time US$40.00 million award for chief product officer Sterling Anderson, acquired a new plant to support future gasoline-powered pickup and Escalade production, and reportedly postponed its next-generation full-size electric truck program at Factory Zero. Together, these moves point to a meaningful rebalancing of GM’s priorities between electric vehicles and high-margin trucks while...",https://finnhub.io/api/news?id=be97bb5734aeb4bd5b00d2aa70230e4234b94669c85198269ffe577caee36d8c
company,1776875986,"BMW says it has no intention of dropping sedans, even as some rivals cut back",139865878,https://image.cnbcfm.com/api/v1/image/108295770-1776889953869-P90636050_highRes_bmw-740-xdrive-04-20.jpg?v=1776890096&w=1920&h=1080,GM,CNBC,"The BMW 7-Series gets one of the most extensive updates any model has received in company history, according to BMW. It will be the first to spearhead ",https://finnhub.io/api/news?id=9d99f40917a8090dc0f8526c082ab154bf30ff44d4b90e4fff590e21ed436384
company,1776867300,General Motors to Report Q1 Earnings: Here's What to Expect,139851756,https://s.yimg.com/rz/stage/p/yahoo_finance_en-US_h_p_finance_2.png,GM,Yahoo,GM heads into Q1 earnings with rising software momentum but declining vehicle sales and tariff pressures clouding the outlook.,https://finnhub.io/api/news?id=8a2642f515150fc90123d50b9aa283e361c62ead45f3c604c715e795c30ce454
company,1776866408,Ford Motor Company (F) Earnings Expected to Grow: Should You Buy?,139849957,https://s.yimg.com/rz/stage/p/yahoo_finance_en-US_h_p_finance_2.png,GM,Yahoo,Ford Motor (F) doesn't possess the right combination of the two key ingredients for a likely earnings beat in its upcoming report. Get prepared with the key expectations.,https://finnhub.io/api/news?id=2c8c258483abeea973108414301012aee3286e3e9346bd2e18bc94543d1be348
company,1776862314,Luxury carmaker BMW imported fewer cars to U.S. than the Detroit 3,139848593,https://s.yimg.com/rz/stage/p/yahoo_finance_en-US_h_p_finance_2.png,GM,Yahoo,A new report shows which automakers imported the most and fewest finished vehicles in 2025. Ford came out the best of the Detroit 3.,https://finnhub.io/api/news?id=7fed45169b9626f3c6357cd7c1e13e228f912478407fee6d84817ae39f5cb8a8
company,1776862048,Tesla Earnings Prediction Market Preview: What Will Elon Musk Say?,139854226,https://cdn.benzinga.com/files/images/story/2026/04/22/Focused-Shot-Capturing-Elon-Musk-Alongsi.jpeg?width=2048&height=1536,GM,Benzinga,Prediction markets are pricing every word of Tesla&#39;s Q1 earnings call. Terafab at 89%. Cybertruck at 59%. Here&#39;s what traders expect Musk to say.,https://finnhub.io/api/news?id=9e8fc74385b97b694217d1ed707505c126908aa3a891d31042910164a14d0694
company,1776839156,"The Pre-Market Rundown: April 22, 2026",139851256,https://image.cnbcfm.com/api/v1/image/108295197-4ED1-PreMarket1-042226.jpg?v=1776853380&w=1920&h=1080,GM,CNBC,"CNBC brings you fast, accurate, and actionable business news and market updates.",https://finnhub.io/api/news?id=96d274adee694130e00a06061abaad34e1b5e13d1e826899769839cd3de2910a
company,1776831785,GM To Suspend Next-Generation EV Pickup Truck Development Amid Gasoline Pivot: Report,139849222,https://cdn.benzinga.com/files/images/story/2026/04/22/General-Motors.jpeg?width=2048&height=1536,GM,Benzinga,GM reportedly suspends the development of EV pickup truck as US auto sector scales back on electric mobility.,https://finnhub.io/api/news?id=5303bad409a1c9b32cc8f4d22fce273cbb6920af088aedb66994ed2876371550
