category,datetime,headline,id,image,related,source,summary,url
company,1776878160,"Pegasystems Q1 Earnings Miss Estimates, Revenues Decline Y/Y",139853158,https://s.yimg.com/rz/stage/p/yahoo_finance_en-US_h_p_finance_2.png,GRMN,Yahoo,"PEGA's Q1 results benefit from Pega Cloud growth and rising ACV, highlighting a continued shift toward cloud demand.",https://finnhub.io/api/news?id=823969e60375a9428411ad51af30b14bf4aade7ee5bd552c0cbb5d10e390cf5c
company,1776873480,TEL Q2 Earnings Beat Estimates on Record Orders & Margin Gains,139858216,https://s.yimg.com/rz/stage/p/yahoo_finance_en-US_h_p_finance_2.png,GRMN,Yahoo,TE Connectivity tops fiscal Q2 estimates as sales rose 14.5% and orders hit a record $5.3B; fiscal Q3 guidance calls for roughly $5B sales and $2.83 EPS.,https://finnhub.io/api/news?id=d672c42daec8df66cac096869e0dfeefd5bef8d993ca18aafa04d29c857526f2
company,1776873060,4 Top-Ranked Technology Stocks Set to Beat Q1 Earnings Expectations,139859112,https://s.yimg.com/rz/stage/p/yahoo_finance_en-US_h_p_finance_2.png,GRMN,Yahoo,"Here, we have picked four technology stocks, SNDK, MPWR, GRMN and GLW, which are likely to pull off earnings surprises this earnings season.",https://finnhub.io/api/news?id=63eff20153ec6673cf0c3a15a3fe6457803a4a0712ddc51b9527be873041d8ff
company,1776866428,Garmin (GRMN) Earnings Expected to Grow: What to Know Ahead of Next Week's Release,139850009,https://s.yimg.com/rz/stage/p/yahoo_finance_en-US_h_p_finance_2.png,GRMN,Yahoo,Garmin (GRMN) possesses the right combination of the two key ingredients for a likely earnings beat in its upcoming report. Get prepared with the key expectations.,https://finnhub.io/api/news?id=13c2d16f5d4be442f51ae1e365d3c38f56e6dfb350181064ac39a9215d713f9f
company,1776864660,Charter Communications to Report Q1 Earnings: What's in the Cards?,139850010,https://s.yimg.com/rz/stage/p/yahoo_finance_en-US_h_p_finance_2.png,GRMN,Yahoo,CHTR heads into Q1 earnings with mobile strength offset by broadband pressure and rising costs.,https://finnhub.io/api/news?id=df4aee8c824d5704e3996abe70ab81043697f8530f2e5093e00657afd8aed589
