category,datetime,headline,id,image,related,source,summary,url
company,1776900787,Las Vegas Sands Corp. 2026 Q1 - Results - Earnings Call Presentation,139857345,https://static.seekingalpha.com/assets/og_image_1200-29b2bfe1a595477db6826bd2126c63ac2091efb7ec76347a8e7f81ba17e3de6c.png,LVS,SeekingAlpha,2026-04-22. The following slide deck was published by Las Vegas Sands Corp.,https://finnhub.io/api/news?id=591600ba1cf25e5d1d73c9924b166a8bed2c72f329bc9f42e878e61af7ec49c7
company,1776898802,Here's What Key Metrics Tell Us About Las Vegas Sands (LVS) Q1 Earnings,139858320,https://s.yimg.com/rz/stage/p/yahoo_finance_en-US_h_p_finance_2.png,LVS,Yahoo,"Although the revenue and EPS for Las Vegas Sands (LVS) give a sense of how its business performed in the quarter ended March 2026, it might be worth considering how some key metrics compare with Wall Street estimates and the year-ago numbers.",https://finnhub.io/api/news?id=00d2518fca8205d68896eca32b3a17e10c89eeeedc0ed1e3ca7cc62d8776d9bd
company,1776892503,Las Vegas Sands (LVS) Q1 Earnings and Revenues Surpass Estimates,139858321,https://s.yimg.com/rz/stage/p/yahoo_finance_en-US_h_p_finance_2.png,LVS,Yahoo,"Las Vegas Sands (LVS) delivered earnings and revenue surprises of +20.69% and +7.85%, respectively, for the quarter ended March 2026. Do the numbers hold clues to what lies ahead for the stock?",https://finnhub.io/api/news?id=20a1951dc937974beaae6143eb326e6ae195e20a21bd463e8f8c5d1e6c3ff127
company,1776890776,Las Vegas Sands Corp (NYSE:LVS) Reports Strong Q1 2026 Earnings Beat,139853978,https://www.chartmill.com/images/uploads/THUMBNAILS_CHARTMILL_1000_528_17_c249efcc18.webp,LVS,ChartMill,"Las Vegas Sands (LVS) Q1 2026 earnings beat estimates with $3.59B revenue and $0.91 EPS, driving positive stock momentum.",https://finnhub.io/api/news?id=76520e19ba8f0ecc32f939cb51a5d4da5cd3883d83981596a79f2d82760be6be
company,1776889240,Las Vegas Sands Corp. (LVS) Q1 2026 Earnings Call Transcript,139856170,https://static.seekingalpha.com/assets/og_image_1200-29b2bfe1a595477db6826bd2126c63ac2091efb7ec76347a8e7f81ba17e3de6c.png,LVS,SeekingAlpha,"Las Vegas Sands Corp. (LVS) Q1 2026 Earnings Call April 22, 2026 4:30 PM EDTCompany ParticipantsDaniel Briggs - Senior Vice President of Investor...",https://finnhub.io/api/news?id=b0f82f0bbe017ffb625f979cf354cfe868de7c444616d1c1f36e63ba2bcd9fb6
company,1776880150,Las Vegas Sands : First Quarter 2026 Presentation,139854467,,LVS,Finnhub,"1Q26 Earnings Presentation April 22, 2026 Investment Case and Strategic Priorities Investment Case: Global...",https://finnhub.io/api/news?id=6f3c0f92a9786f70224b1939f451549395a990485bfd08ca341dc2a8d8966f68
company,1776878587,Full Transcript: Las Vegas Sands Q1 2026 Earnings Call,139869994,https://cdn.benzinga.com/files/images/story/2025/11/06/movers_1.jpg?width=2048&height=1536,LVS,Benzinga, ,https://finnhub.io/api/news?id=d7824776a7233e3baf8c6ae8493cde0bb6b830faa5801051666832084f0f3ff5
company,1776877918,"Casino operator Las Vegas Sands quarterly profit rises on Macau, Singapore demand",139854084,,LVS,Finnhub,"Las Vegas Sands reported ahigher first-quarter profit on Wednesday, driven by strongdemand from both its Macau and Singapore businesses, sending thecasino operator's shares up more than 2% after...",https://finnhub.io/api/news?id=d6e7a32b4de9374e8031733623419314f36f5c6fcdbfd0183af9da7ae3f81749
company,1776877622,Las Vegas Sands shares are trading higher after the company reported better-than-expected Q1 financial results.,139869995,,LVS,Benzinga,,https://finnhub.io/api/news?id=210771eb964d38155a86de62bed07bb343a85b423071c6578c6f5406437f5246
company,1776874216,Las Vegas Sands: Q1 Earnings Snapshot,139853330,,LVS,Finnhub,"LAS VEGAS — LAS VEGAS — Las Vegas Sands Corp. on Wednesday reported first-quarter net income of $567 million. On a per-share basis, the Las Vegas-based company said it had profit of 85 cents....",https://finnhub.io/api/news?id=10763de7523f4bf76973e76173f0d58e698df8400ba84266c85aefcf591cb427
company,1776874101,"Las Vegas Sands Q1 Adj. EPS $0.91 Beats $0.78 Estimate, Sales $3.585B Beat $3.343B Estimate",139869996,,LVS,Benzinga,Las Vegas Sands (NYSE:LVS) reported quarterly earnings of $0.91 per share which beat the analyst consensus estimate of $0.78 by 16.67 percent. This is a 54.24 percent increase over earnings of $0.59 per share from the,https://finnhub.io/api/news?id=2e3b8f8a6ecd025bbfbc9626ae63d3322f4cb7cd5ade6024aa87289bd4f61e7d
company,1776873975,Las Vegas Sands Reports First Quarter 2026 Results,139853219,,LVS,Finnhub,"For the quarter ended March 31, 2026Net Revenue Increased 25.3% to $3.59 billionNet Income Increased 57.1% to $641 millionDiluted Earnings per Share Increased 73.5% to $0.85 per Share Consolidated...",https://finnhub.io/api/news?id=f97194b82a99d102e97ebafc312b04f588c08f007f619ad7e2823ca0923978b4
company,1776870686,Is Las Vegas Sands Big Macao Push Going to Hurt?,139850098,https://s.yimg.com/rz/stage/p/yahoo_finance_en-US_h_p_finance_2.png,LVS,Yahoo,"Las Vegas Sands (NYSE:LVS) reports Q1 2026 results today after the close, with a conference call at 1:30 p.m. PT. The stock is up 8.71% over the past month but down 11.14% year to date, and a Macao margin story will be front and center. A Strong Finish, a Complicated Setup Las Vegas Sands closed ... Is Las Vegas Sands Big Macao Push Going to Hurt?",https://finnhub.io/api/news?id=e7831904347d6316a2d67d5697f4d4a43da0d7c265a2d97fec90ff049b0c659c
company,1776841880,"Earnings Scheduled For April 22, 2026",139848781,https://cdn.benzinga.com/files/images/story/2025/11/06/earnings_scheduled_1.jpg?width=2048&height=1536,LVS,Benzinga, ,https://finnhub.io/api/news?id=1e7158ea851d7890fc286fd70d8458d9ebfd7cdbe7070895fd31cf56e6a850e9
