category,datetime,headline,id,image,related,source,summary,url
company,1776894303,Realty Income Corp. (O) Stock Sinks As Market Gains: Here's Why,139855927,https://s.yimg.com/rz/stage/p/yahoo_finance_en-US_h_p_finance_2.png,O,Yahoo,"Realty Income Corp. (O) closed at $63.34 in the latest trading session, marking a -1.03% move from the prior day.",https://finnhub.io/api/news?id=3f51c7ab3eac964aab6e90e9d14bffc435fe95e80a04ab2d2d3b662b357058c7
company,1776862845,What We're Watching This REIT Earnings Season,139850708,https://static.seekingalpha.com/cdn/s3/uploads/getty_images/1940527700/image_1940527700.jpg?io=getty-c-w1536,O,SeekingAlpha,"Preview REIT earnings season: forecasts, key trends, IPO/M&A signals, and sector winners/laggards amid rate volatility. Read the full analysis here.",https://finnhub.io/api/news?id=5b82cdfd8c74db5d6d853eec79a7882e15b15f9c36c632e190eb37674a61e274
company,1776862453,Realty Income: 3 New Reasons This Is Still A Hard Pass,139850659,https://static.seekingalpha.com/cdn/s3/uploads/getty_images/2254461423/image_2254461423.jpg?io=getty-c-w1536,O,SeekingAlpha,"Realty Income (O) lags the S&P 500 with weak long-term growth, negative true FCF margins (incl.",https://finnhub.io/api/news?id=16e31369a9af1f2e5d8ee20a3371410b0225ea4c3ca27af219ddecd7a8e4cfbc
company,1776860149,Wall Street Is Lukewarm on Realty Income While Retail Piles In. What Do Analysts Know?,139848617,https://s.yimg.com/rz/stage/p/yahoo_finance_en-US_h_p_finance_2.png,O,Yahoo,"Realty Income (NYSE: O) has built its identity around one promise: a reliable monthly dividend. The company has now declared its 667th consecutive common stock monthly dividend, and its 31-plus consecutive years of dividend increases have earned it S&P 500 Dividend Aristocrat status. Retail investors on Reddit are enthusiastic, with a bullish sentiment score of ... Wall Street Is Lukewarm on Realty Income While Retail Piles In. What Do Analysts Know?",https://finnhub.io/api/news?id=e7d753769e3e1199d5847f198fe7fddf455b6928d67a8ecf5e071899c769428a
company,1776846600,NNN REIT: A Reliable Yield To Shield You From An Inflationary World,139847724,https://static.seekingalpha.com/cdn/s3/uploads/getty_images/2211164930/image_2211164930.jpg?io=getty-c-w1536,O,SeekingAlpha,"Explore NNN REIT (NNN): 5.27% yield, strong dividend safety, 2025 AFFO growth outlook, and discounted valuation upside.",https://finnhub.io/api/news?id=f076cdb16a07cacb8987ef7b046d5cc546d2467cce4eb0f6c1e8eb63ca9bbe36
