category,datetime,headline,id,image,related,source,summary,url
company,1776872363,Olstein Capital Sells $5.2 Million Kulicke and Soffa Stake -- Is the Semiconductor Equipment Rally Over?,139849838,https://s.yimg.com/rz/stage/p/yahoo_finance_en-US_h_p_finance_2.png,OMC,Yahoo,This semiconductor equipment maker delivers assembly and packaging solutions to electronics manufacturers across the U.S. and Asia/Pacific.,https://finnhub.io/api/news?id=a608ebb92f5eeacc4651f0303dc325ae967274ab4c6a9e4c03ffb0e791f746cf
company,1776862938,US Equity Futures Rise Pre-Bell After Trump Extends US-Iran Ceasefire,139848365,https://s.yimg.com/rz/stage/p/yahoo_finance_en-US_h_p_finance_2.png,OMC,Yahoo,US equity futures were rising pre-bell Wednesday after President Donald Trump extended the ceasefire,https://finnhub.io/api/news?id=21ea255fccb1f511707600d3aa5194b46eac920641198c501564af3fd30fff3d
company,1776848868,How The Investment Story For Omnicom Group (OMC) Is Shifting After Recent Analyst Revisions,139846194,https://s.yimg.com/rz/stage/p/yahoo_finance_en-US_h_p_finance_2.png,OMC,Yahoo,"Recent price target moves on Omnicom Group range from Citi lifting its view to US$115 from US$103 to more cautious cuts such as US$82 from US$88, with several Equal Weight calls around US$90. These changes reflect a split narrative, where some analysts point to programmatic audit outcomes and media review results as support for higher targets, while others focus on execution risk and limited upside. As you read on, you will see how these shifting targets fit into the evolving story around...",https://finnhub.io/api/news?id=53174de8e1d1bcd07680e2323bf2e389975537239143d2ade12a850775a47dd9
company,1776841593,Adobe Buyback And AI Partnerships Reframe Enterprise Growth Opportunity,139845204,https://s.yimg.com/rz/stage/p/yahoo_finance_en-US_h_p_finance_2.png,OMC,Yahoo,"Adobe (NasdaqGS:ADBE) approved a new US$25b share repurchase authorization, running through 2030. The company announced new AI driven marketing partnerships with DICK'S Sporting Goods and Xfinity at its 2026 Summit. Adobe also expanded relationships with Omnicom and IBM to develop vertical specific AI agent solutions for enterprises. Adobe, best known for Creative Cloud and Experience Cloud, is leaning deeper into AI for marketing and content production as large enterprises look to automate...",https://finnhub.io/api/news?id=3cfcba31fb84b73816e34658398b963c514d1fb9d5a73df11911aaf7226013cc
company,1776825904,What Does This Latest Adobe Practice Launch Mean for Omnicom Group (OMC),139843853,https://s.yimg.com/rz/stage/p/yahoo_finance_en-US_h_p_finance_2.png,OMC,Yahoo,"Omnicom Group Inc. (NYSE:OMC) is one of the 8 best advertising agency stocks to buy according to hedge funds. On April 1, Omnicom Group Inc. (NYSE:OMC) announced that its consultancy for transformation, Credera, has launched an Adobe practice with a view to catering to the needs of enterprise businesses. Nik DeBenedetto, who once worked as […]",https://finnhub.io/api/news?id=5f0735bb2fe471d13ce8bfec62c2037a0c3f70dfc9bd259b624ec17a7ea7a2bb
