category,datetime,headline,id,image,related,source,summary,url
company,1779798230,Lithium Miners News For The Month Of May 2026,140421670,https://static.seekingalpha.com/cdn/s3/uploads/getty_images/1570062156/image_1570062156.jpg?io=getty-c-w1536,A,SeekingAlpha,China lithium prices edge up; supply risks and miner profits surge. Read this month's news roundup for lithium miners here.,https://finnhub.io/api/news?id=b7c4053d78dc8d5d6d23d6a04aa1592d7e49593fb84f9d6104c3ba4be47595c8
company,1779796800,Agilent Launches Multi-Attribute Method (MAM) Solution for BioPharma Quality Control,140420461,https://s.yimg.com/rz/stage/p/yahoo_finance_en-US_h_p_finance_2.png,A,Yahoo,"SANTA CLARA, Calif., May 26, 2026--Agilent Technologies Inc. (NYSE: A) today announced the release of a new multi-attribute method (MAM) workflow designed to help pharmaceutical and biopharmaceutical quality control (QC) laboratories implement liquid chromatography high-resolution mass spectrometry (LC/HRMS) in routine, regulated testing environments.",https://finnhub.io/api/news?id=c5e6d22525d3003dddd342ebe1cb1ce4c0669c5f378970791825af5ad74fed66
company,1779796800,Agilent Launches New GC Systems with GC Assist to Improve Laboratory Efficiency and Data Quality,140420460,https://s.yimg.com/rz/stage/p/yahoo_finance_en-US_h_p_finance_2.png,A,Yahoo,"SANTA CLARA, Calif., May 26, 2026--Agilent Technologies Inc. (NYSE: A) today announced the launch of the new 8890B GC and 8860B GC with GC Assist. GC Assist is the new, advanced instrument intelligence that provides system monitoring, built-in troubleshooting, and remote connectivity to analytical instrumentation within the laboratory’s secure network. These systems enable higher performance and productivity across gas chromatography analyses.",https://finnhub.io/api/news?id=efe7744f79b7808990024993cf85ced1152ef278f35ef78397b0508ffaf5bab9
company,1779786566,CrowdStrike To Rally Over 15%? Here Are 10 Top Analyst Forecasts For Tuesday,140420932,https://cdn.benzinga.com/files/images/story/2026/05/26/9--CrowdStrike-Holdings-Inc-.jpeg?width=2048&height=1536,A,Benzinga,"Wall Street analysts changed outlook on top names. Guggenheim raised price target for IMVT, Piper Sandler increased price target for TRV, and more.",https://finnhub.io/api/news?id=a1f1ec09420e0b136e5e8858987c693b3869746ae841cf58c0723460c26f1eae
company,1779782892,Agilent Technologies Rolls Out New Multi-Attribute Method Workflow,140422137,,A,Benzinga,Agilent Technologies Inc. (NYSE:A) today announced the release of a new multi-attribute method (MAM) workflow designed to help pharmaceutical and biopharmaceutical quality control (QC) laboratories implement liquid,https://finnhub.io/api/news?id=6b7f1e29937534b143a1122a0d01a124cebb945738cd07922299ac869a6fb702
company,1779778492,"Baird Maintains Outperform on Agilent Technologies, Raises Price Target to $156",140422138,,A,Benzinga,Baird  analyst Catherine Schulte   maintains Agilent Technologies (NYSE:A) with a Outperform and raises the price target from $155 to $156.,https://finnhub.io/api/news?id=167fc2555d4e4a96ad0c4b1b2d398f7c89c24ea6b7f713cd6bdc6d08db9c5743
company,1779767330,What To Expect From Agilent’s (A) Q1 Earnings,140417303,https://s.yimg.com/rz/stage/p/yahoo_finance_en-US_h_p_finance_2.png,A,Yahoo,Life sciences tools company Agilent Technologies (NYSE:A) will be reporting results this Wednesday after the bell. Here’s what investors should know.,https://finnhub.io/api/news?id=462438b6a1e900ce7da0cd2585b9053d99b47d67b7e44b91f33aa0a8b3deddc4
