category,datetime,headline,id,image,related,source,summary,url
company,1779803520,Boston Scientific Bets on WATCHMAN to Drive Structural Heart Growth,140421360,https://s.yimg.com/rz/stage/p/yahoo_finance_en-US_h_p_finance_2.png,ABT,Yahoo,WATCHMAN's 19% growth and trial wins bolster Boston Scientific's push to expand its addressable market from 5M to 20M patients worldwide.,https://finnhub.io/api/news?id=4358c892fd347501b4ba3e6622312d82e3240889009e6556dddf58becea1195a
company,1779800400,Abbott showcases expanding evidence across its cancer diagnostics portfolio at ASCO 2026,140420332,https://s.yimg.com/rz/stage/p/yahoo_finance_en-US_h_p_finance_2.png,ABT,Yahoo,"Abbott (NYSE: ABT) will present 11 abstracts featuring new evidence across the cancer care continuum at the American Society of Clinical Oncology (ASCO) Annual Meeting, taking place May 29 – June 2, 2026, in Chicago. The presentations showcase the breadth of Abbott's integrated cancer diagnostics portfolio and demonstrate how its tests support critical decision points—from identifying risk and detecting disease earlier to guiding treatment and monitoring for recurrence.",https://finnhub.io/api/news?id=1707501fd360c76b56047210b0f1fd4954237bf3d01cf42587700b5a0c96f845
company,1779796297,Abbott Laboratories (ABT) Slid on Headwinds in Nutrition Business,140420333,https://s.yimg.com/rz/stage/p/yahoo_finance_en-US_h_p_finance_2.png,ABT,Yahoo,"Diamond Hill Capital, a First Eagle Investment Management company, issued its Q1 2026 investor letter for its “Large Cap Strategy”. A copy of the letter is available to download here. The Strategy declined 2.39% (net of fees), trailing the Russell 1000 Value Index’s 2.10%. The performance was positively affected by stock selection in industrials and consumer discretionary, along […]",https://finnhub.io/api/news?id=109e355e8d7d0640f2b1f3518e4b53c2cac771713bb44e44d8f18941b1aea694
company,1779786458,Abbott To Present 11 New Abstracts Across Cancer Care Continuum At American Society Of Clinical Oncology Annual Meeting,140421645,,ABT,Benzinga,"Abbott (NYSE:ABT) will present 11 abstracts featuring new evidence across the cancer care continuum at the American Society of Clinical Oncology (ASCO) Annual Meeting, taking place May 29 – June 2, 2026, in Chicago. The",https://finnhub.io/api/news?id=7d27bd95189dab9fbb8125482441de767f20f45291b40c9a1adcdd4e43e05c02
company,1779765063,"Anthony Pompliano Says The Cheaper Stocks Become, The More People Yell 'Bubble'",140421646,https://cdn.benzinga.com/files/images/story/2026/05/26/Close-Up-Crop-Soap-Bubbles-On-Forefront-.jpeg?width=2048&height=1536,ABT,Benzinga,"Anthony Pompliano pushed back against bubble fears, arguing that current stock valuations remain far below the extremes seen during the dot-com era despite the market&#39;s record rally.",https://finnhub.io/api/news?id=02acb993a45a466643f7eedc941e71c0585ed509646c7345d96d95b4e50d2332
company,1779764029,Best Dividend Kings: May 2026,140418297,https://static.seekingalpha.com/cdn/s3/uploads/getty_images/2248559295/image_2248559295.jpg?io=getty-c-w1536,ABT,SeekingAlpha,"Dividend growth among Kings accelerated to 3.71%, with notable increases from W.W. Grainger, Parker-Hannifin, and RLI Corp. Read more on Dividend Kings here.",https://finnhub.io/api/news?id=cd99a191430536645179e46920a19163c3899aaecd256f9688e0d9c09439d695
