category,datetime,headline,id,image,related,source,summary,url
company,1779833845,Bristol Myers Squibb ASCO Data Puts Oncology Pipeline In Investor Focus,140427343,https://s.yimg.com/rz/stage/p/yahoo_finance_en-US_h_p_finance_2.png,BMY,Yahoo,"Bristol-Myers Squibb (NYSE:BMY) plans to present extensive new clinical data at the 2026 ASCO Annual Meeting. The company will share more than 60 scientific disclosures, including 19 oral presentations across oncology programs. Late-breaking Phase 3 data, including SUCCESSOR-2 for mezigdomide and izalontamab brengitecan, will be highlighted. The updates cover multiple myeloma, lymphoma, breast and lung cancers, and several emerging oncology mechanisms. For investors tracking NYSE:BMY, this...",https://finnhub.io/api/news?id=378f5873c6286324604088091dd946810d19567d091502fe5bab115fa52420bb
company,1779813754,Thinning revenues: inside the $14bn Eliquis patent cliff,140422795,https://s.yimg.com/rz/stage/p/yahoo_finance_en-US_h_p_finance_2.png,BMY,Yahoo,"With $14.2bn in projected revenue losses over six years, the Eliquis loss-of-exclusivity event is set to become one of the most consequential patent cliffs in pharmaceutical history — and a stark illustration of how quickly generic entry can dismantle even the industry's most entrenched brands.",https://finnhub.io/api/news?id=cfc13150eba946e5635581e763dde1f2a48b71a71cf10e3da5bfd339df48d09b
company,1779813060,How Agenus' Pipeline Progress Unlock Its Next Growth Phase,140422730,https://s.yimg.com/rz/stage/p/yahoo_finance_en-US_h_p_finance_2.png,BMY,Yahoo,AGEN advances BOT/BAL into phase III for MSS colorectal cancer as survival data and global access efforts shape its next growth phase.,https://finnhub.io/api/news?id=cd79e3b7298a110228b485e8baa18dd458b71cf2c20d6d08e9ef3c76365f68c1
company,1779809280,Here's Why You Should Add JANX Stock to Your Portfolio Now,140422731,https://s.yimg.com/rz/stage/p/yahoo_finance_en-US_h_p_finance_2.png,BMY,Yahoo,"Janux Therapeutics advances multiple oncology and immune therapy programs with key clinical updates, new studies and expanded partnerships with BMY and MRK.",https://finnhub.io/api/news?id=f0d97bab286800b5bd4c9c82da9ecd9dac9cbfc654d7115f38d1efad4d43b27b
company,1779802803,Here's Why Bristol Myers Squibb (BMY) is a Strong Value Stock,140422817,https://s.yimg.com/rz/stage/p/yahoo_finance_en-US_h_p_finance_2.png,BMY,Yahoo,"Wondering how to pick strong, market-beating stocks for your investment portfolio? Look no further than the Zacks Style Scores.",https://finnhub.io/api/news?id=6a9854ddf8a578b3c766be0c1050d7af3156894fa16ad57fbec82da35c514757
