category,datetime,headline,id,image,related,source,summary,url
company,1779837903,My Dividend Stock Portfolio: New April Dividend Record - 100 Holdings With 5 Buys,140428960,https://static.seekingalpha.com/cdn/s3/uploads/getty_images/1213764535/image_1213764535.jpg?io=getty-c-w1536,BX,SeekingAlpha,April net investment activity reached a multi-year low. Read what prompted a cautious approach and check out the dividend portfolio here.,https://finnhub.io/api/news?id=ff16c6fa1c12ce27bb41bdcfe4a2660e2f2d3947f09ba109ccf8944ceed7160b
company,1779824791,SpaceX & Beyond – Public & Private Capital Markets Assessment: 2nd Princeton CorpGov Forum,140424383,https://s.yimg.com/rz/stage/p/yahoo_finance_en-US_h_p_finance_2.png,BX,Yahoo,"Watch Video of the Panel Below, or Click HERE: CorpGov hosted the second Princeton CorpGov Forum on May 21, 2026, at The Nassau Inn in Princeton, New Jersey. Speakers featured industry leaders and alumni spanning five decades at Princeton, and topics comprised university endowments, shareholder activism, private equity, venture capital, private and public capital markets, […]",https://finnhub.io/api/news?id=ec0745c7b82c479ffc6cee087acacd2e7e786a823641f86d0b23e4006b927b30
company,1779824594,The NIL Effect – Finance of Sports: Collegiate Focus: 2nd Princeton CorpGov Forum,140426054,https://s.yimg.com/rz/stage/p/yahoo_finance_en-US_h_p_finance_2.png,BX,Yahoo,"Watch Video of the Panel Below, or Click HERE: CorpGov hosted the second Princeton CorpGov Forum on May 21, 2026, at The Nassau Inn in Princeton, New Jersey. Speakers featured industry leaders and alumni spanning five decades at Princeton, and topics comprised university endowments, shareholder activism, private equity, venture capital, private and public capital markets, […] The post The NIL Effect – Finance of Sports: Collegiate Focus: 2nd Princeton CorpGov Forum appeared first on CorpGov.",https://finnhub.io/api/news?id=9493fb554e3a9d5750727f59e28a2568889f194221cdcf44ed91b8e48d5f3436
company,1779823247,The 5% Debate – Endowments & Long-Term Investing: 2nd Princeton CorpGov Forum,140426055,https://s.yimg.com/rz/stage/p/yahoo_finance_en-US_h_p_finance_2.png,BX,Yahoo,"Watch Video of the Panel Below, or Click HERE: CorpGov hosted the second Princeton CorpGov Forum on May 21, 2026, at The Nassau Inn in Princeton, New Jersey. Speakers featured industry leaders and alumni spanning five decades at Princeton, and topics comprised university endowments, shareholder activism, private equity, venture capital, private and public capital markets, […] The post The 5% Debate – Endowments & Long-Term Investing: 2nd Princeton CorpGov Forum appeared first on CorpGov.",https://finnhub.io/api/news?id=82919b0f1c2315cbacd5f2376a332030ecba1cdb2948a50e891ee372c20e3470
company,1779820746,What Betamax Teaches Us About AI – The Business of Entertainment: 2nd Princeton CorpGov Forum,140426056,https://s.yimg.com/rz/stage/p/yahoo_finance_en-US_h_p_finance_2.png,BX,Yahoo,"Watch Video of the Panel Below, or Click HERE: CorpGov hosted the second Princeton CorpGov Forum on May 21, 2026, at The Nassau Inn in Princeton, New Jersey. Speakers featured industry leaders and alumni spanning five decades at Princeton, and topics comprised university endowments, shareholder activism, private equity, venture capital, private and public capital markets, […] The post What Betamax Teaches Us About AI – The Business of Entertainment: 2nd Princeton CorpGov Forum appeared first on",https://finnhub.io/api/news?id=c5359cddeacdb9d38f34eecdaafd44210436b3b74d8174642dda2b86e3b8dced
company,1779804900,Beyond Dividends: Jussi Askola's REIT Playbook For Total Return,140423186,,BX,SeekingAlpha,,https://finnhub.io/api/news?id=d46e408662fc2997ca52de67d72f4821ed7087e685419bb044279bafdba7f491
company,1779779700,3 REITs To Sell Before They Cut Their Dividends,140419279,https://static.seekingalpha.com/cdn/s3/uploads/getty_images/2264793589/image_2264793589.jpg?io=getty-c-w1536,BX,SeekingAlpha,It is critical to avoid future dividend cutters while investing in REITs. Check out three REIT stocks that I would sell before they cut their dividend.,https://finnhub.io/api/news?id=b0ae0c35559432f794275b2cf06b762b91d174173178049d87116f79ff52ac54
