category,datetime,headline,id,image,related,source,summary,url
company,1779827597,Synopsys Is the ‘Growth Trap’ Your Advisor Won’t Warn You About,140425947,https://s.yimg.com/rz/stage/p/yahoo_finance_en-US_h_p_finance_2.png,CDNS,Yahoo,"The bear case on SNPS is structural. Synopsys (NASDAQ:SNPS) gets lumped in with the AI hardware winners because it sells the software that designs the chips. The narrative is clean. The financial model is something else entirely. Synopsys sits inside a duopoly with Cadence (NASDAQ:CDNS) in electronic design automation, plus a semiconductor IP catalog. It also ... Synopsys Is the ‘Growth Trap’ Your Advisor Won’t Warn You About",https://finnhub.io/api/news?id=fce8250a1f25b545c425bc3e342b129b4512303bbeecb22623fec20a4a81bcdf
company,1779826800,Cadence’s Anirudh Devgan to Present at BofA Conference,140426130,https://s.yimg.com/rz/stage/p/yahoo_finance_en-US_h_p_finance_2.png,CDNS,Yahoo,"SAN JOSE, Calif., May 26, 2026--Cadence’s Anirudh Devgan to Present at BofA Conference",https://finnhub.io/api/news?id=65e66b1eee96d36868b465854abda0ae03e4cef36e5b1fcb53e6dfdfbbbfe9dd
company,1779798801,Here's How Much $1000 Invested In Cadence Design Systems 5 Years Ago Would Be Worth Today,140436215,,CDNS,Benzinga, ,https://finnhub.io/api/news?id=695bcdf49ee5ebbf89b85eba2b05840c8449f85cb6d826940b80831ee843e950
company,1779794486,"The AI Bubble That Isn't: Why Nvidia, Micron Still Look Cheap",140421589,https://cdn.benzinga.com/files/images/story/2026/05/26/Micron-Technology-Logo-Displayed-On-A-Mo_2.jpeg?width=2048&height=1536,CDNS,Benzinga,"BofA says company fundamentals do not support the semiconductor bubble narrative. Nvidia, Micron and Credo trade below historical P/E.",https://finnhub.io/api/news?id=95534efdc1806eb9bac19c03cd459dd69e21b60b9ac8412d1f66df63b08d02e5
company,1779789243,"Wells Fargo Maintains Overweight on Cadence Design Systems, Raises Price Target to $425",140421590,,CDNS,Benzinga,Wells Fargo  analyst Joe Quatrochi   maintains Cadence Design Systems (NASDAQ:CDNS) with a Overweight and raises the price target from $400 to $425.,https://finnhub.io/api/news?id=d78069055307cb64cf260d5794bdc69d90fbd4a4cac7a9da58a0a8a09e1ffcea
