category,datetime,headline,id,image,related,source,summary,url
company,1779837903,My Dividend Stock Portfolio: New April Dividend Record - 100 Holdings With 5 Buys,140428960,https://static.seekingalpha.com/cdn/s3/uploads/getty_images/1213764535/image_1213764535.jpg?io=getty-c-w1536,CVS,SeekingAlpha,April net investment activity reached a multi-year low. Read what prompted a cautious approach and check out the dividend portfolio here.,https://finnhub.io/api/news?id=ff16c6fa1c12ce27bb41bdcfe4a2660e2f2d3947f09ba109ccf8944ceed7160b
company,1779827958,Stocks Finish Mostly Higher on Iran Peace Progress,140429485,https://s.yimg.com/rz/stage/p/yahoo_finance_en-US_h_p_finance_2.png,CVS,Yahoo,"The S&P 500 Index ($SPX ) (SPY ) on Tuesday closed up +0.61%, the Dow Jones Industrial Average ($DOWI ) (DIA ) closed down -0.23%, and the Nasdaq 100 Index ($IUXX ) (QQQ ) closed up +1.76%. June E-mini S&P futures (ESM26 ) rose +0.61%, and June E-mini Nasdaq futures...",https://finnhub.io/api/news?id=5f2613d75eb06dea81fb17d1dca0dc03715b5a3ef379ed16866bdd721e0e13c4
company,1779808320,S&P 500 and Nasdaq 100 Climb to Record Highs on Tech Stock Strength,140426018,https://s.yimg.com/rz/stage/p/yahoo_finance_en-US_h_p_finance_2.png,CVS,Yahoo,"The S&P 500 Index ($SPX ) (SPY ) today is up +0.81%, the Dow Jones Industrial Average ($DOWI ) (DIA ) is down -0.10%, and the Nasdaq 100 Index ($IUXX ) (QQQ ) is up +1.74%. June E-mini S&P futures (ESM26 ) are up +0.77%, and June E-mini Nasdaq futures...",https://finnhub.io/api/news?id=b89c95c93a3e4a64c9853e8bf11220b0b47779f86b253caeaab2186816ad7316
company,1779800400,MinuteClinic(R) and Hartford HealthCare Expand Primary Care Access Across Connecticut,140420357,https://s.yimg.com/rz/stage/p/yahoo_finance_en-US_h_p_finance_2.png,CVS,Yahoo,"Hartford HealthCare becomes one of the first clinically integrated networks in the region to include MinuteClinic as an in-network primary care option HARTFORD, CT / ACCESS Newswire / May 26, 2026 /Originally published on CVS Health Company News MinuteClinic®, ...",https://finnhub.io/api/news?id=a9ed2c76004f1c4d049dd237b3f9e5d20f890f076a473c9889662364bda84554
company,1779800400,Aetna reduces claims processing time by more than 20% with AI to improve care experience,140420356,https://s.yimg.com/rz/stage/p/yahoo_finance_en-US_h_p_finance_2.png,CVS,Yahoo,"Aetna®, a CVS Health® company (NYSE: CVS), today announced the launch of the second generation Aetna Claims Assist Manager (CAM), an AI-powered agentic claims advisor platform designed to streamline claims processing and improve payment accuracy.",https://finnhub.io/api/news?id=22afc7f965825127684b2f1936366b1da8900e168d44913b14bc2e0cf026b698
company,1779799396,Here’s What Analysts Are Saying About CVS Health Corporation (CVS),140420358,https://s.yimg.com/rz/stage/p/yahoo_finance_en-US_h_p_finance_2.png,CVS,Yahoo,"CVS Health Corporation (NYSE:CVS) is one of the best medical stocks to invest in according to billionaires. Morgan Stanley lifted the price target on CVS Health Corporation (NYSE:CVS) to $106 from $93 on May 14, maintaining an Overweight rating on the shares. CVS Health Corporation (NYSE:CVS) also received a rating update from Bernstein on May 13, […]",https://finnhub.io/api/news?id=9c5e44ceb90c21e32a35785afc73d46c47e7443475d9b89f804dbcf191879193
