category,datetime,headline,id,image,related,source,summary,url
company,1779799560,4 Diversified Chemical Stocks to Gain From Demand Rebound,140420408,https://s.yimg.com/rz/stage/p/yahoo_finance_en-US_h_p_finance_2.png,DOW,Yahoo,"The Zacks Chemicals Diversified industry is expected to benefit from an uptick in demand across major end-use markets and the end of destocking activities. APD, DOW, ALB and MEOH are set to gain from strategic actions and demand recovery.",https://finnhub.io/api/news?id=160ec9bf8ba44aba87ad3d8cf97c07eed5296287b7ab70d61185a0123d8edfb4
company,1779795000,"[Latest] Global Specialty Chemicals Market Size/Share Worth USD 1497 Billion by 2035 at a 5.2% CAGR: Custom Market Insights (Analysis, Outlook, Leaders, Report, Trends, Forecast, Segmentation, Growth Rate, Value, SWOT Analysis)",140419606,https://s.yimg.com/rz/stage/p/yahoo_finance_en-US_h_p_finance_2.png,DOW,Yahoo,"[220+ Pages Latest Report] According to a market research study published by Custom Market Insights, the demand analysis of Global Specialty Chemicals Market size & share revenue was valued at approximately USD 902 Billion in 2025 and is expected to reach USD 949 Billion in 2026 and is expected to reach around USD 1497 Billion by 2035, at a CAGR of 5.2% between 2026 and 2035. The key market players listed in the report with their sales, revenues and strategies are Lanxess AG, Arkema S.A., Asahi",https://finnhub.io/api/news?id=011ecb7c7a2e830c8e340593af042cde660c3e1f40fca98a8045ca1654fe541b
company,1779792000,Univar Solutions Strengthens Strategic Partnership with Dow for Silicone Additives in EMEA,140419607,https://s.yimg.com/rz/stage/p/yahoo_finance_en-US_h_p_finance_2.png,DOW,Yahoo,"Univar Solutions B.V., a subsidiary of Univar Solutions LLC (""Univar Solutions"" or ""The Company""), a leading global solutions provider of specialty ingredients and chemicals, today announced that its Ingredients + Specialties from Univar Solutions segment has expanded its long–standing strategic partnership with Dow (NYSE: DOW). Under the new agreement, the Company will distribute Dow's silicone additives for plastics and composites throughout Europe, the Middle East, and Africa (EMEA)*.",https://finnhub.io/api/news?id=4927e9e57a7a8ba98232235774b580866baefbfbcdaaa22d5370e794834b9c16
company,1779782400,Eastman Chemical: Riding The Cycles To Shareholder Returns,140419647,https://static.seekingalpha.com/cdn/s3/uploads/getty_images/1178658788/image_1178658788.jpg?io=getty-c-w1536,DOW,SeekingAlpha,"Eastman Chemical Company stands out as the top-quality option in the cyclical chemical sector, offering resilient dividend growth. Read why EMN stock is a Buy.",https://finnhub.io/api/news?id=d256f891c14003ebd67b40560de1ef2c9ab414cf4881a7de9eeb7fe408677fbc
company,1779780000,3 Blue Chip Dividend Stocks to Buy in June as the Dow Jones Industrial Average Turns 130,140418479,https://s.yimg.com/rz/stage/p/yahoo_finance_en-US_h_p_finance_2.png,DOW,Yahoo,"The Dow is no longer dominated by industrial, energy, manufacturing, and consumer goods companies.",https://finnhub.io/api/news?id=033ee5053bd5fcab3275af378c0f026c1f9286457cd796789afc4b094a0db26a
company,1779777776,Univar Solutions' Ingredients + Specialties Segment Expands Strategic Partnership To Distribute Dow's Silicone Additives For Plastics And Composites Throughout EMEA,140423651,,DOW,Benzinga,"Advanced silicone technologies to enhance performance, processing, and sustainability for plastics and composites manufacturersESSEN, Germany, May 26, 2026 /PRNewswire/ -- Univar Solutions B.V., a subsidiary of Univar",https://finnhub.io/api/news?id=c4209d60723e39b03dbfcd5a3c6ab3c42c6aa215eb36f31cc3d0760874df73c9
