category,datetime,headline,id,image,related,source,summary,url
company,1779834208,"MYR Group and Tutor Perini Shares Are Soaring, What You Need To Know",140427324,https://s.yimg.com/rz/stage/p/yahoo_finance_en-US_h_p_finance_2.png,EME,Yahoo,A number of stocks jumped in the afternoon session after WTI oil fell 4.7% and Treasury yields declined on Iran-US peace progress.,https://finnhub.io/api/news?id=bf06595ef98b2e2b8543b610300a6c987a855bcf01132e8956585cc3850b0a95
company,1779834208,"Limbach and Primoris Shares Are Soaring, What You Need To Know",140427346,https://s.yimg.com/rz/stage/p/yahoo_finance_en-US_h_p_finance_2.png,EME,Yahoo,A number of stocks jumped in the afternoon session after WTI oil fell 4.7% and Treasury yields declined on Iran-US peace progress.,https://finnhub.io/api/news?id=a51a678e1514061ad4961fe8b346b7521b8acf3014229bcfd049f9a1f4b977b9
company,1779815315,Is It Too Late To Consider EMCOR Group (EME) After Its Strong Multi Year Rally?,140422901,https://s.yimg.com/rz/stage/p/yahoo_finance_en-US_h_p_finance_2.png,EME,Yahoo,"For investors considering whether EMCOR Group at around US$848.91 still offers value or if most of the opportunity is already priced in, this article breaks down what the numbers are really saying about the stock. The share price has eased slightly, with EMCOR Group down 0.6% over the last week and 2.4% over the last month. The stock is still up 32.9% year to date and 78.8% over the last year, with a very large 3 year return and 5 year return. Recent coverage has focused on EMCOR Group’s...",https://finnhub.io/api/news?id=fadca418b00ae82a54599e00ac88151c979c250dadbbf15ec2ede4eca1ab738b
company,1779811500,Can Sterling's $512M Cash Position Fuel New Acquisition Opportunities?,140422902,https://s.yimg.com/rz/stage/p/yahoo_finance_en-US_h_p_finance_2.png,EME,Yahoo,Can STRL's $512 million cash hoard and net-cash balance drive new acquisitions in data center and semiconductor construction?,https://finnhub.io/api/news?id=3fe33e47c6ee1b931d6ac799b6757b2dc71648acd1a0787e058fc287d100bc94
company,1779800402,"EMCOR Group, Inc. (EME) Is a Trending Stock: Facts to Know Before Betting on It",140421403,https://s.yimg.com/rz/stage/p/yahoo_finance_en-US_h_p_finance_2.png,EME,Yahoo,"Emcor Group (EME) has been one of the stocks most watched by Zacks.com users lately. So, it is worth exploring what lies ahead for the stock.",https://finnhub.io/api/news?id=02e16f2a6151fe23bdf8b9e49effe80d1e05d06d36624f7a829cd4b1310a1cc7
company,1779774010,Are Wall Street Analysts Predicting EMCOR Group Stock Will Climb or Sink?,140419600,https://s.yimg.com/rz/stage/p/yahoo_finance_en-US_h_p_finance_2.png,EME,Yahoo,"As EMCOR Group has notably outperformed the broader market over the past 52 weeks, Wall Street analysts maintain a moderately optimistic outlook about the stock’s prospects.",https://finnhub.io/api/news?id=bd9c3f813080d3458083d6d64debd58832ee8df38c9ce2286c3ae85610066041
