category,datetime,headline,id,image,related,source,summary,url
company,1779825746,Magnificent Seven Post Best Earnings In Nearly 5 Years. Sign Of A Bubble?,140425953,https://s.yimg.com/rz/stage/p/yahoo_finance_en-US_h_p_finance_2.png,FDS,Yahoo,"The Magnificent Seven's first-quarter earnings are in the books, and the seven companies registered their best profit growth in nearly five years.  All remain pillars of the S&P 500 index.  Collectively, Mag 7 earnings jumped 63.2% year over year, according to a report from FactSet.",https://finnhub.io/api/news?id=b8b62b71e0ab8fc9256ecae2f378a0644d35f78c608ebd2c8578145f04b02137
company,1779813758,"S&P 500 Companies' Quarterly Earnings, Revenue Growth Accelerates, Oppenheimer Says",140422696,https://s.yimg.com/rz/stage/p/yahoo_finance_en-US_h_p_finance_2.png,FDS,Yahoo,"S&P 500 companies' quarterly earnings and revenue growth accelerated, compared with figures from a w",https://finnhub.io/api/news?id=23da7b3b64edaf0cb489068f7a14b260f44be3c39f5b02c81c9098cedf90e3be
company,1779812880,Here's Why FactSet Stock Is a Compelling Pick for You Right Now,140422830,https://s.yimg.com/rz/stage/p/yahoo_finance_en-US_h_p_finance_2.png,FDS,Yahoo,"FDS stock rises 7% over the past three months as acquisitions, AI partnerships and rising demand for analytics fuel growth prospects.",https://finnhub.io/api/news?id=0a947d0c3b21783cb5c7f300345e2114b88754120823143eaaa848a7a0bd6736
company,1779798840,"Beat the Market the Zacks Way: ORIX, Starbucks, Alphabet in Focus",140420132,https://s.yimg.com/rz/stage/p/yahoo_finance_en-US_h_p_finance_2.png,FDS,Yahoo,"IX, SBUX and GOOGL rallied after Zacks upgrades and portfolio additions, while major indexes stayed volatile amid Fed and inflation concerns.",https://finnhub.io/api/news?id=93bff7a1c4fa81ddda253a5433ec5ed745f09ea9b0a4e84206e4b6506c49d308
company,1779790309,1 Small-Cap Stock for Long-Term Investors and 2 That Underwhelm,140419621,https://s.yimg.com/rz/stage/p/yahoo_finance_en-US_h_p_finance_2.png,FDS,Yahoo,"Investors looking for hidden gems should keep an eye on small-cap stocks because they’re frequently overlooked by Wall Street. Many opportunities exist in this part of the market, but it is also a high-risk, high-reward environment due to the lack of reliable analyst price targets.",https://finnhub.io/api/news?id=d6ba3731e149fd164253d3876cb01fce7e6955dcbdbb0c70741b250c6e1f42bf
