category,datetime,headline,id,image,related,source,summary,url
company,1779837903,My Dividend Stock Portfolio: New April Dividend Record - 100 Holdings With 5 Buys,140428960,https://static.seekingalpha.com/cdn/s3/uploads/getty_images/1213764535/image_1213764535.jpg?io=getty-c-w1536,MA,SeekingAlpha,April net investment activity reached a multi-year low. Read what prompted a cautious approach and check out the dividend portfolio here.,https://finnhub.io/api/news?id=ff16c6fa1c12ce27bb41bdcfe4a2660e2f2d3947f09ba109ccf8944ceed7160b
company,1779811882,Mastercard CTO Ed McLaughlin on Firm’s Goal to ‘Set the Stage for the Future’,140422702,https://s.yimg.com/rz/stage/p/yahoo_finance_en-US_h_p_finance_2.png,MA,Yahoo,Ed McLaughlin of Mastercard joins Ashley Mastronardi on NYSE Live to discuss firm's goal to 'Set the Stage for the Future',https://finnhub.io/api/news?id=979dfec047477aed5692a2a0e7bee8a42b47854013871470f94c3f7a511a4b5e
company,1779800400,Increase Expands Instant Payment Solutions to Include Push-to-Card Transfers,140420242,https://s.yimg.com/rz/stage/p/yahoo_finance_en-US_h_p_finance_2.png,MA,Yahoo,"NEW YORK, May 26, 2026--Increase, a modern banking core purpose-built to help technology companies store, move, and reconcile money, has expanded instant payments to include push-to-card transfers. This latest addition to the Increase platform enables companies to issue payouts, disbursements, and refunds directly to eligible Mastercard or Visa cards. The company also announced that Warren Brown has joined Increase as the General Manager of its card issuing solutions.",https://finnhub.io/api/news?id=c0776d417f4bec854009d754457558adca88212c6c09fddfb3f330c7dd1b1846
company,1779800100,NYSE Content Update: Mastercard Celebrates Two Decades as NYSE-Listed Company,140420256,https://s.yimg.com/rz/stage/p/yahoo_finance_en-US_h_p_finance_2.png,MA,Yahoo,The New York Stock Exchange (NYSE) provides a daily pre-market update directly from the NYSE Trading Floor. Access today's NYSE Pre-market update for market insights before trading begins.,https://finnhub.io/api/news?id=759742ad67086a8af1866354079b050576b80f4bb9ab60fca785d9128a391f8e
company,1779794956,"The fundamentals in the equity markets are still strong, says Neuberger’s Holly Newman Kroft",140422185,https://image.cnbcfm.com/api/v1/image/108311989-17798091321779809129-46176721322-1080pnbcnews.jpg?v=1779809131&w=1920&h=1080,MA,CNBC,"Holly Newman Kroft, managing director at Neuberger Berman Private Wealth, joins CNBC’s ‘Squawk on the Street’ to discuss what’s dominating conversations with her clients, her advice to investors, and more.",https://finnhub.io/api/news?id=7e27e401b146a04d1ff9c65d1fe39680fadd9f7b90f34b20e0671d3a36d44ae0
company,1779791699,Mastercard CEO Michael Miebach: Overall spending trends in the Middle East remain solid,140422198,https://image.cnbcfm.com/api/v1/image/108311917-17798058741779805872-46176001604-1080pnbcnews.jpg?v=1779805873&w=1920&h=1080,MA,CNBC,"Mastercard CEO Michael Miebach joins 'Squawk on the Street' to discuss the 20th anniversary of its IPO, the trends he is seeing in consumer spending, whether the Iran war has impacted its business, and more.",https://finnhub.io/api/news?id=24b8c07eb9cf2f34683d18cfbae0d070418db0e8bf7a9d06a77b6966140e7717
company,1779788680,"Opening Bell: May 26, 2026",140422211,https://image.cnbcfm.com/api/v1/image/108311890-17798028361779802833-46175335248-1080pnbcnews.jpg?v=1779802835&w=1920&h=1080,MA,CNBC,"Watch the opening bell for the New York Stock Exchange, the Nasdaq and Cboe from May 26, 2026.",https://finnhub.io/api/news?id=5af3181b0e90c0cd62924dd359906ba657880607855b7ee5c111fa12f3a2c3a5
