category,datetime,headline,id,image,related,source,summary,url
company,1779837903,My Dividend Stock Portfolio: New April Dividend Record - 100 Holdings With 5 Buys,140428960,https://static.seekingalpha.com/cdn/s3/uploads/getty_images/1213764535/image_1213764535.jpg?io=getty-c-w1536,MCD,SeekingAlpha,April net investment activity reached a multi-year low. Read what prompted a cautious approach and check out the dividend portfolio here.,https://finnhub.io/api/news?id=ff16c6fa1c12ce27bb41bdcfe4a2660e2f2d3947f09ba109ccf8944ceed7160b
company,1779827579,McDonald’s can’t meet its 2030 emissions targets,140426093,https://s.yimg.com/rz/stage/p/yahoo_finance_en-US_h_p_finance_2.png,MCD,Yahoo,"The fast-food chain also fell short of a packaging goal, citing events beyond its control, but plans to keep long-term targets",https://finnhub.io/api/news?id=fa7177e7304bc8eccb59638c1274d21317fbd5536cea97c45cc908f892356ac2
company,1779822601,Stay informed with the top movers within the dow jones index on Tuesday.,140423866,https://www.chartmill.com/images/uploads/CM_Top_Movers_Small_free_2b4ff2fc22.webp,MCD,ChartMill,Stay updated with the movement of dow jones stocks in today's session. Discover which dow jones stocks are making waves on Tuesday.,https://finnhub.io/api/news?id=55e94b72a3ea22cf4da6731b84661fe5d26aa3d6a8706499fbc47931158ffe58
company,1779782400,McDonald's expands in Ukraine; Penetron technology helps protect concrete,140418997,https://s.yimg.com/rz/stage/p/yahoo_finance_en-US_h_p_finance_2.png,MCD,Yahoo,"McDonald's opened its newest restaurants in Kyiv and Lviv. Kyiv, in north-central Ukraine along the Dnieper River, is the capital and largest city, with a population of 2.9 million and a metropolitan area of more than 5 million. It is an important industrial, scientific and educational center for Eastern Europe. Lviv is the largest city in western Ukraine, with a population of 717,500, and is one of the country's key cultural centers. With many companies relocating from eastern Ukraine, it also",https://finnhub.io/api/news?id=5b30d4526d59c08ce6d334147119cfe1520a3cbf2cbc005ad8c150c95f32f9c2
company,1779779520,"Eight Weeks and Counting: Wall Street Returns With a New Fed Chair, Cheaper Oil, and More Questions Than Answers",140418529,https://www.chartmill.com/images/uploads/THUMBNAILS_CHARTMILL_1000_528_63_6dce0f387b.webp,MCD,ChartMill,"Eight consecutive weekly gains. A new Federal Reserve chair sworn in at the White House. Oil futures down 6% over the holiday weekend on Iran deal signals that nobody quite believes yet. Tuesday's open carries more storylines than most, here's what you need to know before the bell rings.",https://finnhub.io/api/news?id=e10e5b2ced5fec6ee11af380740506a4e2684340ba6e5e982e15b0eac9107aec
