category,datetime,headline,id,image,related,source,summary,url
company,1779828928,"Norwegian Cruise Line and Delta Shares Skyrocket, What You Need To Know",140426184,https://s.yimg.com/rz/stage/p/yahoo_finance_en-US_h_p_finance_2.png,NCLH,Yahoo,"A number of stocks jumped in the afternoon session after WTI crude crashed 4.7% to $92.94 on Iran-US peace deal progress, providing direct relief to airlines, hotels, cruise lines, and online travel agents.",https://finnhub.io/api/news?id=5ee24827b9c8cd1ca2f8aa09cd034cc03464d1d2bf8651e2cce5c6a3ea4600be
company,1779827958,Stocks Finish Mostly Higher on Iran Peace Progress,140429485,https://s.yimg.com/rz/stage/p/yahoo_finance_en-US_h_p_finance_2.png,NCLH,Yahoo,"The S&P 500 Index ($SPX ) (SPY ) on Tuesday closed up +0.61%, the Dow Jones Industrial Average ($DOWI ) (DIA ) closed down -0.23%, and the Nasdaq 100 Index ($IUXX ) (QQQ ) closed up +1.76%. June E-mini S&P futures (ESM26 ) rose +0.61%, and June E-mini Nasdaq futures...",https://finnhub.io/api/news?id=5f2613d75eb06dea81fb17d1dca0dc03715b5a3ef379ed16866bdd721e0e13c4
company,1779808320,S&P 500 and Nasdaq 100 Climb to Record Highs on Tech Stock Strength,140426018,https://s.yimg.com/rz/stage/p/yahoo_finance_en-US_h_p_finance_2.png,NCLH,Yahoo,"The S&P 500 Index ($SPX ) (SPY ) today is up +0.81%, the Dow Jones Industrial Average ($DOWI ) (DIA ) is down -0.10%, and the Nasdaq 100 Index ($IUXX ) (QQQ ) is up +1.74%. June E-mini S&P futures (ESM26 ) are up +0.77%, and June E-mini Nasdaq futures...",https://finnhub.io/api/news?id=b89c95c93a3e4a64c9853e8bf11220b0b47779f86b253caeaab2186816ad7316
company,1779804588,Stocks Jump on US-Iran Peace Optimism,140424988,https://s.yimg.com/rz/stage/p/yahoo_finance_en-US_h_p_finance_2.png,NCLH,Yahoo,"The S&P 500 Index ($SPX ) (SPY ) today is up +0.72%, the Dow Jones Industrial Average ($DOWI ) (DIA ) is up +0.31%, and the Nasdaq 100 Index ($IUXX ) (QQQ ) is up +1.42%. June E-mini S&P futures (ESM26 ) are up +0.62%, and June E-mini Nasdaq futures...",https://finnhub.io/api/news?id=4a5cb956b25fe4aeca9356205a975c58ad2c709311bc4fe36a667e3edff06f46
company,1779802539,10 Consumer Discretionary Stocks With Whale Alerts In Today's Session,140423653,https://cdn.benzinga.com/files/images/story/2025/11/06/aggregated_options_1.jpg?width=2048&height=1536,NCLH,Benzinga, ,https://finnhub.io/api/news?id=b4f3239a4d885cb5243297f61c9b31eb7ce7fa8f5dfd54e90d1faf6939a09e7d
