category,datetime,headline,id,image,related,source,summary,url
company,1779837903,My Dividend Stock Portfolio: New April Dividend Record - 100 Holdings With 5 Buys,140428960,https://static.seekingalpha.com/cdn/s3/uploads/getty_images/1213764535/image_1213764535.jpg?io=getty-c-w1536,O,SeekingAlpha,April net investment activity reached a multi-year low. Read what prompted a cautious approach and check out the dividend portfolio here.,https://finnhub.io/api/news?id=ff16c6fa1c12ce27bb41bdcfe4a2660e2f2d3947f09ba109ccf8944ceed7160b
company,1779815446,Overlooked High-Yielding Elite Dividend Growth Machines,140425396,https://static.seekingalpha.com/cdn/s3/uploads/getty_images/1354371707/image_1354371707.jpg?io=getty-c-w1536,O,SeekingAlpha,The five non-negotiable criteria for identifying high-yielding stocks that are also elite dividend growers and the top picks. Read the full analysis here.,https://finnhub.io/api/news?id=92999347aecd8694e5f31a842aa0dea838325cd27d1d4c0a7b3e678ed32ef12a
company,1779811920,"Realty Income's Scale Test: Can 15,571 Properties Cushion the Business?",140422868,https://s.yimg.com/rz/stage/p/yahoo_finance_en-US_h_p_finance_2.png,O,Yahoo,"O leans on 15,571 properties and 98.9% occupancy as it boosts 2026 guidance and posts 6.6% AFFO/share growth.",https://finnhub.io/api/news?id=79f4a0ed7e40810eb1af33a2455d928439d5229e34ce3f8996881e7e96630a3f
company,1779803066,Freedom Broker Upgrades Realty Income (O) to Buy After Strong Q1 AFFO Beat,140420419,https://s.yimg.com/rz/stage/p/yahoo_finance_en-US_h_p_finance_2.png,O,Yahoo,"Realty Income Corporation (NYSE:O) is included among the Dividend Stock Portfolio For Retirement: Top 12 Stock Picks. On May 11, Freedom Broker analyst Zhiger Kurmet upgraded Realty Income Corporation (NYSE:O) to Buy from Hold and assigned a $69 price target. The analyst said Q1 AFFO of $1.13 per share came in above both the firm’s […]",https://finnhub.io/api/news?id=c89f8385062abc6ab990993ef5ad1218a635bd5462e0add6b52ba926d3f49e22
company,1779795008,"How $450,000 Can Deliver a $27,000 Paycheck Without Working a Day",140419491,https://s.yimg.com/rz/stage/p/yahoo_finance_en-US_h_p_finance_2.png,O,Yahoo,"A $450,000 portfolio generating a 6% blended yield produces about $27,000 per year in income. For many early retirees between ages 55 and 65, that can function as a financial bridge between leaving full-time work and the arrival of Social Security and Medicare benefits. The underlying math is straightforward: $27,000 divided by a 6% yield ... How $450,000 Can Deliver a $27,000 Paycheck Without Working a Day",https://finnhub.io/api/news?id=53910a0b145091652ec5f7c57432e51f2f53904baa7f6e7c63d997ac47eca4b1
company,1779791400,Market Crash: 3 Stocks I'd Buy Without Hesitation,140419419,https://s.yimg.com/rz/stage/p/yahoo_finance_en-US_h_p_finance_2.png,O,Yahoo,"Walmart, Realty Income, and PMI are all resilient blue chip stocks.",https://finnhub.io/api/news?id=66efabbe945d5addc64fadac69169adc6a02a26b95c707e7796124a9198de37b
company,1779789420,"No Matter What Happens to the Market, These 3 Dividend Stocks Belong in Your Portfolio",140419494,https://s.yimg.com/rz/stage/p/yahoo_finance_en-US_h_p_finance_2.png,O,Yahoo,Investing is about more than just cashing in when the going is good.,https://finnhub.io/api/news?id=08edcddbd8099a41388c369223440c45d52dbb5c0613a10fda8dc72befec4ea7
