category,datetime,headline,id,image,related,source,summary,url
company,1779827958,Stocks Finish Mostly Higher on Iran Peace Progress,140429485,https://s.yimg.com/rz/stage/p/yahoo_finance_en-US_h_p_finance_2.png,OXY,Yahoo,"The S&P 500 Index ($SPX ) (SPY ) on Tuesday closed up +0.61%, the Dow Jones Industrial Average ($DOWI ) (DIA ) closed down -0.23%, and the Nasdaq 100 Index ($IUXX ) (QQQ ) closed up +1.76%. June E-mini S&P futures (ESM26 ) rose +0.61%, and June E-mini Nasdaq futures...",https://finnhub.io/api/news?id=5f2613d75eb06dea81fb17d1dca0dc03715b5a3ef379ed16866bdd721e0e13c4
company,1779825810,Sector Update: Energy Stocks Fall Late Afternoon,140426020,https://s.yimg.com/rz/stage/p/yahoo_finance_en-US_h_p_finance_2.png,OXY,Yahoo,Energy stocks declined late Tuesday afternoon with the NYSE Energy Sector Index falling 2.2% and the,https://finnhub.io/api/news?id=703d1c150863d9fd19f341d90bcd86f3318d17136f7d43919cd501d3161099ed
company,1779824220,Top bank resets Occidental Petroleum stock price as crude jumps,140424466,https://s.yimg.com/rz/stage/p/yahoo_finance_en-US_h_p_finance_2.png,OXY,Yahoo,"Wall Street spent most of 2025 sour on Occidental Petroleum (OXY), but that's changing. Today, May 26, Barclays became the third major bank in six trading days to flip its stance on Warren Buffett's largest single oil holding. The firm lifted OXY to Overweight from Equalweight and raised its price ...",https://finnhub.io/api/news?id=260ce3e64f362f6c2d6bc2da015f1727cfbab781755f9f3a46a314daaca030c6
company,1779802488,"Intel downgraded, Marvell upgraded: Wall Street's top analyst calls",140420211,https://s.yimg.com/rz/stage/p/yahoo_finance_en-US_h_p_finance_2.png,OXY,Yahoo,"Intel downgraded, Marvell upgraded: Wall Street's top analyst calls",https://finnhub.io/api/news?id=c9045c53ac19ad80d94a07c2e8320fa134ac76c18ad5824d79898864952688d5
company,1779802238,"Barclays sees multi-year oil boom, sees upside in OXY, Devon and ConocoPhillips",140420344,https://s.yimg.com/rz/stage/p/yahoo_finance_en-US_h_p_finance_2.png,OXY,Yahoo,"Investing.com -- Analysts at Barclays raised their medium-term oil price forecasts and upgraded Occidental Petroleum to Overweight, arguing that tightening global supply conditions and muted U.S. shale growth are setting up oil-focused energy companies for a prolonged cash flow boom.",https://finnhub.io/api/news?id=7da4e37aa853232c85af07904767b2d2d7dab1ca50a066a8f3a58072613f1e0d
company,1779800307,'Occidental Petroleum To Acquire 10% Stake In Exxon Deepwater Block Offshore Trinidad' - Reuters Exclusive,140426914,,OXY,Benzinga,"Occidental to acquire 10% stake in Exxon&#39;s Trinidad deepwater block, sources sayExxon conducting seismic surveys, data interpretation expected by end of 2026Block borders Guyana&#39;s Stabroek, potential seen but exploration",https://finnhub.io/api/news?id=4cac08b02211225e30890ed8902f8ea78b611257c336ea2ca9c8159e907a21d9
company,1779800028,Progress on Potential Middle East Peace Agreement Drives US Equity Futures Higher Pre-Bell,140420190,https://s.yimg.com/rz/stage/p/yahoo_finance_en-US_h_p_finance_2.png,OXY,Yahoo,US equity futures were edging higher pre-bell Tuesday as traders monitored the US-Iran situation for,https://finnhub.io/api/news?id=495fc837ff39f11dabce1dd6e98ad5cfc860c4b2e33524fba1fdd060e274e0cb
company,1779798245,"Barclays Upgrades Occidental Petroleum to Overweight, Raises Price Target to $72",140426915,,OXY,Benzinga,Barclays  analyst Betty Jiang   upgrades Occidental Petroleum (NYSE:OXY) from Equal-Weight to Overweight and raises the price target from $59 to $72.,https://finnhub.io/api/news?id=70a01d258c868cdeadcfca3faefa140d6f5404c757c13785b4f1e1202ce156d7
company,1779797633,"Here Are Tuesday’s Top Wall Street Analyst Research Calls: Albemarle, Booz Allen Hamilton, Cigna, DT Midstream, GE Vernova, Intel, Okta, Travelers, Occidental Petroleum, and More",140420223,https://s.yimg.com/rz/stage/p/yahoo_finance_en-US_h_p_finance_2.png,OXY,Yahoo,"Pre-Market Stock Futures: Futures are trading higher as investors return to a holiday-shortened trading week after a record-setting Friday, when the S&P 500, which posted its eighth straight weekly gain, and the Dow Jones Industrial Average both posted new all-time highs, closing at 7,473 and 50,579, respectively. Not to be left behind, the Nasdaq closed ... Here Are Tuesday’s Top Wall Street Analyst Research Calls: Albemarle, Booz Allen Hamilton, Cigna, DT Midstream, GE Vernova, Intel, Okta, Tr",https://finnhub.io/api/news?id=087812107a511eb13c89c04a978fe69f631a9ce4eb03e98eb2a1e82f023361e7
