category,datetime,headline,id,image,related,source,summary,url
company,1779827597,Synopsys Is the ‘Growth Trap’ Your Advisor Won’t Warn You About,140425947,https://s.yimg.com/rz/stage/p/yahoo_finance_en-US_h_p_finance_2.png,SNPS,Yahoo,"The bear case on SNPS is structural. Synopsys (NASDAQ:SNPS) gets lumped in with the AI hardware winners because it sells the software that designs the chips. The narrative is clean. The financial model is something else entirely. Synopsys sits inside a duopoly with Cadence (NASDAQ:CDNS) in electronic design automation, plus a semiconductor IP catalog. It also ... Synopsys Is the ‘Growth Trap’ Your Advisor Won’t Warn You About",https://finnhub.io/api/news?id=fce8250a1f25b545c425bc3e342b129b4512303bbeecb22623fec20a4a81bcdf
company,1779799885,"Synopsys Q2 Preview: Ansys, AI Tool Adoption To Drive Results",140434587,https://cdn.benzinga.com/files/images/story/2026/05/26/Synopsys--Inc-.jpeg?width=2048&height=1536,SNPS,Benzinga,"Synopsys to report Q2 results, driven by Ansys acquisition and growth in EDA demand and AI chip programs. Analysts raises PT.",https://finnhub.io/api/news?id=2e9f54f69c02d0169d19a69b92d629e2e92aa04af1daaae7f12c91d9c599c76d
company,1779798077,Trading the tech boom: The Committee's top strategies,140421961,https://image.cnbcfm.com/api/v1/image/108312033-17798121891779812184-46177391379-1080pnbcnews.jpg?v=1779812188&w=1920&h=1080,SNPS,CNBC,The Investment Committee discuss how they're trading the tech boom and share the best strategies to navigate the high-flying sector.,https://finnhub.io/api/news?id=eac1661916724f17f464b4969d18e785a32e0d0ebdac84889c49a2a805802133
company,1779794486,"The AI Bubble That Isn't: Why Nvidia, Micron Still Look Cheap",140421589,https://cdn.benzinga.com/files/images/story/2026/05/26/Micron-Technology-Logo-Displayed-On-A-Mo_2.jpeg?width=2048&height=1536,SNPS,Benzinga,"BofA says company fundamentals do not support the semiconductor bubble narrative. Nvidia, Micron and Credo trade below historical P/E.",https://finnhub.io/api/news?id=95534efdc1806eb9bac19c03cd459dd69e21b60b9ac8412d1f66df63b08d02e5
company,1779791804,"Stocks Set to Open Higher as U.S.-Iran Peace Hopes Hold, PCE Inflation Data and Fed Speak Awaited",140422647,https://s.yimg.com/rz/stage/p/yahoo_finance_en-US_h_p_finance_2.png,SNPS,Yahoo,"June S&P 500 E-Mini futures (ESM26) are up +0.67%, and June Nasdaq 100 E-Mini futures (NQM26) are up +1.03% this morning as investors remained hopeful that the latest U.S. strikes on Iran would not derail talks to end the Middle East conflict.",https://finnhub.io/api/news?id=dd5238166fa16ac23b7c6b3d7d9556d2c867e0cfb91b9691c1d05988b84fe313
company,1779786566,CrowdStrike To Rally Over 15%? Here Are 10 Top Analyst Forecasts For Tuesday,140420932,https://cdn.benzinga.com/files/images/story/2026/05/26/9--CrowdStrike-Holdings-Inc-.jpeg?width=2048&height=1536,SNPS,Benzinga,"Wall Street analysts changed outlook on top names. Guggenheim raised price target for IMVT, Piper Sandler increased price target for TRV, and more.",https://finnhub.io/api/news?id=a1f1ec09420e0b136e5e8858987c693b3869746ae841cf58c0723460c26f1eae
company,1779784780,"Rosenblatt Maintains Buy on Synopsys, Raises Price Target to $575",140421637,,SNPS,Benzinga,Rosenblatt  analyst Blair Abernethy   maintains Synopsys (NASDAQ:SNPS) with a Buy and raises the price target from $530 to $575.,https://finnhub.io/api/news?id=3aaec80502ba3f3f4030ddf36305fa83b36956246d37ef91c218a6121401a3fc
