category,datetime,headline,id,image,related,source,summary,url
company,1779829648,"Dow Jones Futures: S&P 500, Nasdaq Hit Highs, Micron Tops $1 Trillion; 5 AI Stocks In Buy Areas",140425992,https://s.yimg.com/rz/stage/p/yahoo_finance_en-US_h_p_finance_2.png,TER,Yahoo,"The S&P 500, Nasdaq and Russell 2000 hit new highs as Micron surged to top a $1 trillion market cap. Caterpillar, Viavi flashed buy signals.",https://finnhub.io/api/news?id=4a4d3aa081d9de5d9b64b3587162e1e835490eb7037e1a074e16cb35598adf3a
company,1779822300,Discover which S&P500 stocks are making waves on Tuesday.,140423865,https://www.chartmill.com/images/uploads/CM_Top_Movers_Small_free_2b4ff2fc22.webp,TER,ChartMill,Uncover the latest developments among S&P500 stocks in today's session. Stay tuned to the S&P500 index's top gainers and losers on Tuesday.,https://finnhub.io/api/news?id=3c6c480c4bd2c43e82374dbb838503b278c91a37c1ec03337c9d04dff333e156
company,1779813300,Exploring the top movers within the S&P500 index during today's session.,140421781,https://www.chartmill.com/images/uploads/CM_Top_Movers_Small_free_2b4ff2fc22.webp,TER,ChartMill,Wondering what's happening in today's session for the S&P500 index? Stay informed with the top movers within the S&P500 index on Tuesday.,https://finnhub.io/api/news?id=2458fbf0ae345aa834f31ae8840cf924b51202cce4ef8cced649e650e88d3011
company,1779806100,Tuesday's session: gap up and gap down stock in the S&P500 index,140420732,https://www.chartmill.com/images/uploads/CM_Gap_Stocks_Small_free_ad767b11cf.webp,TER,ChartMill,Looking for the S&P500 stocks that are experiencing notable gaps on Tuesday? Find out which stocks are gapping up and gapping down in the S&P500 index during today's session.,https://finnhub.io/api/news?id=b392df27eeafa41fbd8e6b65dd8582f13f2b600fda0b7876351cd313c1e63af4
company,1779802204,Wall Street Analysts Think Teradyne (TER) Is a Good Investment: Is It?,140421391,https://s.yimg.com/rz/stage/p/yahoo_finance_en-US_h_p_finance_2.png,TER,Yahoo,"Based on the average brokerage recommendation (ABR), Teradyne (TER) should be added to one's portfolio. Wall Street analysts' overly optimistic recommendations cast doubt on the effectiveness of this highly sought-after metric. So, is the stock worth buying?",https://finnhub.io/api/news?id=1d498e851da45d212ecab3652057315d075f05b10ee4f1eefebd9f552bb0f518
company,1779801238,Cathie Wood Is Dumping AMD and TSMC Stock. Here's What She's Buying Instead,140420088,https://s.yimg.com/rz/stage/p/yahoo_finance_en-US_h_p_finance_2.png,TER,Yahoo,Cathie Wood Just Made a Bold Bet on AI Hardware and Crypto Stocks,https://finnhub.io/api/news?id=5745668c00a2a8d0ee1abaf4187263fd8adbed3772bd25682fe88556c3fcc34a
company,1779800400,VETS Indexes Names Teradyne 2026 Recognized Employer,140420432,https://s.yimg.com/rz/stage/p/yahoo_finance_en-US_h_p_finance_2.png,TER,Yahoo,"NORTH READING, Mass., May 26, 2026--Teradyne, Inc. (NASDAQ: TER), a leading supplier of automated test solutions and advanced robotics, today announced it has been named a Recognized Employer in the 2026 VETS Indexes Employer Awards. VETS Indexes honors organizations that demonstrate strong commitment to recruiting, hiring, retaining, developing, and supporting veterans and the broader military‑connected community.",https://finnhub.io/api/news?id=5f35a556440b9b691c915db636783e8fd422dfa97f71ba94500fdc0d25112bef
company,1779793597,"Micron, Braiin, Redwire, Modine Manufacturing And Other Big Stocks Moving Higher On Tuesday",140420994,https://cdn.benzinga.com/files/images/story/2026/05/26/Micron-Technology-Logo-On-Circuit-Board.jpeg?width=2048&height=1536,TER,Benzinga,"U.S. stocks were higher, Nasdaq up 350 points. Micron stock rose on UBS&#39;s tripled price target. Other big gainers include BRAI, RDW, HTT, ATOM, TE, MOD, ORBS, YSS, ASTS, UMC, and JOYY.",https://finnhub.io/api/news?id=2af156727b9e2499ca3a0c2114f083a1ddf42d8126ee70fa0f4e2f56db9879c0
