category,datetime,headline,id,image,related,source,summary,url
company,1779828120,"Top Stock Picks for Week of May 25, 2026",140426092,https://s.yimg.com/rz/stage/p/yahoo_finance_en-US_h_p_finance_2.png,TMUS,Yahoo,A Telecom Company Eyeing a Broadband Network in Space and a Non-Tech Nasdaq Stock That has Skyrocketed are Highlighted.,https://finnhub.io/api/news?id=d5544db36d85ef7bd4d458a55f13644c9cee843480defcc109f5668e36640dbb
company,1779815400,AST SpaceMobile’s June Launch Plan Puts Its 2026 Satellite Goal Back in Focus,140434883,https://s.yimg.com/rz/stage/p/yahoo_finance_en-US_h_p_finance_2.png,TMUS,Yahoo,"AST SpaceMobile plans a mid-June triple satellite launch, keeping it on pace for its 2026 target. Despite Wall Street skepticism, strong cash and 95% integration fuel growth.",https://finnhub.io/api/news?id=6912416ca0c90ff3d92701478149daf09512f744c29ef561e67f2476366c5121
company,1779811200,"T-Mobile US, Inc. to Present at the Evercore TMT Global Conference",140422835,https://s.yimg.com/rz/stage/p/yahoo_finance_en-US_h_p_finance_2.png,TMUS,Yahoo,"BELLEVUE, Wash., May 26, 2026--Peter Osvaldik, chief financial officer of T-Mobile US, Inc. (NASDAQ: TMUS), will present and provide a business update on Tuesday, June 2, 2026 at 12:30 p.m. Pacific Time (PT) at the 2026 Evercore TMT Global Conference.",https://finnhub.io/api/news?id=9ec9087f5403e355dfe57a1ff3148ef91bbf05d114f77b0cf019b1029f4b08ba
company,1779808498,Nokia Stock Has More Than Doubled. Here’s What’s Fueling The Rally,140421166,https://s.yimg.com/rz/stage/p/yahoo_finance_en-US_h_p_finance_2.png,TMUS,Yahoo,"Nokia stock (NYSE:NOK) was founded in 1865 as a paper mill. In 2026, it has somehow become one of the market’s hottest AI infrastructure stocks.",https://finnhub.io/api/news?id=8f00ebac1950ae083aab6ef7e67fb907d9871fedb3a7ca57e27e5b73eb08f9b9
company,1779800400,Forrester Study Finds Zip’s AI Platform Delivers 386% ROI for the World’s Largest Enterprises,140420371,https://s.yimg.com/rz/stage/p/yahoo_finance_en-US_h_p_finance_2.png,TMUS,Yahoo,"SAN FRANCISCO, May 26, 2026--Forrester Study Finds Zip’s AI Platform Delivers 386% ROI for the World’s Largest Enterprises",https://finnhub.io/api/news?id=2d77d7bb4855e3ef6ce75af41ec526e1331b5ca4f632c45d17f473fbc3cab0ba
company,1779789715,The best roadside assistance plans of 2026 ,140422057,https://image.cnbcfm.com/api/v1/image/106921272-1628012228654-towing-an-automobile-to-fix-the-flat-tire-tonythetigersson-tony-andrews-photography_t20_YEkn11.jpg?v=1628012302&w=1920&h=1080,TMUS,CNBC,"From joining AAA to getting a car warranty, here's how you can get help with your car in a pinch.",https://finnhub.io/api/news?id=e2b7e4f723f755901f6c6934822ad0bad30cebb43d10ccf71d30ae45b7f11b46
company,1779776399,ASTS Stock Gains Overnight: Bulls Cheer ‘Back On Track’ Moment As BlueBird Satellites Reach Florida,140418516,https://s.yimg.com/rz/stage/p/yahoo_finance_en-US_h_p_finance_2.png,TMUS,Yahoo,"The update is expected to ease investor concerns over prior launch issues, boosting sentiment around the company’s commercial plans.",https://finnhub.io/api/news?id=20f044ec7214bdced72b6a5ae63e5c71b62d0defc58f497e2de6523f68472330
company,1779772044,AST SpaceMobile JV With US Carriers Shifts Focus To Execution Risks,140418517,https://s.yimg.com/rz/stage/p/yahoo_finance_en-US_h_p_finance_2.png,TMUS,Yahoo,"AST SpaceMobile secured a central role in a new joint venture with AT&T, Verizon, and T-Mobile to expand satellite cellular coverage across the U.S. The company received FCC approval for direct-to-device satellite services, clearing a key regulatory hurdle for commercial deployment. AST SpaceMobile has signed significant commercial contracts tied to this collaboration, signaling a move toward large scale service rollout. For investors watching NasdaqGS:ASTS, this development marks a shift...",https://finnhub.io/api/news?id=83a9c7abb082f0b134566dba94f329ae138f5c283642b8b2a6b37dccf5db5511
company,1779769179,"América Móvil: Good Execution, But The Rally Has Caught Up",140418609,https://static.seekingalpha.com/cdn/s3/uploads/getty_images/2148113140/image_2148113140.jpg?io=getty-c-w1536,TMUS,SeekingAlpha,"AmÃ©rica MÃ³vil's EBITDA margin reached around 40%, driven by cost control, digitalization, and scale. Read why I rate AMX stock a Hold.",https://finnhub.io/api/news?id=46af0aed904fc865cfc6382154874e9719558f568a247de0b90a69dbcc206fce
