category,datetime,headline,id,image,related,source,summary,url
company,1780521301,"C3.ai, Inc. (AI) Reports Q4 Loss, Tops Revenue Estimates",140518356,https://s.yimg.com/rz/stage/p/yahoo_finance_en-US_h_p_finance_2.png,ACN,Yahoo,"C3.ai (AI) delivered earnings and revenue surprises of +13.45% and +3.72%, respectively, for the quarter ended April 2026. Do the numbers hold clues to what lies ahead for the stock?",https://finnhub.io/api/news?id=3629b19981d36cd496cf033c3519be4357f734c4af5ec6852364600c3ed52015
company,1780517630,How The Investment Story For Accenture (ACN) Is Shifting With AI And Softer IT Spending,140517352,https://s.yimg.com/rz/stage/p/yahoo_finance_en-US_h_p_finance_2.png,ACN,Yahoo,"Accenture’s fair value estimate has been trimmed from US$249.19 to US$244.86, a reduction of about 1.7% that reflects a slightly more cautious stance on the stock. Analysts linking this adjustment to softer IT spending, rising AI competition, and questions about how AI might affect existing consulting revenue now balance long term optimism in AI services with nearer term execution risks. As you read on, you will see how to interpret these shifts and follow the evolving analyst narrative...",https://finnhub.io/api/news?id=8abb6849d3a61de22d5ade39c14d89ca2f043702c93920fd1e5e8f064b85ac48
company,1780505580,3 Consulting Services Stocks to Consider Amid Industry Woes,140516160,https://s.yimg.com/rz/stage/p/yahoo_finance_en-US_h_p_finance_2.png,ACN,Yahoo,"Rising talent costs, persistent inflation and cautious corporate spending are weighing on the consulting services industry. Expert consultation and data-driven advisory demand are likely to aid. STN, CBZ and CRAI appear well-poised.",https://finnhub.io/api/news?id=376dc5d6fce9263b53a30b898b0ccdaaa376c61a8bac7ce612fc504ea3f106b3
company,1780504980,RedMane Technology Appoints John Murray as Chief Executive Officer,140515111,https://s.yimg.com/rz/stage/p/yahoo_finance_en-US_h_p_finance_2.png,ACN,Yahoo,"RedMane Technology LLC, a Chicago-based software solutions and systems integration company specializing in health and human services, announced the appointment of John Murray as Chief Executive Officer, effective May 11, 2026.",https://finnhub.io/api/news?id=871e1aa07d5ff12a8b4edc5f5b19de6cee6bf8e8a6da9909ac36f3cdead18a34
company,1780492637,"Goldman Sachs Maintains Buy on Accenture, Lowers Price Target to $270",140515513,,ACN,Benzinga,Goldman Sachs  analyst James Schneider   maintains Accenture (NYSE:ACN) with a Buy and lowers the price target from $300 to $270.,https://finnhub.io/api/news?id=f1cb29f7f1098b1563ac1f155ca95621d7754dc4aa9d96c9cd78975e91359817
company,1780488000,"AlphaSense Raises $350M at $7.5B Valuation, and Surpasses $600M in Annual Recurring Revenue",140512298,https://s.yimg.com/rz/stage/p/yahoo_finance_en-US_h_p_finance_2.png,ACN,Yahoo,"New funding round led by Vitruvian Partners, Accenture Ventures, J.P. Morgan Asset Management, D. E. Shaw Ventures, and Pinegrove Opportunity Partners, alongside existing investors CapitalG, Goldman Sachs Alternatives, and Viking Global InvestorsNEW YORK, June 03, 2026 (GLOBE NEWSWIRE) -- AlphaSense, the AI platform redefining market intelligence for the business and financial world, today announced the close of a $350 million funding round valuing the company at $7.5 billion – nearly double its",https://finnhub.io/api/news?id=30b0f40e2d74788841f9d1041f77fbea0f3421aa2a88477c134408f485d704e2
company,1780487940,Accenture and AlphaSense Announce Strategic Investment and Partnership to Bring Agentic Workflows for Market Intelligence to Enterprises,140512299,https://s.yimg.com/rz/stage/p/yahoo_finance_en-US_h_p_finance_2.png,ACN,Yahoo,"NEW YORK, June 03, 2026--Accenture and AlphaSense today announced an investment by Accenture Ventures in AlphaSense.",https://finnhub.io/api/news?id=06278f1e1c0ac10be103eb1f74020fe95fb27bb22ce54f00e42e6ae018c2daf2
company,1780486299,Top Dividend Stocks To Consider In June 2026,140511501,https://s.yimg.com/rz/stage/p/yahoo_finance_en-US_h_p_finance_2.png,ACN,Yahoo,"The United States market has shown robust performance, with a 1.2% increase over the last week and a remarkable 27% rise over the past year, while earnings are projected to grow by 17% annually. In this thriving environment, dividend stocks that offer consistent payouts and potential for growth can be an attractive option for investors seeking stability and income.",https://finnhub.io/api/news?id=8230504d5f613782147ee369974eb76036ff3dc8bb89a003ecc089f7b1fa67ab
company,1780485068,"Stifel Maintains Buy on Accenture, Lowers Price Target to $270",140515514,,ACN,Benzinga,Stifel  analyst David Grossman   maintains Accenture (NYSE:ACN) with a Buy and lowers the price target from $315 to $270.,https://finnhub.io/api/news?id=62bbaef0125f48c45eeb56a384de55df7bd7fd27882ef2d1cad16030e444e44a
company,1780473679,Accenture Ventures Invests In AI Market Intelligence Firm AlphaSense; Terms Not Disclosed,140515515,,ACN,Benzinga,"Accenture (NYSE:ACN) and AlphaSense today announced an investment by Accenture Ventures in AlphaSense, the AI platform transforming market intelligence for the business and financial world. The two companies are also",https://finnhub.io/api/news?id=f2c891af984d3321f32c7d0a4e02e977ecc23e82bcdd1c00782ce944d4236218
