category,datetime,headline,id,image,related,source,summary,url
company,1780518946,Stocks Retreat as US-Iran Peace Hopes in Doubt,140519416,https://s.yimg.com/rz/stage/p/yahoo_finance_en-US_h_p_finance_2.png,AMAT,Yahoo,"The S&P 500 Index ($SPX ) (SPY ) on Wednesday closed down -0.74%, the Dow Jones Industrial Average ($DOWI ) (DIA ) closed down -1.21%, and the Nasdaq 100 Index ($IUXX ) (QQQ ) closed down -0.29%. June E-mini S&P futures (ESM26 ) fell -0.78%, and June E-mini Nasdaq futures...",https://finnhub.io/api/news?id=c15b07df8063ea06404970f3a0d4374997f18827fce4fa4ca71d0429485a266d
company,1780517400,RiverPark Long/Short Opportunity Fund Q1 2026 Key Contributors And Detractors,140518482,https://static.seekingalpha.com/cdn/s3/uploads/getty_images/2262913202/image_2262913202.jpg?io=getty-c-w1536,AMAT,SeekingAlpha,"RiverPark Long/Short Opportunity Fund highlights Q1 2026 performance, led by Applied Materials. Read the full analysis for more details.",https://finnhub.io/api/news?id=6eb88e7894b18657c89dc5f2556c449237b6b315a5703e91050029546000c413
company,1780500000,AXTI's Capacity Expansion: Will It Cement AI Supply-Chain Leadership?,140515023,https://s.yimg.com/rz/stage/p/yahoo_finance_en-US_h_p_finance_2.png,AMAT,Yahoo,"AXTI plans to quadruple indium phosphide capacity by 2027, using existing facilities and vertical integration to meet rising AI demand.",https://finnhub.io/api/news?id=92366ee8db2a5ccc6308ec37872f9a3b31c90d367d025da58738eafa3f06b6f8
company,1780499967,Stocks Fall on Escalation of US-Iran Hostilities,140517249,https://s.yimg.com/rz/stage/p/yahoo_finance_en-US_h_p_finance_2.png,AMAT,Yahoo,"The S&P 500 Index ($SPX ) (SPY ) today is down -0.40%, the Dow Jones Industrial Average ($DOWI ) (DIA ) is down -0.74%, and the Nasdaq 100 Index ($IUXX ) (QQQ ) is down -0.08%. June E-mini S&P futures (ESM26 ) are down -0.48%, and June E-mini Nasdaq futures...",https://finnhub.io/api/news?id=8e0eeea37dc5e4a18989382aba354fb4747c08ecfc61e2ee0d1891492342b086
company,1780498920,Will Strong Cash Flows Support Lam Research's Buyback Strategy Ahead?,140515009,https://s.yimg.com/rz/stage/p/yahoo_finance_en-US_h_p_finance_2.png,AMAT,Yahoo,LRCX's strong cash flow powers share repurchase activities. About $4.3B is left authorized for buybacks as AI-led demand lifts revenues and margins.,https://finnhub.io/api/news?id=00334b347739e8e902b7b4f20e577528753156ee4c1170190132a43f2f2626ff
