category,datetime,headline,id,image,related,source,summary,url
company,1780524902,Here's Why BlackRock (BLK) Fell More Than Broader Market,140518351,https://s.yimg.com/rz/stage/p/yahoo_finance_en-US_h_p_finance_2.png,BLK,Yahoo,"The latest trading day saw BlackRock (BLK) settling at $990.87, representing a -2.76% change from its previous close.",https://finnhub.io/api/news?id=ad0e13c027c06a3e0d8b6648a152313596264d10d78e61b2ad2875b6bd85ceab
company,1780518946,Stocks Retreat as US-Iran Peace Hopes in Doubt,140519416,https://s.yimg.com/rz/stage/p/yahoo_finance_en-US_h_p_finance_2.png,BLK,Yahoo,"The S&P 500 Index ($SPX ) (SPY ) on Wednesday closed down -0.74%, the Dow Jones Industrial Average ($DOWI ) (DIA ) closed down -1.21%, and the Nasdaq 100 Index ($IUXX ) (QQQ ) closed down -0.29%. June E-mini S&P futures (ESM26 ) fell -0.78%, and June E-mini Nasdaq futures...",https://finnhub.io/api/news?id=c15b07df8063ea06404970f3a0d4374997f18827fce4fa4ca71d0429485a266d
company,1780509330,Vanguard’s VOO Hits $1 Trillion of Assets in ETF Industry First,140516144,https://s.yimg.com/rz/stage/p/yahoo_finance_en-US_h_p_finance_2.png,BLK,Yahoo,"(Bloomberg) -- A seemingly endless appetite for buying US stock dips has propelled Vanguard Group’s S&P 500-tracking ETF past $1 trillion in assets, making it the first fund of its kind to reach a milestone once thought unimaginable for the ETF industry.Most Read from BloombergTrump Begins Rebuilding His Tariff Wall, Citing Forced LaborRussia Finance Officials Tell Putin War Spending Is UnaffordableTrump to Get Audit Immunity as $1.8 Billion Fund in DoubtTikTok Billionaire Overtakes Mukesh Amban",https://finnhub.io/api/news?id=2e53e318cd9b71f07d1d584372b797b01afb7c8506fc42688724ab9d9757bf4f
company,1776958527,"Shares of companies in the broader financial sector are trading lower amid overall market weakness, as investors react to reports that air defenses were activated in Tehran and to President Trump's social media post.",139942573,,BLK,Benzinga,,https://finnhub.io/api/news?id=0622b3b1cf69372313b6a080b71ad40de736c090bef96f1b87643378103e97e6
company,1780499967,Stocks Fall on Escalation of US-Iran Hostilities,140517249,https://s.yimg.com/rz/stage/p/yahoo_finance_en-US_h_p_finance_2.png,BLK,Yahoo,"The S&P 500 Index ($SPX ) (SPY ) today is down -0.40%, the Dow Jones Industrial Average ($DOWI ) (DIA ) is down -0.74%, and the Nasdaq 100 Index ($IUXX ) (QQQ ) is down -0.08%. June E-mini S&P futures (ESM26 ) are down -0.48%, and June E-mini Nasdaq futures...",https://finnhub.io/api/news?id=8e0eeea37dc5e4a18989382aba354fb4747c08ecfc61e2ee0d1891492342b086
company,1780499930,Tech ETF inflows surge and defy AI concentration risks,140514917,https://s.yimg.com/rz/stage/p/yahoo_finance_en-US_h_p_finance_2.png,BLK,Yahoo,"In the latest installment of Yahoo Finance's ETF Report, BlackRock head of iShares investment strategy for the Americas, Kristy Akullian, sits down with Julie Hyman to lay out where the biggest tech ETF inflows are happening as the latest bout of AI momentum stokes the flame of the market.",https://finnhub.io/api/news?id=7dcb1d8b8e5b60da05844dac0ad621db74ef96e1bce81b408a99a6bdbdd41c4f
company,1780496944,"Private Credit Jitters Go Global As Partners Group Gates Fund, Shares Tumble 17%",140517846,https://cdn.benzinga.com/files/images/story/2026/06/03/Private-Credit-Stress.png?width=2048&height=1536,BLK,Benzinga,Partners Group is restricting investor withdrawals after redemption requests exceeded 5% of the net asset value. ,https://finnhub.io/api/news?id=4acc5c2c26fcaba97f2dd7bda3d5eae061d93862371bc8d2328d6b84a42f8d5c
company,1780490700,'The world is choosing Texas': Is 'Y'All Street' taking over as the new financial capital of America?,140512156,https://s.yimg.com/rz/stage/p/yahoo_finance_en-US_h_p_finance_2.png,BLK,Yahoo,The governor believes his state can displace New York as a hub for finance.,https://finnhub.io/api/news?id=36af38569d35d18fc44580de953a55fbbd84ecebaf79f0742f05583a8720804d
company,1780449808,Blackstone Stock: Is BX Underperforming the Financial Sector?,140510422,https://s.yimg.com/rz/stage/p/yahoo_finance_en-US_h_p_finance_2.png,BLK,Yahoo,"Despite Blackstone's underperformance relative to the financial sector over the past year, Wall Street analysts maintain a moderately optimistic outlook on the stock’s prospects.",https://finnhub.io/api/news?id=5b8d0c8fa824c80e0f34aa0204696b6938f8912d85fb51ae24f565a6cde3df86
