category,datetime,headline,id,image,related,source,summary,url
company,1780523386,CNBC Daily Open: Fresh Iran war worries halt stock rally,140524336,https://image.cnbcfm.com/api/v1/image/108316338-1780518732442-gettyimages-2279672498-kd1_8532_vbiuiux6.jpeg?v=1780518769&w=1920&h=1080,CF,CNBC,Oil prices rise and markets fall after Netanyahu tells CNBC Israel and U.S. prepared to attack Iran again if necessary.,https://finnhub.io/api/news?id=f41c377062c4f4c9fb62b24426097b13f17bb4dc5959880548c6584978f5cc8b
company,1780500360,Dow Features Next-Gen AI Thermal Technologies at COMPUTEX Taipei,140515216,https://s.yimg.com/rz/stage/p/yahoo_finance_en-US_h_p_finance_2.png,CF,Yahoo,"DOW heads into COMPUTEX Taipei 2026 with next-gen AI thermal materials, designed to support scalable cooling, from chip packaging to data-center operations.",https://finnhub.io/api/news?id=059e53e146b8230e95ccf968bfa72903af22dff302745998d89715436777d9c1
company,1780494003,Are Investors Undervaluing CF Industries (CF) Right Now?,140513461,https://s.yimg.com/rz/stage/p/yahoo_finance_en-US_h_p_finance_2.png,CF,Yahoo,"Here at Zacks, our focus is on the proven Zacks Rank system, which emphasizes earnings estimates and estimate revisions to find great stocks. Nevertheless, we are always paying attention to the latest value, growth, and momentum trends to underscore strong picks.",https://finnhub.io/api/news?id=2e2c9f300b7807e7a3db1ffd64e77cf01fe19a4c5ab10d356c880c7a0ae98076
company,1780487828,"JP Morgan Maintains Neutral on CF Industries Holdings, Raises Price Target to $115",140523086,,CF,Benzinga,JP Morgan  analyst Jeffrey Zekauskas   maintains CF Industries Holdings (NYSE:CF) with a Neutral and raises the price target from $94 to $115.,https://finnhub.io/api/news?id=c24a1dd83c70cf6102ef3a44efde4c3c2c9bed58ef76933c64d503f9330a485d
company,1780470679,"Earnings Scheduled For June 3, 2026",140512819,https://cdn.benzinga.com/files/images/story/2025/11/06/earnings_scheduled_1.jpg?width=2048&height=1536,CF,Benzinga, ,https://finnhub.io/api/news?id=a056513098cad11a7f63b1cd059b8bce5bfbc70e20979964f47d1434e04be088
