category,datetime,headline,id,image,related,source,summary,url
company,1780530474,"Dow Jones Futures: Broadcom, CrowdStrike Dive On Earnings; SpaceX IPO Price Target Set",140518226,https://s.yimg.com/rz/stage/p/yahoo_finance_en-US_h_p_finance_2.png,CIEN,Yahoo,Broadcom and CrowdStrike fell late on earnings. The SpaceX IPO price target and size have been set with the offering next week.,https://finnhub.io/api/news?id=50c083ac4ae5b0879e7e2186a323295d45052502acc3707230d844997539a307
company,1780523559,"Dow Jones Futures Fall As Broadcom, CrowdStrike Dive On Earnings; SpaceX IPO Price Target Set",140517151,https://s.yimg.com/rz/stage/p/yahoo_finance_en-US_h_p_finance_2.png,CIEN,Yahoo,Broadcom and CrowdStrike fell late on earnings. The SpaceX IPO price target and size have been set with the offering next week.,https://finnhub.io/api/news?id=e7259a4950e758b420473cc836c09fd9c8e69ee9ada3f39fdb13a48e355023ac
company,1780509749,"Dow jumps 800 points, Nasdaq lags as investors rotate out of chip stocks for banks, retail: Live updates",140524434,https://image.cnbcfm.com/api/v1/image/108316787-1780584405108-gettyimages-2279812242-mms18712_aqiscxbg.jpeg?v=1780584477&w=1920&h=1080,CIEN,CNBC,The S&P 500 fell Thursday as traders dumped chip stocks following an underwhelming report from Broadcom.,https://finnhub.io/api/news?id=da3324d4c8a092d63ab6e3d049091c5b3139fcc074ebfcfe3b7690c7a3d73807
company,1780503360,Palo Alto Networks Q3 Earnings and Revenues Surpass Estimates,140515065,https://s.yimg.com/rz/stage/p/yahoo_finance_en-US_h_p_finance_2.png,CIEN,Yahoo,"PANW tops Q3 estimates as AI-driven demand boosts revenues, bookings momentum and next-generation security growth.",https://finnhub.io/api/news?id=1b10d1be8acb4ebee3225aae3b34eff4688661b6b2453b10cedcb8940d1fea6f
company,1780503060,"GitLab Shares Down Despite Q1 Earnings Beat, Revenues Up Y/Y",140515081,https://s.yimg.com/rz/stage/p/yahoo_finance_en-US_h_p_finance_2.png,CIEN,Yahoo,GTLB beat Q1 estimates and raises FY2027 guidance as enterprise adoption and customer expansion fuel revenue growth.,https://finnhub.io/api/news?id=8e1e90c443afdeed46b0314c1edef56d7c3012d751a3d0ad18f990e0a74a0991
company,1780473600,5 Things To Consider Ahead Of Anthropic's IPO,140511587,https://static.seekingalpha.com/cdn/s3/uploads/getty_images/2270277028/image_2270277028.jpg?io=getty-c-w1536,CIEN,SeekingAlpha,"Anthropic is preparing for a high-profile IPO, with recent funding rounds suggesting a potential $1–2.45T valuation. Read why post-IPO volatility is likely.",https://finnhub.io/api/news?id=880638a4129ae93ac08ded2f0b3f33f1fa2e8a4e1e318b8556d5bebe325c5efc
company,1780448886,Ciena Taps Cloud And Subsea Demand In Cirion And Biznet Wins,140508795,https://s.yimg.com/rz/stage/p/yahoo_finance_en-US_h_p_finance_2.png,CIEN,Yahoo,"Ciena (NYSE:CIEN) is supplying technology for Cirion Technologies' new Network-as-a-Service offering in Latin America, aimed at on-demand, cloud-like enterprise connectivity. Biznet in Indonesia has deployed Ciena's WaveLogic optical platform to upgrade capacity on its submarine cable network. Ciena (NYSE:CIEN) sits at the intersection of optical networking, routing and automation software, serving carriers and large enterprises that need high-capacity, programmable networks. Cirion's...",https://finnhub.io/api/news?id=2ffeddb7934fe5a268b3ef80b48887510e1ce08db84091b7f0d10e761d07e3d6
