category,datetime,headline,id,image,related,source,summary,url
company,1780517700,"Top Stock Reports for Broadcom, Cisco & Alibaba",140517204,https://s.yimg.com/rz/stage/p/yahoo_finance_en-US_h_p_finance_2.png,CSCO,Yahoo,"Broadcom, Cisco and Alibaba headline new research reports, with AI, networking and cloud growth emerging as key themes shaping outlooks.",https://finnhub.io/api/news?id=2bfceb64c9714aecc5450d3932df294f2e6a47f66c33d8840586f047c60b2d8e
company,1780514889,Jim Cramer talks the flow of money in Big Tech and the dealmaking race,140524337,https://image.cnbcfm.com/api/v1/image/108316434-4ED3-MM-A-BLOCK-060326.jpg?v=1780527894&w=1920&h=1080,CSCO,CNBC,'Mad Money' host Jim Cramer weighs in on the latest news on the upcoming SpaceX IPO and how tech companies are racing to raise funds.,https://finnhub.io/api/news?id=fa145c0cbdf3274829b0bafd2d361212945479a61b37b8eb98c94f590d8b8aa0
company,1780513802,What's going on in today's session: dow jones movers,140515847,https://www.chartmill.com/images/uploads/CM_Top_Movers_Small_free_2b4ff2fc22.webp,CSCO,ChartMill,Join us in exploring the top gainers and losers within the dow jones index one hour before the close of the markets on Wednesday as we examine the latest happenings in today's session.,https://finnhub.io/api/news?id=f12eae3674694cf425f50d042292f0735b68447f2c30d7b4dfe9d35bd11e5ca5
company,1780512540,ANET Rises 33.8% in a YTD: Is There More Room for the Stock to Grow?,140516292,https://s.yimg.com/rz/stage/p/yahoo_finance_en-US_h_p_finance_2.png,CSCO,Yahoo,"ANET is riding the AI networking demand and surging cash flow, but competition, AI spending reliance and customer concentration remain key risks.",https://finnhub.io/api/news?id=c3c9caa934081f6e3aa8a61640984b0b94eb4409ad6217d15ce66c2aafed3b74
company,1780504802,Top dow jones movers in Wednesday's session,140513835,https://www.chartmill.com/images/uploads/CM_Top_Movers_Small_free_2b4ff2fc22.webp,CSCO,ChartMill,Join us in exploring the top gainers and losers within the dow jones index in the middle of the day on Wednesday as we examine the latest happenings in today's session.,https://finnhub.io/api/news?id=7e1cb0184f6aeb9ddbe16925bff29adde63c5afab579bff30d0eeaf1f3ab0d26
company,1780502040,"Weeks of Manual Infrastructure Work, Condensed to Hours: Quali and Cisco Launch Stack Automation Platform at Cisco Live",140514991,https://s.yimg.com/rz/stage/p/yahoo_finance_en-US_h_p_finance_2.png,CSCO,Yahoo,"Quali today announced the launch of Stack Automation by Quali, a new deployment automation platform developed for Cisco and unveiled at Cisco Live. Offered exclusively through Cisco, the platform is designed to help enterprises move from manual, component-by-component infrastructure assembly to automated, production-ready full-stack deployments in hours, not weeks.",https://finnhub.io/api/news?id=d82049db5d22b2e5c0b1dd9097dc8cb75ec412c774ac444ce1cabc35342b7694
company,1780501076,Adobe considering two internal executives for CEO position,140513112,https://s.yimg.com/rz/stage/p/yahoo_finance_en-US_h_p_finance_2.png,CSCO,Yahoo,"Investing.com -- Adobe Inc. has narrowed its CEO search to two internal candidates while also exploring external options through a hired search firm, according to a Bloomberg report Wednesday.",https://finnhub.io/api/news?id=cf0aee110e6b9ae6d369f2ebb018b4f8c00522f666ea02d3ee70d5ac09598f41
company,1780499930,Tech ETF inflows surge and defy AI concentration risks,140514917,https://s.yimg.com/rz/stage/p/yahoo_finance_en-US_h_p_finance_2.png,CSCO,Yahoo,"In the latest installment of Yahoo Finance's ETF Report, BlackRock head of iShares investment strategy for the Americas, Kristy Akullian, sits down with Julie Hyman to lay out where the biggest tech ETF inflows are happening as the latest bout of AI momentum stokes the flame of the market.",https://finnhub.io/api/news?id=7dcb1d8b8e5b60da05844dac0ad621db74ef96e1bce81b408a99a6bdbdd41c4f
company,1780499520,"FTNT Jumps 87.5% YTD on AI Security Push: Buy, Sell or Hold the Stock?",140514993,https://s.yimg.com/rz/stage/p/yahoo_finance_en-US_h_p_finance_2.png,CSCO,Yahoo,"Fortinet stock soars 87.5% YTD on AI-driven security growth and strong earnings, but premium valuation and rising competition may temper upside.",https://finnhub.io/api/news?id=5899717ae6d0b5f6d5f1c70b8f73184cc8d6a99d83c14fde3b1394bbc99b4550
company,1780498144,Cisco CEO explains why the stock is at record highs: 'Infrastructure is definitely cool',140513218,https://s.yimg.com/rz/stage/p/yahoo_finance_en-US_h_p_finance_2.png,CSCO,Yahoo,Cisco aims to get out in front of cyberattacks on businesses.,https://finnhub.io/api/news?id=3664a980b574d144fd9a75f1452474396673316f0feced629043bcb8644fb8b0
company,1780495200,LiveOne (Nasdaq: LVO) Collaborates with AT&T (NYSE: T) to Expand Next-Generation Connected Car Entertainment Platform,140513219,https://s.yimg.com/rz/stage/p/yahoo_finance_en-US_h_p_finance_2.png,CSCO,Yahoo,"Collaboration positions LiveOne for scalable deployment opportunities across AT&T’s Connected Car™ ecosystem supporting millions of connected vehicles nationwideLOS ANGELES, June 03, 2026 (GLOBE NEWSWIRE) -- LiveOne (Nasdaq: LVO) today announced an expanded collaboration with AT&T (NYSE: T) and Cisco (Nasdaq: CSCO) to support next-generation in-vehicle entertainment experiences through AT&T’s Connected Car™ platform. The collaboration enables automotive OEMs to more easily deploy premium connect",https://finnhub.io/api/news?id=764dcf0af72aa67b1ba52282f13a95f0ed5a2ae3a8096178f2fb87123ddb00b5
company,1780493733,2 Growth Stocks to Stash and 1 Facing Challenges,140512180,https://s.yimg.com/rz/stage/p/yahoo_finance_en-US_h_p_finance_2.png,CSCO,Yahoo,"Growth is oxygen. But when it evaporates, the consequences can be severe - ask anyone who bought Cisco in the Dot-Com Bubble or newer investors who lived through the 2020 to 2022 COVID cycle.",https://finnhub.io/api/news?id=27b2084eaf60e450c50154712d3a10cbc9a8eed7dbd90f3fdb840ac28e27a756
company,1780492239,From Activist Pressure to AI Fit: Why These 3 Software Stocks Could Be Gone by Year-End,140512062,https://s.yimg.com/rz/stage/p/yahoo_finance_en-US_h_p_finance_2.png,CSCO,Yahoo,"Software M&A activity has returned in 2026 as public SaaS multiples compress while private equity dry powder and strategic stack consolidation remain abundant. Mid-cap, sticky enterprise software companies with negative book equity, AI-relevant platforms, and visible activist or buyback signaling are the most logical targets. We screened for six attributes: Digestible market cap between $1 ... From Activist Pressure to AI Fit: Why These 3 Software Stocks Could Be Gone by Year-End",https://finnhub.io/api/news?id=a824af52f690ae9eb955793af2ac5746f91905d161a6b2cbd0bedb7742cd1842
company,1780491600,NWN Named to Elite Tier of National Partners with Cisco Preferred Partner Status Across All Six Portfolio Designations in the Cisco 360 Partner Program,140512182,https://s.yimg.com/rz/stage/p/yahoo_finance_en-US_h_p_finance_2.png,CSCO,Yahoo,"BOSTON, June 03, 2026--NWN, the leading AI-powered technology solutions provider, today announced continued momentum in its strategic partnership with Cisco, including achieving Preferred Partner status across all six Cisco portfolios within Cisco’s new Cisco 360 Partner Program. The company will also showcase its joint innovation with Cisco at Cisco Live and take the stage alongside Cisco at InfoComm 2026, reinforcing its leadership in delivering secure, intelligent experiences for modern enter",https://finnhub.io/api/news?id=d572af6ecadfcc012abb9b2928e140f932786ce8e69121f71d0f9fe44a201ebf
company,1780490700,LTM Launches Managed Secure Service Edge (SSE) Solution with Cisco,140512183,https://s.yimg.com/rz/stage/p/yahoo_finance_en-US_h_p_finance_2.png,CSCO,Yahoo,"LAS VEGAS & MUMBAI, India, June 03, 2026--LTM, the Business Creativity partner to the world’s largest enterprises, launches its new Managed Secure Service Edge solution at Cisco Live 2026.",https://finnhub.io/api/news?id=bd1ce41a420026ef459e7032a9d34a50553a9ba3eab4904492e0bdafb90afb5e
company,1780489800,ePlus Demonstrates Enterprise-Grade Agentic AI Platform for Autonomous IT and Security Operations at Cisco Live,140512184,https://s.yimg.com/rz/stage/p/yahoo_finance_en-US_h_p_finance_2.png,CSCO,Yahoo,"ePlus inc. (NASDAQ NGS: PLUS) (news) today announced that it unveiled and demonstrated newly created AgenticOps technology, developed with Cisco and NVIDIA, that delivers an enterprise-grade, self-contained Agentic AI platform which organizations can deploy safely and securely in their own environment.",https://finnhub.io/api/news?id=c711fd1c2c28e4caf86a26fc53d6601c1a2341f4e4d9610e82bfaff7d6182a1d
company,1780489502,How Corning Turned Glass Into Gold,140512185,https://s.yimg.com/rz/stage/p/yahoo_finance_en-US_h_p_finance_2.png,CSCO,Yahoo,"If you were asked to name the stock that returned +305% in the last twelve months, you might guess a hot chip designer or a buzzy software name. You would probably not guess Corning (GLW), the maker of glass and ceramics. Yet here we are. While the S&P 500 managed a respectable +30% gain, GLW significantly outperformed both the broader market and its industry peers.",https://finnhub.io/api/news?id=49ebc2ee1bbba76d1dab2f7aa99782f15041828ba790b1cbe597e8f8d9d14f21
company,1780488000,NetApp and Cisco Accelerate and Secure AI Innovation,140512187,https://s.yimg.com/rz/stage/p/yahoo_finance_en-US_h_p_finance_2.png,CSCO,Yahoo,"SAN JOSE, Calif., June 03, 2026--NetApp® (NASDAQ: NTAP), the Intelligent Data Infrastructure company, and Cisco (NASDAQ: CSCO) today announced that they have collaborated to offer new validated solutions for secure, scalable, and simplified AI. Expanding the proven success of FlexPod, the new solutions provide a simple, reliable path for enterprises to address the specific challenges AI workloads place on compute, network, and storage infrastructure.",https://finnhub.io/api/news?id=bec187918e2609e24d40eee91009325c34cd6b69cff1d31df7fa410f23d2b0e9
company,1780488000,NetApp and Cisco Collaboration Strengthens Defense-in-Depth for Enterprise Cyber Resilience,140512186,https://s.yimg.com/rz/stage/p/yahoo_finance_en-US_h_p_finance_2.png,CSCO,Yahoo,"SAN JOSE, Calif., June 03, 2026--NetApp® (NASDAQ: NTAP), the Intelligent Data Infrastructure company, and Cisco (NASDAQ: CSCO), today announced an expansion of their collaboration to help customers strengthen defense-in-depth strategies for customers. Combining Intelligent Data Infrastructure with advanced analytics and observability capabilities, NetApp and Splunk have delivered deep, real-time visibility into storage and infrastructure health. Together, they are helping customers turn operatio",https://finnhub.io/api/news?id=cd7359cd45368f39d6f91baaf2c1711702bf4913df1c5304a15ad4b9ab0b1683
company,1780480978,LiveOne Expands Collaboration With AT&T And Cisco To Power In Vehicle Entertainment Through Connected Car Platform,140513680,,CSCO,Benzinga,LiveOne (NASDAQ:LVO) today announced an expanded collaboration with AT&amp;T (NYSE:T) and Cisco (NASDAQ:CSCO) to support next-generation in-vehicle entertainment experiences through AT&amp;T&#39;s Connected Car™,https://finnhub.io/api/news?id=6913998a6f5fea3ecfc45af3989ace2724059f23b8e7a01575c144248b1b8671
company,1780478822,"After Dell And HPE's AI-Fueled Surge, Is Cisco The Next 1990s Tech Giant To Break Out?",140515706,https://cdn.benzinga.com/files/images/story/2026/06/03/Cisco-Systems.jpeg?width=2048&height=1536,CSCO,Benzinga,Dell and HPE roughly doubled in a month on AI server demand while Cisco lagged. Now eleven Wall Street firms have raised Cisco price targets.,https://finnhub.io/api/news?id=dc376e9a85585566e1f29e14ad2b2e89bd395276d193aa8aa2aa44196ffc90d1
company,1780474811,HSBC Upgrades Cisco Systems (CSCO) on Surging AI Infrastructure Demand,140510885,https://s.yimg.com/rz/stage/p/yahoo_finance_en-US_h_p_finance_2.png,CSCO,Yahoo,"Cisco Systems, Inc. (NASDAQ:CSCO) ranks among the best most active stocks to buy according to hedge funds. On May 15, HSBC boosted Cisco Systems Inc.’s (NASDAQ:CSCO) rating to Buy and hiked its price target to $137 from $77, citing a stronger-than-expected AI infrastructure demand pattern that has significantly changed the company’s growth profile. Analyst Stephen […]",https://finnhub.io/api/news?id=873eb624cab64b07550b40412e920c0b61b2e4a962ee5e83d5ab17e4ad25ccec
company,1774339802,NetApp Announces Strategic Alliance With Commvault To Deliver Enterprise Data Protection And Cybersecurity,140079375,,CSCO,Benzinga,,https://finnhub.io/api/news?id=91885764079b94d60ad1a459fe5b34ed4f180bdcbbbd50e18c20218f19c046ac
company,1780466842,"Cisco And Palo Alto Could Be Major Winners From Anthropic's Mythos AI, According To Jim Cramer",140515452,https://cdn.benzinga.com/files/images/story/2026/06/03/Los-Angeles--California---March-29--2024.jpeg?width=2048&height=1536,CSCO,Benzinga,"Jim Cramer says Cisco and Palo Alto have more room to run, citing Anthropic&#39;s Mythos AI as a catalyst for both.",https://finnhub.io/api/news?id=eadefba9eca790a84aff4ea9538b77d962cb1b0498500d8551422780eea3ed36
company,1780452105,CNBC Daily Open: Records upon records for major markets,140514042,https://image.cnbcfm.com/api/v1/image/108314730-17803334992026-06-01t150042z_1743563887_rc21llar1k89_rtrmadp_0_usa-stocks.jpeg?v=1780333539&w=1920&h=1080,CSCO,CNBC,"Wall Street marks another round of fresh record highs, but will new trade tensions and deadlock over Iran start to take the shine off the AI trade?",https://finnhub.io/api/news?id=9465b7bc4f4007781dbea4389ce356a0da60f5fb457d048e5b78c2d8d3fa0b7a
company,1780445697,Cisco Systems (CSCO) Is Up 8.2% After Record AI-Focused Quarter And New Cloud Control Platform – Has The Bull Case Changed?,140508742,https://s.yimg.com/rz/stage/p/yahoo_finance_en-US_h_p_finance_2.png,CSCO,Yahoo,"Cisco Systems recently reported record quarterly revenue with earnings above analyst expectations, raised its AI infrastructure orders target, and filed a US$41.20 million shelf registration for ESOP-related common stock offerings. The company also launched its AI-powered Cisco Cloud Control and Live Protect platforms, underscoring a push to tie networking, automation, and cybersecurity into a unified AI-centric infrastructure offering. We’ll now examine how Cisco’s new Cloud Control AI...",https://finnhub.io/api/news?id=ce57339760155335262a846de23860059962170a85376a44449723cf4ea94104
