category,datetime,headline,id,image,related,source,summary,url
company,1780518251,Inside India newsletter: Why Taiwan and South Korea's stock markets have surged past India within a week,140524581,https://image.cnbcfm.com/api/v1/image/102539725-176924300.jpg?v=1532564326&w=1920&h=1080,KO,CNBC,"The Indian equity market is losing favour with global investors, as its domestic consumption story weakens and the country lags in AI.",https://finnhub.io/api/news?id=a4b1564c5533717f592008460c67552bdc050bcfb5349f4d40f4669d43811d19
company,1780517100,Coke's $10B India IPO Plan Pops the Top on Hidden Value,140529227,https://s.yimg.com/rz/stage/p/yahoo_finance_en-US_h_p_finance_2.png,KO,Yahoo,The Coca-Cola Company plans to spin off its Indian bottling unit to unlock massive latent equity value and drive long-term structural margin expansion.,https://finnhub.io/api/news?id=086630d11ab92854205e2f9d9f8d34bb8ecf62edc31aa3d09a4feef97254311a
company,1780513802,What's going on in today's session: dow jones movers,140515847,https://www.chartmill.com/images/uploads/CM_Top_Movers_Small_free_2b4ff2fc22.webp,KO,ChartMill,Join us in exploring the top gainers and losers within the dow jones index one hour before the close of the markets on Wednesday as we examine the latest happenings in today's session.,https://finnhub.io/api/news?id=f12eae3674694cf425f50d042292f0735b68447f2c30d7b4dfe9d35bd11e5ca5
company,1780508856,Costco adds an exclusive Coca-Cola soda rival,140514986,https://s.yimg.com/rz/stage/p/yahoo_finance_en-US_h_p_finance_2.png,KO,Yahoo,"The soda wars used to mean Coke versus Pepsi. Back in the 1990s, and even into the 2000s, alternative soda brands were novelties, and energy drinks weren't even a major category. Now, Keurig Dr Pepper has become a significant rival to Coca-Cola and PepsiCo, and energy brands including Red Bull, ...",https://finnhub.io/api/news?id=0148f92ab58f220c610607c51c962203132ca5f1678132b655fd07c673abf426
company,1780504802,Top dow jones movers in Wednesday's session,140513835,https://www.chartmill.com/images/uploads/CM_Top_Movers_Small_free_2b4ff2fc22.webp,KO,ChartMill,Join us in exploring the top gainers and losers within the dow jones index in the middle of the day on Wednesday as we examine the latest happenings in today's session.,https://finnhub.io/api/news?id=7e1cb0184f6aeb9ddbe16925bff29adde63c5afab579bff30d0eeaf1f3ab0d26
company,1780494003,Is Coca-Cola (KO) Outperforming Other Consumer Staples Stocks This Year?,140513253,https://s.yimg.com/rz/stage/p/yahoo_finance_en-US_h_p_finance_2.png,KO,Yahoo,Here is how Coca-Cola (KO) and Shiseido Co. (SSDOY) have performed compared to their sector so far this year.,https://finnhub.io/api/news?id=ec349d087289d61df12fb254618873905a58b2664d36cf531fa9ec7a93b572b9
company,1780493100,Coca-Cola Stock Rises 12.1% YTD: Buy Now or Wait for a Pullback?,140513254,https://s.yimg.com/rz/stage/p/yahoo_finance_en-US_h_p_finance_2.png,KO,Yahoo,"KO shares are climbing on steady demand, disciplined pricing and innovation, but a premium valuation raises the pullback question.",https://finnhub.io/api/news?id=1d4b8c2506a212c930167a7e5a100e79e080aa5e2dbc5f71c471e45bd7e13967
company,1780491603,CocaCola Company (The) (KO) is Attracting Investor Attention: Here is What You Should Know,140513255,https://s.yimg.com/rz/stage/p/yahoo_finance_en-US_h_p_finance_2.png,KO,Yahoo,"Recently, Zacks.com users have been paying close attention to Coca-Cola (KO). This makes it worthwhile to examine what the stock has in store.",https://finnhub.io/api/news?id=41b3b2ff082cdf76a67506187251ba63d188b1015a336a3a2aa1ccbea5a1bd35
company,1780483412,"How a 48-Year-Old Engineer Could Replace a $150,000 Salary With Dividend Growth Plus Covered Calls",140511454,https://s.yimg.com/rz/stage/p/yahoo_finance_en-US_h_p_finance_2.png,KO,Yahoo,"A senior software engineer earning $150,000 annually at age 48 still has approximately 15 to 20 years before reaching a traditional retirement age. The central question is straightforward: how much capital is required to replace that salary with investment income, and what type of portfolio structure makes the most sense when there is still enough ... How a 48-Year-Old Engineer Could Replace a $150,000 Salary With Dividend Growth Plus Covered Calls",https://finnhub.io/api/news?id=43a9ddc2fac34d6404744a1b39ced94b3565573023b8bd0f9ec541795eb1120c
