category,datetime,headline,id,image,related,source,summary,url
company,1780499716,Why Regulating Capital And Serving Burgers Are Both Getting Tougher In China,140517618,https://cdn.benzinga.com/files/images/story/2026/06/03/-3-6-2026-142810-thebambooworks-com.jpeg?width=2048&height=1536,MCD,Benzinga, ,https://finnhub.io/api/news?id=23c693962977076d9b411c8e07e9ba370898e99640651486ee4b7fdaa3efd170
company,1780498800,"BridgeCore Capital Finances McDonald's Property in Saraland, Alabama",140513283,https://s.yimg.com/rz/stage/p/yahoo_finance_en-US_h_p_finance_2.png,MCD,Yahoo,"BEVERLY HILLS, CA - June 3, 2026 (NEWMEDIAWIRE) - BridgeCore Capital, Inc. today announced it has closed a $1,400,000 acquisition financing of a McDonald's property in Saraland, Alabama. The borrower secured the property at a price below fair market ...",https://finnhub.io/api/news?id=8c229c6f4fec4fee3af85d2762812a45f83d661105eb813cb265449faa67176f
company,1780488869,Morgan Flatley Joins Constellation Brands Board As Marketing Focus Grows,140512258,https://s.yimg.com/rz/stage/p/yahoo_finance_en-US_h_p_finance_2.png,MCD,Yahoo,"Constellation Brands (NYSE:STZ) has appointed Morgan Flatley, a senior marketing leader from McDonald's Corporation, to its Board of Directors. Flatley will serve as an independent director, bringing experience in global brand building and consumer marketing. The appointment is part of Constellation Brands' ongoing board refreshment process. Constellation Brands, trading at $136.76, has seen the stock decline 7.4% over the past week and 10.5% over the past month. The share price is also...",https://finnhub.io/api/news?id=8c5c11815475771fca36984d96b57299bba7d70559d98114a777d79d5931bc81
company,1780479660,How McDonald’s is serving up culture as part of its new strategic plan,140512259,https://s.yimg.com/rz/stage/p/yahoo_finance_en-US_h_p_finance_2.png,MCD,Yahoo,Activations around a Nike sneaker release and box office smash “Backrooms” demonstrate how the fast-food giant uses social media marketing.,https://finnhub.io/api/news?id=e72df6260fb205d78c4739fd1d6eebe0bddbc0ed02a2ecdd710f3b828fe54ca4
company,1780477767,McDonald’s unveils new ‘McDonald’s > NEXT’ growth strategy,140510922,https://s.yimg.com/rz/stage/p/yahoo_finance_en-US_h_p_finance_2.png,MCD,Yahoo,The new strategy will emphasise on automation and increasing the hospitality standards to support growth.,https://finnhub.io/api/news?id=fafe0659fa31f6b59925e1bab23bd3604952b462c5637334cf7320595add7f9f
company,1780451264,How Is Chipotle Mexican Grill's Stock Performance Compared to Other Consumer Cyclical Stocks?,140510935,https://s.yimg.com/rz/stage/p/yahoo_finance_en-US_h_p_finance_2.png,MCD,Yahoo,"While Chipotle Mexican Grill has underperformed relative to its peers over the past year, Wall Street analysts maintain a moderately optimistic outlook on the stock’s prospects.",https://finnhub.io/api/news?id=168954c2ef766c7088f53fe1c3a6902f91ab5ffb616235d58cc2f43ab81d3a5f
