category,datetime,headline,id,image,related,source,summary,url
company,1780531173,"ServiceNow and Snowflake Shares Are Falling, What You Need To Know",140518983,https://s.yimg.com/rz/stage/p/yahoo_finance_en-US_h_p_finance_2.png,NOW,Yahoo,"A number of stocks fell in the afternoon session after software stocks declined for a second consecutive session, extending the profit-taking that began earlier in the week.",https://finnhub.io/api/news?id=3dc99374a8121f3b0af4be652813ea9064192a06700b3b9bbead5ff40fee71a0
company,1780523518,"ServiceNow, Inc. (NOW) Presents at 2026 Evercore Global TMT Conference Transcript",140518902,https://static.seekingalpha.com/assets/og_image_1200-29b2bfe1a595477db6826bd2126c63ac2091efb7ec76347a8e7f81ba17e3de6c.png,NOW,SeekingAlpha,"ServiceNow, Inc. (NOW) 2026 Evercore Global TMT Conference June 3, 2026 5:10 PM EDTCompany ParticipantsGaurav Rewari - Senior VP and GM of Data &...",https://finnhub.io/api/news?id=a4fb51a23e0e40a9ddca675c12d9544584f848bb8f086214dce520926543b516
company,1780518946,Stocks Retreat as US-Iran Peace Hopes in Doubt,140519416,https://s.yimg.com/rz/stage/p/yahoo_finance_en-US_h_p_finance_2.png,NOW,Yahoo,"The S&P 500 Index ($SPX ) (SPY ) on Wednesday closed down -0.74%, the Dow Jones Industrial Average ($DOWI ) (DIA ) closed down -1.21%, and the Nasdaq 100 Index ($IUXX ) (QQQ ) closed down -0.29%. June E-mini S&P futures (ESM26 ) fell -0.78%, and June E-mini Nasdaq futures...",https://finnhub.io/api/news?id=c15b07df8063ea06404970f3a0d4374997f18827fce4fa4ca71d0429485a266d
company,1780518747,Wall Street Snaps Record Rally Amid Re-Escalation in Middle East Conflict,140517164,https://s.yimg.com/rz/stage/p/yahoo_finance_en-US_h_p_finance_2.png,NOW,Yahoo,US equities snapped their record-setting rally on Wednesday as renewed hostilities in the Middle Eas,https://finnhub.io/api/news?id=bc5ac53e46e05872dbb87f3109f778a5ef26e5c2962f1c89eb30e24121fda034
company,1780513500,Wednesday's session: top gainers and losers in the S&P500 index,140515846,https://www.chartmill.com/images/uploads/CM_Top_Movers_Small_free_2b4ff2fc22.webp,NOW,ChartMill,Uncover the latest developments among S&P500 stocks in today's session. Stay tuned to the S&P500 index's top gainers and losers on Wednesday.,https://finnhub.io/api/news?id=6f8333afdbbc628a16bfbf77815d296ed2239843acfb739d18bf69da09e2db13
company,1780512600,Marvell’s AI Moment Raises a Bigger Question for Amazon and ServiceNow,140527289,https://s.yimg.com/rz/stage/p/yahoo_finance_en-US_h_p_finance_2.png,NOW,Yahoo,"Tech remains the strongest market segment, rising on the strength of AI as spending spreads to nuts and bolts plays throughout the stack.",https://finnhub.io/api/news?id=bccad41c713d3c0f0e9ce1a43db66c6c5ecf636a422346801f58fa7c413c16db
company,1780506723,"ServiceNow, Inc. (NOW) Presents at Bank of America 2026 Global Technology Conference Transcript",140516877,https://static.seekingalpha.com/assets/og_image_1200-29b2bfe1a595477db6826bd2126c63ac2091efb7ec76347a8e7f81ba17e3de6c.png,NOW,SeekingAlpha,"ServiceNow, Inc. (NOW) Bank of America 2026 Global Technology Conference June 3, 2026 2:20 PM EDTCompany ParticipantsGina Mastantuono - President &...",https://finnhub.io/api/news?id=9ee416e8974d9ae81747a3496a84cbce26fd1bd8063128ad57c2356b334e2289
company,1780504318,"ServiceNow, Inc. (NOW) Presents at 46th Annual William Blair Growth Stock Conference Transcript",140516580,https://static.seekingalpha.com/assets/og_image_1200-29b2bfe1a595477db6826bd2126c63ac2091efb7ec76347a8e7f81ba17e3de6c.png,NOW,SeekingAlpha,"ServiceNow, Inc. (NOW) 46th Annual William Blair Growth Stock Conference June 3, 2026 1:00 PM EDTCompany ParticipantsAmit Zavery - President, Chief Product...",https://finnhub.io/api/news?id=38d978ae574b5bfe5ddd4163e41bd667cd7d0ae6fe36d860acced034d0eab08b
company,1780504200,City Year Receives $2.5M Grant from ServiceNow to Power Student Success and Build Future-Ready Talent Pipelines,140515102,https://s.yimg.com/rz/stage/p/yahoo_finance_en-US_h_p_finance_2.png,NOW,Yahoo,"Three-part investment spans student coaching, workforce pathways, and AI-enabled operational innovation across six U.S. markets and the U.K City Year Receives $2.5M Grant from ServiceNow to Power Student Success and Build Future-Ready Talent Pipelines Three-part investment spans student coaching, workforce pathways, and AI-enabled operational innovation across six U.S. markets and the U.K Boston, June 03, 2026 (GLOBE NEWSWIRE) -- City Year today announced a $2.5 million grant from ServiceNow (NY",https://finnhub.io/api/news?id=18887b26b495b1f70bfd8ae7235f2297f5241510cfc28974533a397d63786448
company,1780502891,ServiceNow Deepens Everbridge xMatters AI Ties In Critical Workflows,140515103,https://s.yimg.com/rz/stage/p/yahoo_finance_en-US_h_p_finance_2.png,NOW,Yahoo,"ServiceNow (NYSE:NOW) expanded its partnership with Everbridge's xMatters platform, integrating AI-driven digital operations for automated incident response and workflow orchestration. The companies are combining capabilities across digital environments so customers can coordinate and resolve incidents in real time using AI. This development has not been widely highlighted in prior coverage focused on AI partnerships, growth narratives, or financials. For you as an investor, this relates to...",https://finnhub.io/api/news?id=415638581e59fe5b69b78e55214f1ff91846871cddb9ba1a98d1fc7590744c25
company,1780499967,Stocks Fall on Escalation of US-Iran Hostilities,140517249,https://s.yimg.com/rz/stage/p/yahoo_finance_en-US_h_p_finance_2.png,NOW,Yahoo,"The S&P 500 Index ($SPX ) (SPY ) today is down -0.40%, the Dow Jones Industrial Average ($DOWI ) (DIA ) is down -0.74%, and the Nasdaq 100 Index ($IUXX ) (QQQ ) is down -0.08%. June E-mini S&P futures (ESM26 ) are down -0.48%, and June E-mini Nasdaq futures...",https://finnhub.io/api/news?id=8e0eeea37dc5e4a18989382aba354fb4747c08ecfc61e2ee0d1891492342b086
company,1780499405,ServiceNow vs Palantir: Which Enterprise AI Stock Belongs in a Retirement Portfolio?,140513102,https://s.yimg.com/rz/stage/p/yahoo_finance_en-US_h_p_finance_2.png,NOW,Yahoo,"ServiceNow (NYSE: NOW) and Palantir Technologies (NASDAQ: PLTR) sit on opposite ends of the enterprise artificial intelligence (AI) spectrum, so the question is simple: which one belongs in a retirement portfolio that prioritizes capital preservation and long-term compounding? This is a valuation stress test, not a growth race. Let’s run the numbers. Dimension 1: Valuation ... ServiceNow vs Palantir: Which Enterprise AI Stock Belongs in a Retirement Portfolio?",https://finnhub.io/api/news?id=881d70aa180a28e41c7a1388a1a6b90f4c766d9e49f4eef60a7a329d5ff9c206
company,1780498800,Microsoft Build 2026 Is Really Just One Big AI Stress Test,140523567,https://s.yimg.com/rz/stage/p/yahoo_finance_en-US_h_p_finance_2.png,NOW,Yahoo,"Microsoft Build 2026 highlights the company's push for AI self-sufficiency as investors weigh Azure, Copilot, and long-term AI optionality",https://finnhub.io/api/news?id=f61577a718dfa6f5a76ec522aac261db82b811cd21137700493a1f2cf7d9cd9e
company,1780495356,ServiceNow: The Ultimate AI Control Tower Trading At A Discount,140515267,https://static.seekingalpha.com/cdn/s3/uploads/getty_images/2250419256/image_2250419256.jpg?io=getty-c-w1536,NOW,SeekingAlpha,"ServiceNow, Inc. cautious Buy: AI + Nvidia partnership could fuel growth and cut costs amid âSaaS apocalypseâ risks. Click for more on NOW stock opportunities.",https://finnhub.io/api/news?id=4a75179fabe05ce8f10e4b27e94092f5aa7b88232438e0f4eaac4b8fa1686a35
company,1780492200,"MongoDB Is the Latest SaaS Apocalypse Victim to Say ""Not Today""",140522547,https://s.yimg.com/rz/stage/p/yahoo_finance_en-US_h_p_finance_2.png,NOW,Yahoo,"MongoDB's blowout quarter is the latest proof that the SaaSpocalypse trade was built on fear rather than fundamentals, and the recovery is only getting started.",https://finnhub.io/api/news?id=7456e99f6733fb9b8663f10709a7faffc44df2bb28baac42d51693dbd481398b
company,1780491827,Why ServiceNow Stock Skyrocketed 41% in May,140512064,https://s.yimg.com/rz/stage/p/yahoo_finance_en-US_h_p_finance_2.png,NOW,Yahoo,The market is recognizing that it may have made a mistake in discounting the company's opportunities.,https://finnhub.io/api/news?id=107133698dc312227e5681798688a7ecacd97eb78d52a20fe3d7f383553fc19e
company,1780489800,Everbridge xMatters Expands Collaboration with ServiceNow to Accelerate Incident Response,140512287,https://s.yimg.com/rz/stage/p/yahoo_finance_en-US_h_p_finance_2.png,NOW,Yahoo,"VIENNA, Va., June 03, 2026--Everbridge, the global leader in High Velocity Critical Event Management (CEM), today announced an expanded collaboration between Everbridge xMatters and ServiceNow, the AI control tower for business reinvention, to help organizations automate response workflows and accelerate incident resolution across digital environments.",https://finnhub.io/api/news?id=67a900047cb7ea7f0026480385e3b7de36e98084b2798112606417dca6bafed1
company,1780484781,May AI Kill SaaS--But It Will Supercharge ServiceNow's Growth,140512918,https://static.seekingalpha.com/cdn/s3/uploads/getty_images/2198179711/image_2198179711.jpg?io=getty-c-w1536,NOW,SeekingAlpha,"ServiceNow (NOW) remains a BUY as AI adoption accelerates, driving both revenue growth and profitability beyond seat-based models.",https://finnhub.io/api/news?id=c8561d84f23d0da45709ede13028040b95ccbb2f6dc0f08c8ff757d9256f8f2a
company,1780473600,5 Things To Consider Ahead Of Anthropic's IPO,140511587,https://static.seekingalpha.com/cdn/s3/uploads/getty_images/2270277028/image_2270277028.jpg?io=getty-c-w1536,NOW,SeekingAlpha,"Anthropic is preparing for a high-profile IPO, with recent funding rounds suggesting a potential $1â2.45T valuation. Read why post-IPO volatility is likely.",https://finnhub.io/api/news?id=880638a4129ae93ac08ded2f0b3f33f1fa2e8a4e1e318b8556d5bebe325c5efc
company,1780470571,"Huang's Trillion-Dollar Sentence, Software's Cold Shower, and a Cyber Beat After the Bell",140510557,https://www.chartmill.com/images/uploads/THUMBNAILS_CHARTMILL_1000_528_78_a15f1e4377.webp,NOW,ChartMill,"One sentence from Jensen Huang added roughly $50 billion in market cap to a single chip stock on Tuesday. The same CEO who blessed software on Monday and watched the sector rip, kept his mouth shut on Tuesday and watched half of those names give it all back. If you wanted a clean illustration of how concentrated the influence inside this tape has become, you got it.",https://finnhub.io/api/news?id=0a89b5f94f2390ffd0f2aabc709171244cec383197b6af29a77d7bfdf4ac9554
company,1780464420,"Wall Street Dumped This Magnificent ETF, but It's Making a Roaring Comeback With a 40% Gain Since April 10",140509903,https://s.yimg.com/rz/stage/p/yahoo_finance_en-US_h_p_finance_2.png,NOW,Yahoo,Investors might have overestimated the impact of artificial intelligence on the software industry.,https://finnhub.io/api/news?id=e97f6e71caf7e80c5867bb1eb06559bb0874db04fec3eb62e3448ed98c8d35ad
