category,datetime,headline,id,image,related,source,summary,url
company,1780500380,Why Jim Cramer Says Newly Public FedEx Freight Stock Could Be a ‘True Winner’,140517252,https://s.yimg.com/rz/stage/p/yahoo_finance_en-US_h_p_finance_2.png,ODFL,Yahoo,Jim Cramer says newly public FedEx Freight could become a “true winner” as Wall Street bets the trucking giant’s spinoff from FedEx will finally unlock the premium valuation.,https://finnhub.io/api/news?id=7889e1f06e2247188d475cb63301dd67732959f819f9c2976772fa0e29044030
company,1780497288,Old Dominion’s May update shows an improving LTL market,140513426,https://s.yimg.com/rz/stage/p/yahoo_finance_en-US_h_p_finance_2.png,ODFL,Yahoo,"Old Dominion Freight Line’s May operating results saw a meaningful improvement from April, as less-than-truckload demand appears to be firming. The post Old Dominion’s May update shows an improving LTL market appeared first on FreightWaves.",https://finnhub.io/api/news?id=5a70f0a110ccff20bc897a63b440d004fb27cf067559adf9c59cfa20c258ede3
company,1780492142,"Final Trades: AbbVie, Goldman Sachs, Old Dominion and the IYE",140514133,https://image.cnbcfm.com/api/v1/image/108316161-17805060471780506045-46328278120-1080pnbcnews.jpg?v=1780506046&w=1920&h=1080,ODFL,CNBC,The Investment Committee give you their top stocks to watch for the second half.,https://finnhub.io/api/news?id=b430d093eb46b282de44997db183ca5bb59d9771961ab1e05b3974c18167bdb4
company,1780484400,Old Dominion Freight Line Provides Update for Second Quarter 2026,140511532,https://s.yimg.com/rz/stage/p/yahoo_finance_en-US_h_p_finance_2.png,ODFL,Yahoo,"THOMASVILLE, N.C., June 03, 2026--Old Dominion Freight Line, Inc. (Nasdaq: ODFL) today reported certain less-than-truckload (""LTL"") operating metrics for May 2026. Revenue per day increased 12.3% as compared to May 2025 due to an increase in our LTL revenue per hundredweight that was partially offset by a 3.8% decrease in LTL tons per day. The change in LTL tons per day was attributable to a 5.3% decrease in LTL shipments per day that was partially offset by a 1.6% increase in LTL weight per shi",https://finnhub.io/api/news?id=44cea045f9d7ff7d056ca8c53d14c3f23b0c8ed20af35ce2c6b64a86b9c19625
company,1780471800,This Market Looks Insane: But It's A Stock Picker's Dream,140511280,https://static.seekingalpha.com/cdn/s3/uploads/getty_images/2251246152/image_2251246152.jpg?io=getty-c-w1536,ODFL,SeekingAlpha,"The market is dominated by AI-driven growth, leading to extreme valuations and concentration in a handful of stocks. Click here to read more on my analysis.",https://finnhub.io/api/news?id=304bf626a0e2b1364ab64334ee1e559837bbaa982ad0d2f64ae589877802e0e0
company,1780471068,Old Dominion Freight Line Reports Certain Less-Than-Truckload Operating Metrics For May 2026; Revenue Per Day Rises 12.3% Over May 2025 Due To Increase In LTL Revenue Per Hundredweight,140517607,,ODFL,Benzinga,"Old Dominion Freight Line, Inc. (NASDAQ:ODFL) today reported certain less-than-truckload (&#34;LTL&#34;) operating metrics for May 2026. Revenue per day increased 12.3% as compared to May 2025 due to an increase in our LTL",https://finnhub.io/api/news?id=cc7660f951d7ca2dcab855971544f958dbb68ffc7e833cc1d6c6b3a91ae55135
