category,datetime,headline,id,image,related,source,summary,url
company,1780530308,HSBC Downgrades Thermo Fisher Scientific (TMO),140518545,,TMO,Fintel,,https://finnhub.io/api/news?id=d2c6345553096af97fe8d69d363a8774b61aa3f60748bfd2a15fb75f2001d6ae
company,1780508640,QuidelOrtho's Respiratory Exposure Remains a Key Near-Term Risk,140516134,https://s.yimg.com/rz/stage/p/yahoo_finance_en-US_h_p_finance_2.png,TMO,Yahoo,"QDEL's Q1 results show how a milder respiratory season can pressure revenue, margins and cash flow despite stable testing market share.",https://finnhub.io/api/news?id=5813039c55b88d7012fb53810d45059d4e63091412b3a2a8741cc0f2466ae78a
company,1780494944,"Yum! Brands upgraded, Chipotle downgraded: Wall Street's top analyst calls",140512429,https://s.yimg.com/rz/stage/p/yahoo_finance_en-US_h_p_finance_2.png,TMO,Yahoo,"Yum! Brands upgraded, Chipotle downgraded: Wall Street's top analyst calls",https://finnhub.io/api/news?id=463cebdd2f99abffd071c69212bff0b73e4bb73dd8dab30539e1a539653e509c
company,1780494055,"HSBC Downgrades Thermo Fisher Scientific to Hold, Lowers Price Target to $540",140514818,,TMO,Benzinga,HSBC  analyst Sidharth Sahoo   downgrades Thermo Fisher Scientific (NYSE:TMO) from Buy to Hold and lowers the price target from $670 to $540.,https://finnhub.io/api/news?id=8674810b40959d817c6abd4105a3854fd6d2e72ed6b5fb8817777b4b08ad65dc
company,1780475400,"[Latest] Global CRISPR-based Gene Editing Market Size/Share Worth USD 12.6 Billion by 2034 at a 13.01% CAGR: Custom Market Insights (Analysis, Outlook, Leaders, Report, Trends, Forecast, Segmentation, Growth, Growth Rate, Value)",140510923,https://s.yimg.com/rz/stage/p/yahoo_finance_en-US_h_p_finance_2.png,TMO,Yahoo,"[220+ Pages Latest Report] According to a market research study published by Custom Market Insights, the demand analysis of Global CRISPR-based Gene Editing Market size & share revenue was valued at approximately USD 3.65 Billion in 2024 and is expected to reach USD 4.10 Billion in 2025 and is expected to reach around USD 12.6 Billion by 2034, at a CAGR of 13.01% between 2025 and 2034. The key market players listed in the report with their sales, revenues and strategies are CRISPR Therapeutics A",https://finnhub.io/api/news?id=cca80a5c004868e3bfb58a51ba1732fbebc0c3490598ce048f867cf533d86e54
