category,datetime,headline,id,image,related,source,summary,url
company,1780507592,Thursday's big stock stories: What’s likely to move the market in the next trading session,140524340,https://image.cnbcfm.com/api/v1/image/108274234-1772723601571-gettyimages-2264128812-raa-broadcom260303_nptOa.jpeg?v=1772723626&w=1920&h=1080,WBD,CNBC,The S&P 500 snapped a nine-day winning streak on Wednesday as rising Treasury yields and oil prices kept stocks under pressure.,https://finnhub.io/api/news?id=01d1c57e6af907f669c7b72840fccb6939b0f867635a875cd4d21264eca17025
company,1780503216,This Cash-Generating Media Juggernaut Is a “No-Brainer” Buy Under $30,140515161,https://s.yimg.com/rz/stage/p/yahoo_finance_en-US_h_p_finance_2.png,WBD,Yahoo,"With major indexes pushing fresh highs, large-cap media stocks under $30 stand out as one of the last corners of the market where contrarian value still hides in plain sight. Wall Street has spent two years pricing legacy TV operators for terminal decline, but the cash flow statements keep telling a very different story. For ... This Cash-Generating Media Juggernaut Is a “No-Brainer” Buy Under $30",https://finnhub.io/api/news?id=940b3e06f0ee936639ef09e8b25d50f1e4318174a3e7f9eda34a4dbbf15435ef
company,1780492293,1 Unpopular Stock That Should Get More Attention and 2 We Avoid,140512339,https://s.yimg.com/rz/stage/p/yahoo_finance_en-US_h_p_finance_2.png,WBD,Yahoo,Wall Street’s bearish price targets for the stocks in this article signal serious concerns. Such forecasts are uncommon in an industry where maintaining cordial corporate relationships often trumps delivering the hard truth.,https://finnhub.io/api/news?id=7305dddb95aebed71ef66bc1b402dc326057123053b4f76b03e3ed758f46e506
company,1780471982,100 Million Households Later And Wall Street Still Underestimates Roku,140511273,https://static.seekingalpha.com/cdn/s3/uploads/getty_images/1221721830/image_1221721830.jpg?io=getty-c-w1536,WBD,SeekingAlpha,"Roku (ROKU) expands live sports with FOX One ahead of World Cup coverage, boosting engagement across 100M households.",https://finnhub.io/api/news?id=15845620b85028924bf26fba8d3f779858ad3fa0fcb1837f80f9f946f7424fff
company,1780450793,CBS fires veteran correspondent Scott Pelley amid turmoil over direction of '60 Minutes',140514308,https://image.cnbcfm.com/api/v1/image/108137388-1745853553011-gettyimages-2151212544-_h2_9356_exihm4cy.jpeg?v=1745853607&w=1920&h=1080,WBD,CNBC,"CBS News has fired high-profile ""60 Minutes"" correspondent Scott Pelley amid debate about the direction of the show, a mainstay of the network.",https://finnhub.io/api/news?id=2729ccf7f830b9b1bbdaecf8238633718fa0a02cc7be4ddb9d1655327752fa77
