category,datetime,headline,id,image,related,source,summary,url
company,1780431300,"Agilent Receives FDA Approval for Expanded Use of PD-L1 IHC 22C3 pharmDx on Dako Omnis in Esophageal Squamous Cell Carcinoma, Triple-Negative Breast Cancer, Cervical Cancer, and Gastric or Gastroesophageal Junction Adenocarcinoma",140506286,https://s.yimg.com/rz/stage/p/yahoo_finance_en-US_h_p_finance_2.png,A,Yahoo,"SANTA CLARA, Calif., June 02, 2026--Agilent Technologies Inc. (NYSE: A) today announced that the U.S. Food and Drug Administration (FDA) has approved the expanded use of PD-L1 IHC 22C3 pharmDx, Code GE006, for use on the Dako Omnis platform to aid in identifying patients in the United States with esophageal squamous cell carcinoma (ESCC)3, triple-negative breast cancer (TNBC)4, cervical cancer5, and gastric or gastroesophageal junction (GEJ) adenocarcinoma6, who may be eligible for treatment wit",https://finnhub.io/api/news?id=f722ede611063af2813ae21a021d470fe22ade6ed725b3dfd915c7f7e8ef6757
company,1780409128,"B of A Securities Maintains Buy on Agilent Technologies, Raises Price Target to $155",140503960,,A,Benzinga,B of A Securities  analyst Derik De Bruin   maintains Agilent Technologies (NYSE:A) with a Buy and raises the price target from $145 to $155.,https://finnhub.io/api/news?id=2c23f1c204cd0ee1b35e7cf3b9cf440570a0df3a97a39ea1a892cabdd94f6a33
company,1780408814,"Is Now The Time To Look At Buying Agilent Technologies, Inc. (NYSE:A)?",140500700,https://s.yimg.com/rz/stage/p/yahoo_finance_en-US_h_p_finance_2.png,A,Yahoo,"Today we're going to take a look at the well-established Agilent Technologies, Inc. ( NYSE:A ). The company's stock...",https://finnhub.io/api/news?id=706bf0e7e90ee6bbe1813e07c8461c2678057b6537e8077669b84108eb2313f8
company,1780388460,"Laboratory Equipment Services Market by Service Type, Service Provider, Equipment Type, Contract Type - Global Forecast to 2030",140497797,https://s.yimg.com/rz/stage/p/yahoo_finance_en-US_h_p_finance_2.png,A,Yahoo,"The global laboratory equipment services market is set to soar, reaching USD 35.4 billion by 2030, expanding from USD 18 billion in 2025, with a CAGR of 14.5%. This growth is spurred by increased R&D investments, higher healthcare spending, and technological advancements. The Asia-Pacific region leads with the highest CAGR, fueled by robust infrastructure growth in countries like China and India. Dominating segments include analytical equipment and the comprehensive Gold Support Plan. Key driver",https://finnhub.io/api/news?id=66a8eadc68df74cecb62019d1e8b03797767c3b9784d916cc4142ca16cdeb8e5
company,1780385105,Wolfe Research Assumes Agilent Technologies at Peer Perform,140503961,,A,Benzinga,Wolfe Research  analyst Mike Polark   assumes Agilent Technologies (NYSE:A) with a Peer Perform rating.,https://finnhub.io/api/news?id=ca8c060be89adfd3bba15228a5bb573b19febeade5f1a63e93172b6e6ba3b576
