category,datetime,headline,id,image,related,source,summary,url
company,1778065590,AMD Stock Hits New All-Time Highs: Well Positioned 'To Ride That Demand Wave',140192741,https://cdn.benzinga.com/files/images/story/2026/05/06/Charlotte--North-Carolina---November-11-_1.jpeg?width=2048&height=1536,AMD,Benzinga,"AMD stock hit new all-time highs Wednesday after Q1 results. Analysts update their price targets, with more upside predicted ahead.",https://finnhub.io/api/news?id=68e3ba840ef8af8bf345fba24bd1323abd15b1cec7887490a0ffa12c365c8856
company,1778065283,"RBC Capital Maintains Sector Perform on Advanced Micro Devices, Raises Price Target to $400",140198033,,AMD,Benzinga,RBC Capital  analyst Srini Pajjuir   maintains Advanced Micro Devices (NASDAQ:AMD) with a Sector Perform and raises the price target from $325 to $400.,https://finnhub.io/api/news?id=e4692411c65846d482fd8e023e92530b17d21744dc4dd43d252e3ad2c654d5e5
company,1778065119,AMD and Intel Extend Rally Despite RSI Flashing Overbought for Weeks,140188072,https://s.yimg.com/rz/stage/p/yahoo_finance_en-US_h_p_finance_2.png,AMD,Yahoo,AMD jumps 18% pre-market after Q1 beat while Intel hits an all-time high. RSI readings stay overbought as the rally extends.,https://finnhub.io/api/news?id=5cb8c1ca69abe26c76fca816610f079785f7ceb47d534872e72689ad238765ba
company,1778064900,"Welcome To Shareholder Meeting Month: AI, Oil, And The Consumer Are In The Spotlight",140190847,https://static.seekingalpha.com/cdn/s3/uploads/getty_images/1675752126/image_1675752126.jpg?io=getty-c-w1536,AMD,SeekingAlpha,A busy docket of Annual General Meetings follows what has been a very strong Q1 earnings season. Read more here.,https://finnhub.io/api/news?id=c30f819832b7ca3138fb254a7e2c7f031160516b15234f40e1e60fe460752e15
company,1778063953,AMD jumps 17% as AI-driven data center growth fuels earnings beat and analyst upgrades,140188055,https://s.yimg.com/rz/stage/p/yahoo_finance_en-US_h_p_finance_2.png,AMD,Yahoo,"Advanced Micro Devices (NASDAQ:AMD) surged roughly 17% in premarket trading on Wednesday after the chipmaker delivered quarterly results and forward guidance that exceeded Wall Street expectations, driven largely by booming demand from the artificial intelligence sector. Investor enthusiasm accelerated after chief executive Lisa Su highlighted strong momentum in AMD’s server and data center operations during the company’s earnings call.",https://finnhub.io/api/news?id=e9705dc385ae162c678e32f914a4dab89022ec934e04b2ed19907fa73d0c98f5
company,1778063947,"Davita, Bloomin' Brands, Compass And Other Big Stocks Moving Higher On Wednesday",140190794,https://cdn.benzinga.com/files/images/story/2026/05/06/Milan--Italy---August-10--2017-Davita-Lo.jpeg?width=2048&height=1536,AMD,Benzinga,"Dow Jones up 500 points, DaVita Inc (DVA) shares rise after better-than-expected earnings and raised guidance. Other gaining stocks include EVC, BLMN, MNKD, FLEX, HUT, AVTX, COMP, VCYT, and SSRM.",https://finnhub.io/api/news?id=a9c0fa15b8491817febcdab2dad06647a52fb674ab90c6a495a055eec846297f
company,1778063944,"Barclays Maintains Overweight on Advanced Micro Devices, Raises Price Target to $500",140198035,,AMD,Benzinga,Barclays  analyst Tom O&#39;Malley   maintains Advanced Micro Devices (NASDAQ:AMD) with a Overweight and raises the price target from $300 to $500.,https://finnhub.io/api/news?id=06567f2fd306e4688395933a6bc050b1b92c8681f562a880a9fa4168339c1f6f
company,1778063852,AMD's Su explains what's behind massive forecast change as stock roars 15% on earnings,140192556,https://image.cnbcfm.com/api/v1/image/108302935-1778074131329-LisaSu5.jpg?v=1778074231&w=1920&h=1080,AMD,CNBC,"CEO Lisa Su highlighted the growing demand for central processing units, doubling her long term forecast after strong first-quarter earnings.",https://finnhub.io/api/news?id=87dad083f88d93fce846fd0578914ed836c75704cde8d20b14cc3937fe4f15f9
company,1778063562,"Wells Fargo Maintains Overweight on Advanced Micro Devices, Raises Price Target to $505",140198036,,AMD,Benzinga,Wells Fargo  analyst Aaron Rakers   maintains Advanced Micro Devices (NASDAQ:AMD) with a Overweight and raises the price target from $345 to $505.,https://finnhub.io/api/news?id=0e79bb490d840b6945c02a496ed6519f2e53785794835f293e5cbf724317a2dc
company,1778063352,AMD upgrades flood in after chipmaker lifts outlook on strong AI demand,140188074,https://s.yimg.com/rz/stage/p/yahoo_finance_en-US_h_p_finance_2.png,AMD,Yahoo,"Investing.com -- Advanced Micro Devices received upgrades from both Goldman Sachs and Bernstein after the chipmaker reported stronger-than-expected first-quarter results and provided a robust second-quarter outlook, with analysts pointing to agentic AI as a key driver of the company’s accelerating growth.",https://finnhub.io/api/news?id=0e9eafbcb0a24d41030264d0e27dc0c95eb345e57c67c0401a7e1e5382ee2c24
company,1778063345,"Market Open: May 6, 2026",140192557,https://image.cnbcfm.com/api/v1/image/108302982-4ED1-NewsOPEN-050626.jpg?v=1778077425&w=1920&h=1080,AMD,CNBC,"CNBC brings you fast, accurate, and actionable business news and market updates.",https://finnhub.io/api/news?id=88fcab502ddb091b00a3b8286936468535c7f7fc8a5861c68399fbb45eb309e2
company,1778062811,"Despite higher energy prices, there's an opportunity in travel stocks, says Janus' Jeremiah Buckley",140192559,https://image.cnbcfm.com/api/v1/image/108302971-17780768881778076885-45746936033-1080pnbcnews.jpg?v=1778076888&w=1920&h=1080,AMD,CNBC,"Jeremiah Buckley, equities portfolio manager at Janus Henderson, joins 'Squawk on the Street' to discuss technology themes, his top picks in travel stocks, and more.",https://finnhub.io/api/news?id=b83ad3ef8267b4b56474f33a7d0f2dc60b854f4619f8ac5da8a7e423bcb14f33
company,1778062507,The AMD Inflection Is Here,140190536,https://static.seekingalpha.com/cdn/s3/uploads/getty_images/2254246642/image_2254246642.jpg?io=getty-c-w1536,AMD,SeekingAlpha,"AMD Q2 outlook: 46% YoY growth, booming EPYC server CPUs, MI450 AI GPUs and hyperscaler wins.",https://finnhub.io/api/news?id=c66c4f8c0202d499ed7ec60a53087a08a9fba20d21ca0c94d80bd550713dbff1
company,1778062407,Mag 7 Pop as Tech Stocks Rally Drives Record Gains,140188075,https://s.yimg.com/rz/stage/p/yahoo_finance_en-US_h_p_finance_2.png,AMD,Yahoo,"Chip makers helped the Nasdaq hit a record closing high on Tuesday, and strong earnings from Advanced Micro Devices looked set to keep the rally in tech stocks going. Futures tracking the Nasdaq 100 were up 1.",https://finnhub.io/api/news?id=fff2242902196b992af0f508835c6fefa040744851c4c21592bb5f3febc0cc26
company,1778062324,"Susquehanna Maintains Positive on Advanced Micro Devices, Raises Price Target to $450",140198037,,AMD,Benzinga,Susquehanna  analyst Christopher Rolland   maintains Advanced Micro Devices (NASDAQ:AMD) with a Positive and raises the price target from $375 to $450.,https://finnhub.io/api/news?id=1ba79f039d203afe8945cb9445187ce0050a56aa84f0e6f8cdcb088875701678
company,1778061880,"OpenAI Collaborates With Microsoft, AMD, Intel, Nvidia, Broadcom To Roll Multipath Reliable Connection Working Protocol",140191937,,AMD,Benzinga,https://x.com/OpenAI/status/2052025532485902368?s=20,https://finnhub.io/api/news?id=6fd3cca2bd88c64fb497e4f1ed28f41ee9db4e76cafe8f38afc9b4fb3f307020
company,1778061840,"These Stocks Are Today’s Movers: AMD, Intel, SMCI, Arista, Lucid, Novo Nordisk, and More",140188076,https://s.yimg.com/rz/stage/p/yahoo_finance_en-US_h_p_finance_2.png,AMD,Yahoo,Shares in Advanced Micro Devices and Intel surge after AMD CEO Lisa Su flags surging demand for central processing units.,https://finnhub.io/api/news?id=eaa07a6efe7040dcbfe0a390d96a5740e97b6aa7a84d5ac98b6f44af18905113
company,1778061680,"Benchmark Maintains Buy on Advanced Micro Devices, Raises Price Target to $485",140198039,,AMD,Benzinga,Benchmark  analyst Cody Acree   maintains Advanced Micro Devices (NASDAQ:AMD) with a Buy and raises the price target from $325 to $485.,https://finnhub.io/api/news?id=ff56f5488f23b17fa72a0dfda99b7428d226c698463b7d9b3b7c2e1bfb1fb735
company,1778061581,Riot Platforms: Data Center Transition Set To Accelerate Through 2027,140190251,,AMD,SeekingAlpha,,https://finnhub.io/api/news?id=748191e717c660f4cbc152549eb7b7390aa9fcf41b827d5effc605ea43417b68
company,1778061214,What's Going On With Intel Stock Wednesday?,140191939,https://cdn.benzinga.com/files/images/story/2026/05/06/Santa-Clara--Ca--Usa---Nov-22--2023-Inte.jpeg?width=2048&height=1536,AMD,Benzinga,"Intel taps Qualcomm veteran Alex Katouzian to lead Client Computing &amp; AI. Plus, INTC stock extends its bullish run to fresh 52-week highs.",https://finnhub.io/api/news?id=7a745773b87648e4d84a4028baf6f0dd54ff8c7119eaf03bc226aea21afa8bf9
company,1778060788,"Dow Jones Futures Rise, Oil Prices Dive Below $100 On Report That U.S.-Iran Deal Close; AMD Soars On Earnings",140186831,https://s.yimg.com/rz/stage/p/yahoo_finance_en-US_h_p_finance_2.png,AMD,Yahoo,"Dow Jones futures: President Trump ""paused"" his Hormuz effort with a U.S.-Iran deal reportedly close. AI stocks AMD, Astera Labs jumped on earnings.",https://finnhub.io/api/news?id=b4b8e09657dab75c2d3ac4ba31255191643fe144f2366d39adb9d76c413f7d79
company,1778060597,AMD CEO Lisa Su: Agents are driving tremendous demand in the AI cycle,140192855,https://image.cnbcfm.com/api/v1/image/108302924-1778073838912-1778073695-45746068381-hd.jpg?v=1778073840&w=1920&h=1080,AMD,CNBC,"AMD CEO Lisa Su joins 'Squawk on the Street' to discuss AI compute demand, the company's latest earnings results, and more.",https://finnhub.io/api/news?id=b38644de84bc5481ccfe6aa7312403a09347b67c6d7a0fbbb910ba899b1528a4
company,1778060548,"Opening Bell: May 6, 2026",140192856,https://image.cnbcfm.com/api/v1/image/108302940-17780743371778074335-45746241129-1080pnbcnews.jpg?v=1778074337&w=1920&h=1080,AMD,CNBC,"Watch the opening bell for the New York Stock Exchange and the Nasdaq from May 6, 2026.",https://finnhub.io/api/news?id=b9082bebfac4e07d92c4ed2d14df7b9f25a337ca7e662d32196403c362b1b5d6
company,1778060409,AMD forecast sparks AI‑driven rally in US chipmaker stocks,140186821,https://s.yimg.com/rz/stage/p/yahoo_finance_en-US_h_p_finance_2.png,AMD,Yahoo,"U.S. semiconductor stocks rose on Wednesday as Advanced Micro Devices' strong outlook boosted investor confidence about sustained demand for AI infrastructure and that a ‌shift toward CPUs would spur the next leg of spending. AMD jumped nearly 18% in premarket ‌trading and is on track to hit a record high if gains hold in market hours, while rival Intel rose 6%. Chip designer Arm Holdings soared 11%, while Qualcomm gained about 4%.",https://finnhub.io/api/news?id=4a765b686963d1bd24f9e0ce340789740582013e65308c66e7eb2b627dc1e563
company,1778059667,"U.S. futures rise after Trump pauses Hormuz mission; AMD rallies on AI-driven earnings beat: Dow Jones, S&P, Nasdaq, Wall Street",140186840,https://s.yimg.com/rz/stage/p/yahoo_finance_en-US_h_p_finance_2.png,AMD,Yahoo,U. S. stock futures moved higher on Wednesday after President Donald Trump paused a military initiative aimed at reopening the Strait of Hormuz and signalled progress toward a possible peace agreement with Iran.,https://finnhub.io/api/news?id=1475a7c57664b900947dbb7c6bca116ce808505d28b0539c39ea46cd821ae920
company,1778059566,"Live On CNBC, AMD CEO Says Very Bullish On What Al Can Do For Companies; Honored To Have OpenAI And Meta As Partners; We Think CPU Market Will Be Over $120B By 2030; Agents Are Driving Tremendous Demand In The Al Cycle; We Are Seeing That Inflection Point In The Market",140198041,,AMD,Benzinga,-CNBC,https://finnhub.io/api/news?id=9945aa2f017326d178c48ab5a6b5bf12758645252a9b5c705b7b65e760e180a3
company,1778059304,"Buy now, ask questions later: CPU stocks soar on AMD’s blowout results, guidance",140186841,https://s.yimg.com/rz/stage/p/yahoo_finance_en-US_h_p_finance_2.png,AMD,Yahoo,"Investing.com -- Advanced Micro Devices forecast second-quarter revenue above Wall Street expectations on Tuesday, driven by strong demand for its data center chips. Shares rose 17% in premarket trading on Wednesday.",https://finnhub.io/api/news?id=46bdcb4d9d4e61d793161aeeaee97a12735a16e62c6e718bf7df812b0bd647c3
company,1778058881,Arm Stock Jumps Ahead Of Earnings As AI Demand Continues To Accelerate,140191028,https://cdn.benzinga.com/files/images/story/2026/05/06/Arm-Holdings-Plc.jpeg?width=2048&height=1536,AMD,Benzinga,"Arm stock rises ahead of Q4 earnings as AI demand, analyst upgrades and bullish technical signals drive investor focus.",https://finnhub.io/api/news?id=81458d371a70d9969f90db9886b765cfaf91f672eeceb8f129b00dd43e1cd16b
company,1778058578,"Stock Market Today: S&P 500, Dow, Nasdaq Futures Rise As Trump Pauses 'Project Freedom'— Super Micro Computer, AMD, Intel In Focus  (UPDATED)",140192281,https://cdn.benzinga.com/files/images/story/2026/05/06/Wall-Street.jpeg?width=2048&height=1536,AMD,Benzinga,"(Editor’s note: The future prices of benchmark tracking ETFs, and the headline, the lede and the economic were updated in the story.)",https://finnhub.io/api/news?id=d312157e4b5fa6cb9347b0bea159726ff2d5c4b4a900b0ae897f775d00facf09
company,1778057929,"Keybanc Maintains Overweight on Advanced Micro Devices, Raises Price Target to $530",140198044,,AMD,Benzinga,Keybanc  analyst John Vinh   maintains Advanced Micro Devices (NASDAQ:AMD) with a Overweight and raises the price target from $330 to $530.,https://finnhub.io/api/news?id=ce90229368a1695cf811a35c68aa630f492be94b3ca24d84c612049359b8c81a
company,1778057047,"Mizuho Maintains Outperform on Advanced Micro Devices, Raises Price Target to $415",140198045,,AMD,Benzinga,Mizuho  analyst Vijay Rakesh   maintains Advanced Micro Devices (NASDAQ:AMD) with a Outperform and raises the price target from $280 to $415.,https://finnhub.io/api/news?id=665bfa8591c3b6ff3c70872426394236ce21bfa910e2b65c1958f0da8b389080
company,1778057033,"Rosenblatt Maintains Buy on Advanced Micro Devices, Raises Price Target to $490",140198046,,AMD,Benzinga,Rosenblatt  analyst Kevin Cassidy   maintains Advanced Micro Devices (NASDAQ:AMD) with a Buy and raises the price target from $300 to $490.,https://finnhub.io/api/news?id=def0a853c58432705018e9a07e2ab40a3ef9c8762b2a3f43fd826ec18e1aaa11
company,1778057018,AMD : Gets a Buy rating from Jefferies,140188962,,AMD,Finnhub,"In a research note published by Blayne Curtis, Jefferies advises its customers to buy the stock. The target price is reviewed upwards from USD 300 to USD 415.",https://finnhub.io/api/news?id=8ca75dea479ea3780e89a2abe142e1c66fe4a37b93d10d9fff5dc089c4e4c9f3
company,1778056905,AMD : Barclays gives a Buy rating,140188925,,AMD,Finnhub,"In a research note published by Tom O'Malley, Barclays advises its customers to buy the stock. The target price is increased from USD 300 to USD 500.",https://finnhub.io/api/news?id=f32f1844621a052a7fad2b0de2d688004d32b8e2f17534f46a13b03775331329
company,1778056778,AMD : Upgraded to Buy by Bernstein,140188819,,AMD,Finnhub,Bernstein raises his rating from Neutral to Buy. The target price has been raised from USD 265 to USD 525.,https://finnhub.io/api/news?id=47c1fcbe8c359ff60a7f2827f1fddf50c704aa8cd250a5309807b93e0f26d7aa
company,1778056699,"Wedbush Maintains Outperform on Advanced Micro Devices, Raises Price Target to $450",140198047,,AMD,Benzinga,Wedbush  analyst Matt Bryson   maintains Advanced Micro Devices (NASDAQ:AMD) with a Outperform and raises the price target from $400 to $450.,https://finnhub.io/api/news?id=bd04f5fb79bcd6a0a0fca90633895ccc011c6c0a580e45c90a494068adf090e1
company,1778056233,"DA Davidson Maintains Buy on Advanced Micro Devices, Raises Price Target to $425",140198048,,AMD,Benzinga,DA Davidson  analyst Gil Luria   maintains Advanced Micro Devices (NASDAQ:AMD) with a Buy and raises the price target from $375 to $425.,https://finnhub.io/api/news?id=4777690cf3dad6ae86e75d482c0cbd177c585ababbb9356b7fd8913503b9189f
company,1778056140,"Seaport Global Upgrades Advanced Micro Devices to Buy, Announces $430 Price Target",140198049,,AMD,Benzinga,Seaport Global  analyst Jay Goldberg   upgrades Advanced Micro Devices (NASDAQ:AMD) from Neutral to Buy and announces $430 price target.,https://finnhub.io/api/news?id=8d3bb5e0e40bd1ca7fce7d60c60d92cfdcc3726d249c85a8fb9a7946799c7198
company,1778054769,12 Information Technology Stocks Moving In Wednesday's Pre-Market Session,140190333,https://cdn.benzinga.com/files/images/story/2025/11/06/movers_4.jpg?width=2048&height=1536,AMD,Benzinga, ,https://finnhub.io/api/news?id=b6b09364678413d366409274cea44c3ed9f838706e04bf07f0ec95202e7e6c19
company,1778053969,"Micron Stock Climbs On Cramer's Bullish Take: AI Storage Demand Secular, Not Cyclical",140192389,https://cdn.benzinga.com/files/images/story/2026/05/06/Micron-Technology-Logo-Displayed-On-A-Mo.jpeg?width=2048&height=1536,AMD,Benzinga,"Micron (MU) stock pushes past $674 in premarket trading. Discover why CNBC&#39;s Jim Cramer believes the AI storage boom is a structural shift, and why analysts are targeting $1,000.",https://finnhub.io/api/news?id=a7f5daae2e69c703b3f5443c965375498df8905da7986b8b27de061e7d03c87c
company,1778053968,AMD : JP Morgan sticks Neutral,140187981,,AMD,Finnhub,JP Morgan's research confirms his advice and maintains his neutral opinion on the stock. The target price is reviewed upwards from USD 270 to USD 385.,https://finnhub.io/api/news?id=cddd7b6641033a653a24f10f7d1c33f83fa557e141c81cad0278156bdd8abb11
company,1778053623,S&P 500 and Nasdaq Head for Record as Chip Stocks Rally Rages On,140186842,https://s.yimg.com/rz/stage/p/yahoo_finance_en-US_h_p_finance_2.png,AMD,Yahoo,"Stocks looked set to extend their record-breaking run on Wednesday after chip maker Advanced Micro Devices posted strong first-quarter earnings and President Donald Trump signaled there had been progress in peace talks between the U.S. and Iran.  S&P 500 futures added 0.3%, and contracts tied to the tech-heavy Nasdaq 100 jumped 0.7%.  The S&P 500 and Nasdaq both closed at all-time highs on Tuesday as chip stocks racked up sizable gains, and AMD’s rock-solid results could extend the rally.",https://finnhub.io/api/news?id=5f125f5f86bb6d44ccf9abcec2e83fc791968d9926b5272212af2f10b1740eae
company,1778053153,"Stifel Maintains Buy on Advanced Micro Devices, Raises Price Target to $450",140198052,,AMD,Benzinga,Stifel  analyst Ruben Roy   maintains Advanced Micro Devices (NASDAQ:AMD) with a Buy and raises the price target from $320 to $450.,https://finnhub.io/api/news?id=270369213cd04b8585926c5060718dabdea2c5eb5de5dec11a5d9427e24bb5ac
company,1778053090,"Record Highs, Punished Results, and One Very Consequential Apple Rumor",140198580,https://www.chartmill.com/images/uploads/THUMBNAILS_CHARTMILL_1000_528_30_e0925ebfb2.webp,AMD,ChartMill,"Tuesday delivered one of those sessions that looks clean in the headline numbers but gets more interesting the closer you look. New records across the board, a chip sector on fire, and two companies that reported strong quarterly results only to watch their stocks fall 7–8%.",https://finnhub.io/api/news?id=539c5b599a9921d7c86c63513194a6a5652f8cd42ef504b9d3f3911a07c47d35
company,1778052774,Will S&P 500 Open Up Or Down On Wednesday?,140194091,https://cdn.benzinga.com/files/images/story/2026/05/06/People-Silhouettes-On-American-Stock-Mar.jpeg?width=2048&height=1536,AMD,Benzinga,"The S&amp;P 500 index climbed to another record high on Tuesday, rising 0.81% to close at 7,259.22, as easing oil prices and upbeat earnings continued to fuel the market rally.",https://finnhub.io/api/news?id=c4e96a28edb3505c41707531073e10e20aca04de4c349287426d091d66d82c54
company,1778052515,AMD : Buy rating from Bank of America,140187732,,AMD,Finnhub,Bank of America is positive on the stock with a Buy rating. The target price has been raised to USD 450 from USD 310.,https://finnhub.io/api/news?id=7d31aee7c7855a72ae625170aa2bdd2a1245c0dccaa0f4d0782526895cc991d4
company,1778051747,Market-Moving News for May 6th,140190798,,AMD,Benzinga,AMD: 21% | Advanced Micro Devices shares are trading higher after the company reported better-than-expected Q1 financial results and issued Q2 sales guidance above estimates. AVTX: 64% | Avalo Therapeutics,https://finnhub.io/api/news?id=60cdf9c59b3c24572bff2922b0e97204e671a56b03279d9b011b14a7e5a9a30f
company,1778051431,"Morgan Stanley Maintains Equal-Weight on Advanced Micro Devices, Raises Price Target to $410",140198055,,AMD,Benzinga,Morgan Stanley  analyst Joseph Moore   maintains Advanced Micro Devices (NASDAQ:AMD) with a Equal-Weight and raises the price target from $360 to $410.,https://finnhub.io/api/news?id=169e756d68799ab2a378dc2789bcbe914ca5bbd5c710c8e2b80649e84567590b
company,1778050323,Wall Street Breakfast Podcast: Soda & Chips: McDonald's And AMD In Focus,140187464,https://static.seekingalpha.com/cdn/s3/uploads/getty_images/2208746424/image_2208746424.jpg?io=getty-c-w1536,AMD,SeekingAlpha,"McDonald's adds barista-style role to stores as part of refreshers & crafted soda launch. AMD shoots up as Q1 results, guidance top estimates. Apple to pay $250M to settle with shareholders.",https://finnhub.io/api/news?id=06a21afbd4511fd3bf25201e1aeb33dfef51be9856898ca9da59bc898f4d29cc
company,1778050032,Peter Sarlin’s QuTwo reaches $380M valuation in angel round,140186006,https://s.yimg.com/rz/stage/p/yahoo_finance_en-US_h_p_finance_2.png,AMD,Yahoo,"QyTw0, the Finnish AI lab founded by former AMD Silo AI CEO Peter Sarlin, is now valued at €325 million (approximately $380 million) after raising a €25 million angel round ($29 million). It's a sign of enduring tailwinds for AI, quantum computing, and sovereign tech, especially for Europe-made companies.",https://finnhub.io/api/news?id=552085cdb0bbb67d9e42da708110f2510e41c65fbc2de5d50919566b81b4bad6
company,1778049686,Advanced Micro Devices Data Center Business Just Went Beast Mode,140191889,https://cdn.benzinga.com/files/images/story/2026/05/06/Charlotte--North-Carolina---November-11-.jpeg?width=2048&height=1536,AMD,Benzinga,AMD stock hits a new 52-week high after Q1 earnings beat. Data center revenue jumps 57% as AI demand fuels a massive &#34;server renaissance.&#34;,https://finnhub.io/api/news?id=4b14119cfe082f8d96dd8e870554dbeccc957ddc360f4daa0cb76eb7d4acdb05
company,1778049000,Arm Reports Earnings as It Shifts Its Business Model,140185984,https://s.yimg.com/rz/stage/p/yahoo_finance_en-US_h_p_finance_2.png,AMD,Yahoo,"Arm reports earnings Wednesday as investors focus on its move into data center CPUs, a business shift that could put the chip-design company in competition with some of its own customers.",https://finnhub.io/api/news?id=5f00baa8d55c162e4c78e3c7d3a0f750c0747b0caca3ce52cf68aa2848e8e8f0
company,1778048684,"Cramer's AI Winners List: From Nvidia To Dell, These Stocks Are Cashing In Big",140190738,https://cdn.benzinga.com/files/images/story/2026/05/06/Creative-Ai-Background-With-Forex-Chart-_0.jpeg?width=2048&height=1536,AMD,Benzinga,"Jim Cramer breaks down the AI and data center boom, identifying top winners in chips, cloud computing, and power infrastructure. Read more.",https://finnhub.io/api/news?id=4677e54b64e7fcf57abf4aa958a87b37fdb001d9b4bfca8d4d818f1f7f7337eb
company,1778045781,"Goldman Sachs Upgrades Advanced Micro Devices to Buy, Raises Price Target to $450",140198058,,AMD,Benzinga,Goldman Sachs  analyst James Schneider   upgrades Advanced Micro Devices (NASDAQ:AMD) from Neutral to Buy and raises the price target from $240 to $450.,https://finnhub.io/api/news?id=e0f58beed89fa489a0d9c55cfffcc90081adff58f7699b7aff7d62c14438f030
company,1778045196,Why Is Super Micro Stock Soaring Wednesday?,140191950,https://cdn.benzinga.com/files/images/story/2026/05/06/Super-Micro-Computer-logo-on-smartphone.jpeg?width=2048&height=1536,AMD,Benzinga,SMCI shares jump 17% premarket on upbeat Q4 guidance. Discover why Super Micro is raising the bar for AI data center profits.,https://finnhub.io/api/news?id=76f8b6627b82b65472d3338f7847b6d8d0159fb7a706152e38e60cb3ab287423
company,1778041657,AMD : Upgraded to Buy by Goldman Sachs,140186210,,AMD,Finnhub,Goldman Sachs's analyst James Schneider has upgraded his rating from Neutral to Buy. The target price has been raised from USD 240 to USD 450.,https://finnhub.io/api/news?id=619740f5283962b21536f4fde7107183329c1acb7de628b8f0e218b86127ab93
company,1778040144,"Lisa Su Says AMD Has Secured Critical AI Memory Supply, But Rising Prices Threaten PC And Gaming Demand",140198060,https://cdn.benzinga.com/files/images/story/2026/05/06/Amd-Chairman-And-Ceo-Lisa-Su-Delivers-Th.jpeg?width=2048&height=1536,AMD,Benzinga,AMD said it has secured sufficient memory supply for its AI growth but warned that rising prices could pressure PC and gaming demand.,https://finnhub.io/api/news?id=27d97bdc86b32aa38df26f0daa7a0c1499650977d908dd2c2a2a00eac8b1d748
company,1778038064,"Walt Disney, AMD And 3 Stocks To Watch Heading Into Wednesday",140190340,https://cdn.benzinga.com/files/images/story/2026/05/06/Tokyo--Japan---December-2--2023-Disney-L.jpeg?width=2048&height=1536,AMD,Benzinga,"U.S. stock futures higher. Kraft Heinz and Super Micro Computer beat earnings estimates, while Disney and AMD report today.",https://finnhub.io/api/news?id=f32e8d415480a9a6f15db6b517d3ab8842f9b5da3163d3e109a862a4d71c55f2
