category,datetime,headline,id,image,related,source,summary,url
company,1778107236,SoftBank shares surge over 18% as Japan tech-fueled rally lifts Nikkei 225 to record highs,140209503,https://image.cnbcfm.com/api/v1/image/108303421-1778122224373-gettyimages-2270790177-str-dailylif260410_np8lS.jpeg?v=1778122243&w=1920&h=1080,AMD,CNBC,The benchmark Nikkei 225 surged over 5% to a record high as Japan reopened after extended Golden Week holidays.,https://finnhub.io/api/news?id=e65f9f51df15669280f5c46d1f80ac93fe2d945178bd52de648f9f9c0a7fabcc
company,1778104680,Arm Stock Takes Wild Ride After Earnings. Demand Might Be Too Strong to Meet.,140199297,https://s.yimg.com/rz/stage/p/yahoo_finance_en-US_h_p_finance_2.png,AMD,Yahoo,"Arm said it would soon see $2 billion in revenue from a new home-made chip, twice its previous estimate.",https://finnhub.io/api/news?id=b6cef0f35668dade7739433edf41a7f9ab714b70e7ca1ea9b83bc4f9a9aa3cfc
company,1778103655,"Stock Market Today, May 6: Markets Break New Ground on Hopes for U.S.-Iran Peace Deal",140197162,https://s.yimg.com/rz/stage/p/yahoo_finance_en-US_h_p_finance_2.png,AMD,Yahoo,"AI-fueled earnings from chipmakers and easing tensions in the Middle East helped power fresh U.S. stock records, today, May 6, 2026.",https://finnhub.io/api/news?id=6e8a39785fe049b3778ebd9f4d537c3f7a44459cc972cf5d23e14d59ed927052
company,1778103372,Dow Jones Futures: Stock Market Hits Highs On Iran-Deal Hopes; Nvidia Leads New Buys; ARM Is Big Earnings Mover,140197163,https://s.yimg.com/rz/stage/p/yahoo_finance_en-US_h_p_finance_2.png,AMD,Yahoo,The S&P 500 and Nasdaq hit new highs on Iran deal hopes. Nvidia leads new buys with Arm a big earnings mover late.,https://finnhub.io/api/news?id=0a2f4649c479b1601317ad2c08966fb81cb9ef9900e2dbd7154677ea92f3c497
company,1778102936,"Stock Market Today, May 6: AMD Surges After Q1 Beat and Strong Q2 Data Center Outlook",140197165,https://s.yimg.com/rz/stage/p/yahoo_finance_en-US_h_p_finance_2.png,AMD,Yahoo,"AMD’s data center revenue jumped 57%, giving investors hard evidence of demand for server CPUs and AI accelerators as the company guided for another strong quarter.",https://finnhub.io/api/news?id=f7d89896c6feb284e95df439087b6bfa4b85fabc7d32b16b501d5ce7e366321c
company,1778101653,"Nasdaq, S&P 500 Hit New Highs as Iran Deal Prospects Brighten",140197166,https://s.yimg.com/rz/stage/p/yahoo_finance_en-US_h_p_finance_2.png,AMD,Yahoo,The Nasdaq Composite and the S&P 500 climbed to new peaks and oil prices tumbled on Wednesday follow,https://finnhub.io/api/news?id=dac67ac169c24e4520adf91ed32c33601c117f84f5095252dd8b8377349f9dcc
company,1778101435,CNBC Daily Open: Peace on the horizon (again?),140209504,https://image.cnbcfm.com/api/v1/image/108302769-1778059076103-gettyimages-2273914248-nikoubazl-dailylif260503_npTL1.jpeg?v=1778059107&w=1920&h=1080,AMD,CNBC,"The U.S. and Iran are close to a memorandum of understanding that would end the war and establish a framework for further negotiations, Axios reported.",https://finnhub.io/api/news?id=e133860ac88e410d3b1502978089553c2d006802113c3d8fd4adbbd99a05f258
company,1778101020,Arm Stock Jumps on Earnings. It’s More Good News for Chips.,140197328,https://s.yimg.com/rz/stage/p/yahoo_finance_en-US_h_p_finance_2.png,AMD,Yahoo,"Arm said it would soon see $2 billion in revenue from a new home-made chip, twice its previous estimate.",https://finnhub.io/api/news?id=ac4e3f3ecaca8bb6fb89ada2dcb659f2dd68baaed1906f8a1ed5c08149d861fe
company,1778100871,"US Equity Indexes Surge as Iran Peace Deal Expectations Rise, AMD's Q1 Boosts Chipmakers",140197329,https://s.yimg.com/rz/stage/p/yahoo_finance_en-US_h_p_finance_2.png,AMD,Yahoo,US equity indexes jumped while crude oil futures sank on Wednesday amid a growing likelihood of Iran,https://finnhub.io/api/news?id=90628263b0150b6b5758ab299f56c9aa4a96665eb90db0eb16e325ceda9a9e01
company,1778099823,Stock Surge on Robust Tech Earnings and US-Iran Peace Hopes,140200690,https://s.yimg.com/rz/stage/p/yahoo_finance_en-US_h_p_finance_2.png,AMD,Yahoo,"The S&P 500 Index ($SPX ) (SPY ) on Wednesday closed up +1.46%, the Dow Jones Industrial Average ($DOWI ) (DIA ) closed up +1.24%, and the Nasdaq 100 Index ($IUXX ) (QQQ ) closed up +2.08%. June E-mini S&P futures (ESM26 ) rose +1.45%, and June E-mini Nasdaq futures...",https://finnhub.io/api/news?id=149387c0c5fdcc24d9a09cb3f0902d0b71aea4dfc6110dca23f916f7eee14cb8
company,1778099722,Cathie Wood sells another $15.6M of surging semiconductor stock,140197282,https://s.yimg.com/rz/stage/p/yahoo_finance_en-US_h_p_finance_2.png,AMD,Yahoo,"Sometimes the hardest part of investing isn't buying. It's not the patience asked of you before the market rewards your move. It’s not even what to invest in, as you may think. It's watching something you sold keep going up to the moon without you. And now you can only stay out and be a spectator. ...",https://finnhub.io/api/news?id=5aeb8474175dc69cefb69c385664cbd9d305ad2317e7dd670875661966b94145
company,1778098979,"Stock Market Today: Nasdaq, S&P 500 Hit New Highs On U.S.-Iran Hopes; Cathie Wood Sells Advanced Micro, CoreWeave (Live Coverage)",140197331,https://s.yimg.com/rz/stage/p/yahoo_finance_en-US_h_p_finance_2.png,AMD,Yahoo,Stock Market Today: The Dow Jones index jumped Wednesday on hopes of a U.S.-Iran deal. AMD stock soared on earnings.,https://finnhub.io/api/news?id=aa4be0b59b9b483219dfe948bb4c0a205d3ae514d65bb347549c41fd6a015058
company,1778098867,7 Stocks Worth Buying the Dip in Now... Or At Least Adding to Your Watchlist,140200691,https://s.yimg.com/rz/stage/p/yahoo_finance_en-US_h_p_finance_2.png,AMD,Yahoo,"While the S&P 500 notched another record close on Tuesday, 17 NYSE and Nasdaq Composite stocks fell to new 52-week lows. Here’s why the seven highest-priced names deserve a spot on your watchlist.",https://finnhub.io/api/news?id=6ff82ef9aa32950d9178204dfdc18f7317f880e766f68584f9529f3c5a28a46c
company,1778098581,"US Equity Markets End Higher as Nasdaq, S&P 500 Hit Records After Reports on US-Iran Peace Deal, Upbeat AMD Results",140197332,https://s.yimg.com/rz/stage/p/yahoo_finance_en-US_h_p_finance_2.png,AMD,Yahoo,"US equity indexes ended higher on Wednesday, with the S&P 500 and the Nasdaq Composite reaching new",https://finnhub.io/api/news?id=4b64c586fd53c474369d770ad9cfd2b910c81ba63886d7a9d859bedf6ebb95c1
company,1778097900,AMD stock surges as the chipmaker forecasts continued AI growth,140197279,https://s.yimg.com/rz/stage/p/yahoo_finance_en-US_h_p_finance_2.png,AMD,Yahoo,Advanced Micro Devices (AMD) stock surges higher on Wednesday after blowing past first quarter earnings estimates and second quarter guidance forecasts. Market Domination Host Josh Lipton and Yahoo Finance Tech Editor Dan Howley sit down to take a closer look at AMD's growth outlook as AI demand pushes chip stocks higher.,https://finnhub.io/api/news?id=8a7e1c0c2b25e497cace25cbc10af00fa6549d4e3457ad53614378846562c093
company,1778097332,"US Equity Indexes Jump as Iran Peace Deal Hopes Increase, AMD's Q1 Results Trigger Rally in Chipmakers",140195049,https://s.yimg.com/rz/stage/p/yahoo_finance_en-US_h_p_finance_2.png,AMD,Yahoo,"US equity indexes jumped ahead of Wednesday's close, with the S&P 500 and the Nasdaq Composite break",https://finnhub.io/api/news?id=d2c1b6be53325f88a4d5b5377a2196d5e0de82f2ec41b4bb945d196103902660
company,1778096730,"Advanced Micro Devices Set to Command Half of Growing Server CPU Market, BofA Says",140194961,https://s.yimg.com/rz/stage/p/yahoo_finance_en-US_h_p_finance_2.png,AMD,Yahoo,Advanced Micro Devices (AMD) is expected to capture about half of the total addressable market for s,https://finnhub.io/api/news?id=ebe03a403c5b2e46f99f676d0a95795a8f2fe4e120195c10271e953bdc8e6588
company,1778096395,S&P 500 and Nasdaq-100 Surge: AMD Earnings Steal the Show at Midday,140194963,https://s.yimg.com/rz/stage/p/yahoo_finance_en-US_h_p_finance_2.png,AMD,Yahoo,"Chip stocks are having a moment, and AMD is leading the charge. Oil prices are tanking, too. Here's what you need to know.",https://finnhub.io/api/news?id=b4bd854604e9aee7803345babdf6d3c87cd45884d70c7d5cd3bba832a0c9b769
company,1778095860,"Intel Has Been on a Tear, but These Chip Stocks Are Having a Better Day",140197323,https://s.yimg.com/rz/stage/p/yahoo_finance_en-US_h_p_finance_2.png,AMD,Yahoo,"Intel stock, Micron, Arm and Qualcomm were all rising as AMD earnings propelled chip companies higher.",https://finnhub.io/api/news?id=63673e48824a56ae188bb8c530859040482546b33639561de3007d9c83a9d168
company,1778095320,Nvidia Shares Are Having a Great Day. It’s Still One of the Year’s Worst in Chip Stocks.,140197335,https://s.yimg.com/rz/stage/p/yahoo_finance_en-US_h_p_finance_2.png,AMD,Yahoo,"Nvidia  was rising early Wednesday amid a broader chip-stocks rally.  While the move pushes it above the psychologically significantly $200 level, it was only a small boost compared with  Advanced Micro Devices  ’ 17% gain on the back of AMD’s strong earnings Tuesday afternoon.  Heading into Wednesday,  Nvidia  has been the single worst performer in the PHLX Semiconductor Sector index, which tracks 30 U.S. chip companies, over both the past month and the past three months through to Tuesday’s close, according to Dow Jones Market Data.",https://finnhub.io/api/news?id=768459b3ba0b03cc050521bfa54949a27e63d9898479a2b67768d8c04e9f2ff8
company,1778095140,Buy the Spike in AMD stock After Strong Q1 Results & Bullish Guidance?,140197286,https://s.yimg.com/rz/stage/p/yahoo_finance_en-US_h_p_finance_2.png,AMD,Yahoo,"Investors applauded AMD's strong Q1 report yesterday evening, with shares spiking over 20% in Wednesday morning's trading session to a new all-time high of $430.",https://finnhub.io/api/news?id=15aca32ada3591e84f7ef732f9d73d1dea5059efd15b3c68f343a833d1612fc9
company,1778094840,AMD Stock Spikes After Earnings. The Chip Maker Is on Track to Surpass a $600 Billion Market Cap.,140197287,https://s.yimg.com/rz/stage/p/yahoo_finance_en-US_h_p_finance_2.png,AMD,Yahoo,AMD’s latest quarter was boosted by revenue growth of 57% in the company’s AI-driven data-center segment.,https://finnhub.io/api/news?id=b7c1913e12863f9b48040bfa777efe3689ed6fa1a554fb7b20d46fa51132794a
company,1778094304,Wednesday's session: top gainers and losers in the S&P500 index,140198713,https://www.chartmill.com/images/uploads/CM_Top_Movers_Small_free_2b4ff2fc22.webp,AMD,ChartMill,"Let's delve into the developments on the US markets one hour before the close of the markets on Wednesday. Below, you'll find the top gainers and losers within the S&P500 index during today's session.",https://finnhub.io/api/news?id=2f3ba7ac4b93a09eb4ebdf551ee3e78e54dbb14ecca215aa142fee88c7bc331e
company,1778093680,"Semiconductor Leaders SOXX, SMH, and FTXL Are Crushing It on AI Infrastructure Demand",140194974,https://s.yimg.com/rz/stage/p/yahoo_finance_en-US_h_p_finance_2.png,AMD,Yahoo,"The semiconductor sector continues to absorb capital at a pace tied to the AI infrastructure buildout, and three exchange-traded funds offer distinct angles on it: iShares Semiconductor ETF (NASDAQ:SOXX), VanEck Semiconductor ETF (NASDAQ:SMH), and First Trust Nasdaq Semiconductor ETF (NASDAQ:FTXL). Each holds Advanced Micro Devices (NASDAQ:AMD), whose Q1 earnings report, released today, reinforces what the ... Semiconductor Leaders SOXX, SMH, and FTXL Are Crushing It on AI Infrastructure Demand",https://finnhub.io/api/news?id=88041426f0cfe116cc1a24681fe7def9e8ca06ba1696db3d52ce8279a1979f62
company,1778092677,The Nasdaq Is Up 3.5% This Month,140195053,https://s.yimg.com/rz/stage/p/yahoo_finance_en-US_h_p_finance_2.png,AMD,Yahoo,"The tech-heavy index was up another 1.8% on Wednesday, bringing its month-to-date gain to 3.5%.  The index is now on pace for its best four-day start to a month since November 2024.  The tech-heavy index was also on pace for a closing high after setting an intraday record of 25,777.38.",https://finnhub.io/api/news?id=ed781f98ec3e9b700286a9b1a6a2c983cc191b6fe3283c45b36c75d65b53d725
company,1778092643,Why Nvidia Stock Popped Today,140195054,https://s.yimg.com/rz/stage/p/yahoo_finance_en-US_h_p_finance_2.png,AMD,Yahoo,Nvidia Jumps on Massive AI Infrastructure Push With $500M Corning Deal,https://finnhub.io/api/news?id=43fefb94bbbae9e64fa69512d059ea6c3b38a4ad424ccd15db300764ea532eb9
company,1778090702,Stay informed about the most active stocks in the S&P500 index on Wednesday's session.,140198711,https://www.chartmill.com/images/uploads/CM_Most_Active_Stocks_Small_free_fec0650b7f.webp,AMD,ChartMill,Looking for the most active S&P500 stocks in today's session? Join us as we dive into the US markets on Wednesday and discover the stocks that are dominating the trading activity and setting the pace for the market.,https://finnhub.io/api/news?id=15101a75c8ee0f1f78ce46150c741a860027a3e895783099f722881c4dfaf8ed
company,1778090460,"AMD Q1 Earnings Beat Estimates, Revenues Rise on Data Center Demand",140195055,https://s.yimg.com/rz/stage/p/yahoo_finance_en-US_h_p_finance_2.png,AMD,Yahoo,"AMD's Q1'26 earnings beat rides on AI-fueled demand, record $5.78B data center sales, margins up, and Q2 revenues guided near $11.2B.",https://finnhub.io/api/news?id=d925787bb33ed37afd0e00f872dc7d746a7a08d65bf9ed621f0347a297eb88d2
company,1778090405,"Equity Markets Rise Intraday, Oil Plunges Amid US-Iran Peace Deal Optimism",140195056,https://s.yimg.com/rz/stage/p/yahoo_finance_en-US_h_p_finance_2.png,AMD,Yahoo,"US benchmark equity indexes were higher intraday, while oil prices tumbled as investors reacted to r",https://finnhub.io/api/news?id=49ac0bd6668a052904c89c8e7f2b6105f5fd4e298eaf2e6e3bd1c21603914479
company,1778090400,Wednesday's session: most active stocks,140198710,https://www.chartmill.com/images/uploads/CM_Most_Active_Stocks_Small_free_fec0650b7f.webp,AMD,ChartMill,Let's have a look at what is happening on the US markets on Wednesday. Below you can find the most active stocks in today's session.,https://finnhub.io/api/news?id=e876ffb949f0f32d18417b9d6877995fae8f763ff1ddb2046b6b46456e097189
company,1778089933,"S&P 500, Nasdaq Hit Records as Iran Steps Closer to Peace Deal, AMD's Q1 Results Fire Up Chipmakers",140193652,https://s.yimg.com/rz/stage/p/yahoo_finance_en-US_h_p_finance_2.png,AMD,Yahoo,"US equity indexes rose after midday Wednesday, with the S&P 500 and the Nasdaq Composite scaling new",https://finnhub.io/api/news?id=98d14016884d68561a0edfdb50f6d665b4616e6c0290a4f4d2184502ab571349
company,1778089343,Tech Up as AI Boom Appears to Gain Steam - Tech Roundup,140197089,,AMD,Finnhub,Shares of technology companies rallied as the artificial-intelligence boom appeared to accelerate. Advanced Micro Devices shares surged after the chip maker posted better-than-expected earnings...,https://finnhub.io/api/news?id=36b45c4d96151ea895c626dd041c8613d0d14f0210161fcca55169fbdc1e16d9
company,1778089297,AMD Tops Estimates as AI Demand Lifts Data Center 57%,140193496,https://s.yimg.com/rz/stage/p/yahoo_finance_en-US_h_p_finance_2.png,AMD,Yahoo,Lisa Su points to inferencing and agentic AI as the forces behind AMD's strongest quarterly beat,https://finnhub.io/api/news?id=c730ae1257ae9e7e54f6789f164c583d785ddef4248ab3f4858ec3d444f6830b
company,1778088815,Stock Market Today: Dow Up 1% On U.S.-Iran Deal Hopes; Berkshire Hathaway Holding Soars (Live Coverage),140193384,https://s.yimg.com/rz/stage/p/yahoo_finance_en-US_h_p_finance_2.png,AMD,Yahoo,Stock Market Today: The Dow Jones index jumped Wednesday on hopes of a U.S.-Iran deal. AMD stock soared on earnings.,https://finnhub.io/api/news?id=7b51b6ba4944a60eabd282bfcf6e5bbe09819ea2965d4aed358ee9931339ae14
company,1778087772,"Nvidia Is a Buy, AMD Is a Hold and Palantir Is a Sell. Here Is the Math Behind Each Call",140193391,https://s.yimg.com/rz/stage/p/yahoo_finance_en-US_h_p_finance_2.png,AMD,Yahoo,"Three of the most-watched AI names point in three different directions at current prices: NVIDIA (NASDAQ:NVDA) at $196.50 looks most attractive on valuation, AMD (NASDAQ:AMD) at $355.26 looks priced for perfection, and Palantir (NASDAQ:PLTR) at $135.91 faces the steepest valuation hurdle. Each rides the same agentic-AI thesis. Valuation and recent price action separate them. Buy ... Nvidia Is a Buy, AMD Is a Hold and Palantir Is a Sell. Here Is the Math Behind Each Call",https://finnhub.io/api/news?id=f2846bca92ade9029ad938e2f4b252d3c31f8a8374ec6f874541633bee47568e
company,1778087097,AMD Rallies On 38% Revenue Surge: 2 Top Undervalued AI Chip Stocks,140196629,https://static.seekingalpha.com/cdn/s3/uploads/getty_images/2254781681/image_2254781681.jpg?io=getty-c-w1536,AMD,SeekingAlpha,"AMDâs Q1 revenue jumped 38%, but its valuation is stretched. Discover two AI chip stocks that deliver similar growth for better value.",https://finnhub.io/api/news?id=2bda8214d0a2bb9a6c513cf37271be1ae63c8e71f6d8d38217d75aec5dcb39b7
company,1778086813,"Hut 8 Surges 35%, Riot Platforms Climbs 13% as Bitcoin Miners Become AI Infrastructure Plays",140193395,https://s.yimg.com/rz/stage/p/yahoo_finance_en-US_h_p_finance_2.png,AMD,Yahoo,"Shares of Hut 8 (NASDAQ:HUT) are surging 35% in midday trading Wednesday. Riot Platforms (NASDAQ:RIOT) stock is climbing 13% in tandem, as investors reprice former Bitcoin mining pure-plays as AI data center landlords. HUT stock changed hands near $109 after opening at $80.51, extending a one-month rally of 67% and a one-year gain of 531%. ... Hut 8 Surges 35%, Riot Platforms Climbs 13% as Bitcoin Miners Become AI Infrastructure Plays",https://finnhub.io/api/news?id=48cc49e2c3e6af33e22020bc4375d2d2efb24f343a24a243d0551e988c2ec0c0
company,1778086757,AMD's Stock Soars to a Fresh Record as AI Demand Drives Up Sales,140195058,https://s.yimg.com/rz/stage/p/yahoo_finance_en-US_h_p_finance_2.png,AMD,Yahoo,Advanced Micro Devices shares rallied to a fresh high Wednesday after the chipmaker beat estimates with its latest quarterly results on growing AI demand.,https://finnhub.io/api/news?id=1c488146e9d50723b1f475b51bfd1987709a84242b70afca2912a5d718cbba24
company,1778086530,Why Is The US Stock Market Up Today?,140193506,https://s.yimg.com/rz/stage/p/yahoo_finance_en-US_h_p_finance_2.png,AMD,Yahoo,"US stock market hit a fresh all-time high on Iran deal hopes, AMD's blowout earnings, and a solid ADP jobs print supporting soft-landing.",https://finnhub.io/api/news?id=c049d34b0f2427c7bf943676cb353344eb0d208e7df0703db12971bc71d63717
company,1778086363,Jim Cramer on AMD: “You Use These Downgrades to Buy”,140193507,https://s.yimg.com/rz/stage/p/yahoo_finance_en-US_h_p_finance_2.png,AMD,Yahoo,"Advanced Micro Devices, Inc. (NASDAQ:AMD) was one of the stocks Jim Cramer looked at during Mad Money’s episode. Cramer highlighted the increase in demand due to the data centers, as he stated: The CPU companies are similar. For a long time, we had a CPU glut that constantly weighed on Intel and AMD, the two […]",https://finnhub.io/api/news?id=91c8496b4b0b628162b94ca64bb43142fc7b3e6b28b5c8c2c75e002cc750947f
company,1778085654,"S&P 500, Nasdaq Break Records as Iran Peace Deal Reportedly in Offing, AMD Helps Boost Technology",140193509,https://s.yimg.com/rz/stage/p/yahoo_finance_en-US_h_p_finance_2.png,AMD,Yahoo,"US equity indexes rose after midday Wednesday, with the S&P 500 and the Nasdaq Composite scaling new",https://finnhub.io/api/news?id=a1780847bb717a1b327a434e4db388345bc92d84cda0370bb47618b53080ca0b
company,1778085622,"'Insane' surge in chip stocks will help boost entire economy, CIO says",140196144,,AMD,Finnhub,"STORY: Advanced Micro Devices' shares jumped to an all-time high on Wednesday as its strong outlook boosted investor confidence about sustained demand for AI infrastructure, sparking a rally across...",https://finnhub.io/api/news?id=5ee3835ed30ff8aa418bd1ac2d5165c84e288af70cf3364919ef261358aafcec
company,1778085304,Exploring the top movers within the S&P500 index during today's session.,140198707,https://www.chartmill.com/images/uploads/CM_Top_Movers_Small_free_2b4ff2fc22.webp,AMD,ChartMill,Uncover the latest developments among S&P500 stocks in today's session. Stay tuned to the S&P500 index's top gainers and losers on Wednesday.,https://finnhub.io/api/news?id=ca0e74cb90ac62b9609f505eb1c920732e31ad909d462c61880409e730ba6bd7
company,1778085223,"Advanced Micro Devices CPU Momentum Strong, GPU Upside Key for Outperformance, RBC Says",140193510,https://s.yimg.com/rz/stage/p/yahoo_finance_en-US_h_p_finance_2.png,AMD,Yahoo,Advanced Micro Devices (AMD) reported solid results and an upbeat outlook but further outperformance,https://finnhub.io/api/news?id=f6468ca1bcdb05ee992759eb025eadde9ac1c229c7d085a6c5dda86869c929df
company,1778084494,AMD: Taking Profits And Eyeing Arm,140196010,https://static.seekingalpha.com/cdn/s3/uploads/getty_images/2248172740/image_2248172740.jpg?io=getty-c-w1536,AMD,SeekingAlpha,"Advanced Micro Devices, Inc. stock has doubled since May; Q1 beat low bars, but risks remain. Click for this AMD earnings update.",https://finnhub.io/api/news?id=488fa96b3108d92e582b0ad95dc43ea49d4ed796ce8b121ad277d7cf5fc793d2
company,1778084383,Why Arm Holdings Stock Was Jumping Today,140193511,https://s.yimg.com/rz/stage/p/yahoo_finance_en-US_h_p_finance_2.png,AMD,Yahoo,A strong report from AMD was good news for Arm.,https://finnhub.io/api/news?id=93616d91cb61937776524b3d27379067d67bf4aa246b340ed6ec093422f45aa1
company,1778083868,"JP Morgan Maintains Neutral on Advanced Micro Devices, Raises Price Target to $385",140198020,,AMD,Benzinga,JP Morgan  analyst Harlan Sur   maintains Advanced Micro Devices (NASDAQ:AMD) with a Neutral and raises the price target from $270 to $385.,https://finnhub.io/api/news?id=1ff9b55725e317dd4a8e5ccca8408bc4ea870c7bad2e69678377328a5dfa69ee
company,1778082920,"After Blowout Quarter, This Is AMD’s Price Prediction For 2026",140193456,https://s.yimg.com/rz/stage/p/yahoo_finance_en-US_h_p_finance_2.png,AMD,Yahoo,"Our 24/7 Wall St. price target for Advanced Micro Devices (NASDAQ:AMD) is $398.04, which sits modestly below where shares currently trade after a blistering rally. With AMD changing hands at $416.36 and the model implying roughly -4.4% from here, the recommendation is hold with 90% confidence. Near fair value is the cleanest way to describe ... After Blowout Quarter, This Is AMD’s Price Prediction For 2026",https://finnhub.io/api/news?id=636e08f636ffa9a54f932116f6f19937d0adf15a15457cc6d458d2ff661d6046
company,1778082611,AMD Just Blew Out Earnings -- and Wall Street Can't Get Enough. Analyst Price Targets Are Skyrocketing,140191342,https://s.yimg.com/rz/stage/p/yahoo_finance_en-US_h_p_finance_2.png,AMD,Yahoo,AMD reported strong earnings results and fantastic guidance.,https://finnhub.io/api/news?id=a7371c76f175ada2735d741076d4cd7174a8eab396fcba3cea67eda52415ec56
company,1778082590,"Top Midday Stories: AMD Q1 Earnings, Q2 Guidance Top Estimates; Nvidia, Corning Enter Multiyear Commercial and Technology Partnership",140191344,https://s.yimg.com/rz/stage/p/yahoo_finance_en-US_h_p_finance_2.png,AMD,Yahoo,"All three major US stock indexes were up over 1% in late-morning trading Wednesday, as investors sho",https://finnhub.io/api/news?id=654b64eec4b4d6a780019ebe824f4e3f85801cffbc95cd8690737a530e6ef124
company,1778081527,Stock Market Today: Dow Jumps 600 Points On U.S.-Iran Deal Hopes; Uber Jumps (Live Coverage),140191352,https://s.yimg.com/rz/stage/p/yahoo_finance_en-US_h_p_finance_2.png,AMD,Yahoo,Stock Market Today: The Dow Jones index jumped Wednesday on hopes of a U.S.-Iran deal. AMD stock soared on earnings.,https://finnhub.io/api/news?id=be9798b7542203b33cce9a4a04eddd16ce58c03a9d8fb09aa58615a0f82a0e4f
company,1778081296,Michael Burry's Chip Short Just Got Wilder: SOXX Went From 43% Above Trend To 60%,140196726,https://cdn.benzinga.com/files/images/story/2026/05/06/xrdDAE9HpS4rJc10535-j6448429399417680500.jpeg?width=2048&height=1536,AMD,Benzinga,SOXX trades 60% above its 200-day average — a record since 2001. Nine chip stocks are even more stretched. Burry&#39;s puts now look early.,https://finnhub.io/api/news?id=f8da198053fb979a606ecc3dd567fb0587cdfc7b7a3c6a19be43abec2e02538d
company,1778081154,Wall Street Just Piled Into AMD: Eight Firms Hike Price Targets After Q1 Earnings Crusher,140191355,https://s.yimg.com/rz/stage/p/yahoo_finance_en-US_h_p_finance_2.png,AMD,Yahoo,"Wall Street unleashed one of the most aggressive coordinated price target hikes of the year on Advanced Micro Devices (NASDAQ:AMD) following its blowout Q1 FY2026 report. Two firms upgraded AMD stock outright (Bernstein and Seaport), while seven others lifted price targets, with the most bullish call landing at $530 from KeyBanc. AMD stock surged 17% on ... Wall Street Just Piled Into AMD: Eight Firms Hike Price Targets After Q1 Earnings Crusher",https://finnhub.io/api/news?id=30aa8f6ee0c82df0d9f5035ed76a88110c95a19fe7ef179a4d7af7c47a5e04fe
company,1778080612,"Advanced Micro Devices Faces Expanding AI Exposure, BofA Says",140191403,https://s.yimg.com/rz/stage/p/yahoo_finance_en-US_h_p_finance_2.png,AMD,Yahoo,Advanced Micro Devices (AMD) is facing expanding artificial intelligence exposure for its computer c,https://finnhub.io/api/news?id=caee1bfa023857e79b02f30e4388c864e3b679b3f05c545f61476b45a2d26c85
company,1778080560,So Many Worries—and Nothing to for the Stock Market to Worry About,140191359,https://s.yimg.com/rz/stage/p/yahoo_finance_en-US_h_p_finance_2.png,AMD,Yahoo,"U.S. stocks are outpacing their global rivals, with tech leading the charge. But worries about the war in Iran still linger.",https://finnhub.io/api/news?id=119c246aec94510e76713cb8a6fcf1ee2ed7eefb56983cbec1931543f0571869
