category,datetime,headline,id,image,related,source,summary,url
company,1778080171,AI Chip Packaging Constraints Create an Opening for Intel’s EMIB Technology,140191390,https://s.yimg.com/rz/stage/p/yahoo_finance_en-US_h_p_finance_2.png,AMD,Yahoo,Advanced Packaging Has Become the Bottleneck Intel (INTC) is attempting to reposition itself in the semiconductor value chain by leveraging one of the few areas where it still holds a differentiated capability—advanced packaging. While Taiwan Semiconductor Manufacturing Company’s (TSM) (TSMC) Chip on Wafer on Substrate (CoWoS) platform has become the industry standard for high-performance AI ... AI Chip Packaging Constraints Create an Opening for Intel’s EMIB Technology,https://finnhub.io/api/news?id=40b7fb0f14b1cc9d0a2ccdd7b32bf9bc10f1443b84ab3b8d19ded44b3b8dd4cf
company,1778079755,Why AMD Stock Exploded Higher Today,140191429,https://s.yimg.com/rz/stage/p/yahoo_finance_en-US_h_p_finance_2.png,AMD,Yahoo,The AI revolution is alive and well. AMD just proved it.,https://finnhub.io/api/news?id=4bbbaff0626710dce4bd7b3334cd50b7552e120b4653ff51752fc0fea3fdb810
company,1778079237,What Micron & Sandisk's stock moves say about the chip sector,140191417,https://s.yimg.com/rz/stage/p/yahoo_finance_en-US_h_p_finance_2.png,AMD,Yahoo,"The semiconductor sector (SOXX) has been ripping higher this year. Yahoo Finance Senior Business Reporter Ines Ferré chats with Yahoo Finance Senior Reporter Brooke DiPalma about the sector's three ""bottlenecks,"" highlighting how Micron (MU) and Sandisk (SNDK) factor in.",https://finnhub.io/api/news?id=d5faa19323bae504d130824d77f84008e1c2462f9d03bef14d3efa8e0b8bf563
company,1778079167,AMD Proves Skeptics Wrong. Stock Soars On Bullish Report.,140191431,https://s.yimg.com/rz/stage/p/yahoo_finance_en-US_h_p_finance_2.png,AMD,Yahoo,AMD stock vaulted higher after the chipmaker delivered a strong first-quarter report and talked up its opportunities in the AI data center market.,https://finnhub.io/api/news?id=e2dfcc0fede4814627c0e70a69843f862d17fb131dad76b926d596648d02b843
company,1778078776,"AMD stock upgraded by Goldman Sachs, Citi, & more: A closer look",140191432,https://s.yimg.com/rz/stage/p/yahoo_finance_en-US_h_p_finance_2.png,AMD,Yahoo,AMD (AMD) stock is tearing higher on Wednesday after the company's first quarter earnings and revenue results beat analysts' estimates. The semiconductor manufacturer also topped forecasts for its second quarter guidance. Yahoo Finance Senior Business Reporter Ines Ferré chats with Yahoo Finance Senior Reporter Brooke DiPalma about the earnings results and the stock's multiple upgrades on Wall Street.,https://finnhub.io/api/news?id=55999754d2a73df4e821d73cb378b5f3bc0a76a91ad4bc3d20a346a54fc44aa4
company,1778078104,Which S&P500 stocks are gapping on Wednesday?,140198705,https://www.chartmill.com/images/uploads/CM_Gap_Stocks_Small_free_ad767b11cf.webp,AMD,ChartMill,Wondering which stocks are making significant price gaps? Explore the S&P500 index on Wednesday to find the gap up and gap down stocks in today's session.,https://finnhub.io/api/news?id=4a8c9979e2ad280a3cdedd6b5ccd7ac90d56507ba3b3ead0ea8acba3d9b73ee9
company,1778077528,"TD Cowen Maintains Buy on Advanced Micro Devices, Raises Price Target to $500",140198022,,AMD,Benzinga,TD Cowen  analyst Joshua Buchalter   maintains Advanced Micro Devices (NASDAQ:AMD) with a Buy and raises the price target from $290 to $500.,https://finnhub.io/api/news?id=85253a039ad12a32276a6ced59932407b86d920be0e096fa08332c9ac6271fb2
company,1777036062,"White House Tells Fox News: Witkoff, Kushner Headed To Pakistan On Saturday Morning For Iran Talks; Iran Reached Out And Asked For In-Person Meeting; Vance Will Be Standing By In U.S.; Everyone Will Be On Standby To Fly To Pakistan, If Necessary",139931400,,AMD,Benzinga,,https://finnhub.io/api/news?id=d3bdac15b53182ea99a61ff1dba0f551311284517a79de2e5271fdc506cc2c72
company,1778076719,AMD and Intel are riding a surprising AI chip comeback,140191433,https://s.yimg.com/rz/stage/p/yahoo_finance_en-US_h_p_finance_2.png,AMD,Yahoo,The AI boom is giving old-school chips called CPUs a new moment.,https://finnhub.io/api/news?id=ba66112a16d9ab69e1293b91fdc8c26168be5a108d333a004ffcf073b7fa4856
company,1778076536,CBOE VIX Slides Toward 17 as Oil Retreat and Tech Stock Surge Restore Risk Appetite,140191419,https://s.yimg.com/rz/stage/p/yahoo_finance_en-US_h_p_finance_2.png,AMD,Yahoo,"The CBOE Volatility Index (^VIX) is drifting back toward the 17 line as optimism returns to the S&P 500 and capital rotates into stocks. The VIX closed near 18 on Monday after dipping to almost 17 late last week, well below the peak above 31 recorded in late March. In a display of a shifting ... CBOE VIX Slides Toward 17 as Oil Retreat and Tech Stock Surge Restore Risk Appetite",https://finnhub.io/api/news?id=25d359e4705088b7f1506073ff4f7c62c2bd5b0cc67ab732efc475dc0352dff8
company,1778076431,TSMC Stock Rallies: $56 Billion AI Expansion Crushes Apple Supply Chain Fears,140196743,https://cdn.benzinga.com/files/images/story/2026/05/06/Hsinchu-City--Taiwan--August-18--2022-Ta.jpeg?width=2048&height=1536,AMD,Benzinga,TSMC (TSM) stock rallies as a massive $56B AI expansion plan completely eclipses Apple supply chain fears. Discover how TSMC just broke a 30-year record to become the single largest country-beating heavyweight in global tech indexes.,https://finnhub.io/api/news?id=75e13f0850204dd629aa43ff3aa642bb3cb57806e241df1fd78a5015edc8595a
company,1778076406,AMD (AMD) Q1 2026 Earnings Call Transcript,140191435,https://s.yimg.com/rz/stage/p/yahoo_finance_en-US_h_p_finance_2.png,AMD,Yahoo,"Lisa Su: Thank you, Matt, and good afternoon to all those listening in today.  Growth was broad-based with every segment increasing year-over-year, led by 57% data center revenue growth.  Data center is now the primary driver of our revenue and earnings growth.",https://finnhub.io/api/news?id=3cb3ffaf4b80f90f82caffeef499ee70a1f5b8bc7b0babba43bb8f482cba9d9b
company,1778076120,Intel Surges Higher. Why This Stock Could Be an Even Bigger CPU Winner.,140191420,https://s.yimg.com/rz/stage/p/yahoo_finance_en-US_h_p_finance_2.png,AMD,Yahoo,"Intel stock, Micron, Arm and Qualcomm were all rising as AMD earnings propelled chip companies higher.",https://finnhub.io/api/news?id=0485d8ed908c3b2071b1d4833f547fb91ab756527bf9cf665202e3981db9f206
company,1778075285,Palo Alto To Rally Around 20%? Here Are 10 Top Analyst Forecasts For Wednesday,140195731,https://cdn.benzinga.com/files/images/story/2026/05/06/Palo-Alto-Networks-Inc-.jpeg?width=2048&height=1536,AMD,Benzinga,Summary: Wall Street analysts changed outlook on top names; Stifel cut price target for Leidos; Bernstein slashed Bellring Brands PT; Morgan Stanley raised PT for Cummins; Rothschild upgraded Monster Beverage; Cantor Fitzgerald raised AMD PT; RBC Capital raised UDR PT; Barclays raised ON PT; Guggenheim increased PT for Sphere Entertainment Co.,https://finnhub.io/api/news?id=6ccfff744ef8420684cb0bf8dce5b30a50abfa75f9fe541b2d775b20eb3a6893
company,1778075273,"AMD stock surges on Q1 earnings, driven by AI demand boom",140191437,https://s.yimg.com/rz/stage/p/yahoo_finance_en-US_h_p_finance_2.png,AMD,Yahoo,"Advanced Micro Devices (AMD) stock rips and tears higher in Wednesday's pre-market session after beating Wall Street's earnings and revenue estimates. The semiconductor manufacturer also topped forecasts for its second quarter guidance. Morning Brief Host Julie Hyman and Yahoo Finance Head of News Myles Udland analyze the current narratives around the chip space, AI data center demand, and the catalysts for AMD in these late stages of the AI Boom.",https://finnhub.io/api/news?id=a06668dfba069fe0920ccdca5be5fe41fddc8d42c2fa380a370cbc14b39994c9
company,1778074905,Nasdaq Hits Fresh Highs After AMD Earnings. The Dot-Com Bubble Parallels Keep Popping Up.,140189774,https://s.yimg.com/rz/stage/p/yahoo_finance_en-US_h_p_finance_2.png,AMD,Yahoo,"Fresh off a record close on Tuesday, the Nasdaq was soaring to fresh highs on Wednesday after Advanced Micro Devices’ earnings report kept the chip rally rolling.  The Dow was up 461 points, or 0.9%.  The S&P and Nasdaq only need to close above yesterday’s level to establish new record closing highs.",https://finnhub.io/api/news?id=94a9a3ec9b730f402928fc1af67c8da5ab7c6798c50dd66d7ad836b4a5323795
company,1778068781,"Stock Market Today: Dow Jumps, Oil Prices Plunge On U.S.-Iran Deal Hopes; AMD Surges On Earnings (Live Coverage)",140188584,https://s.yimg.com/rz/stage/p/yahoo_finance_en-US_h_p_finance_2.png,AMD,Yahoo,Stock Market Today: The Dow Jones index jumped Wednesday on hopes of a U.S.-Iran deal. AMD stock soared on earnings.,https://finnhub.io/api/news?id=01c81db05b39d48b3f90236b284632c692afecd0c9c5686dcacad2cfc8ac14d0
company,1778074733,"AMD upgraded, Reddit downgraded: Wall Street's top analyst calls",140189776,https://s.yimg.com/rz/stage/p/yahoo_finance_en-US_h_p_finance_2.png,AMD,Yahoo,"AMD upgraded, Reddit downgraded: Wall Street's top analyst calls",https://finnhub.io/api/news?id=0a45d20ef110269920ebbff738b53b9b2404cd5b2b7599db2278b27647105637
company,1778065288,Nvidia Is Facing More Competition and It’s Spooking Investors,140188250,https://s.yimg.com/rz/stage/p/yahoo_finance_en-US_h_p_finance_2.png,AMD,Yahoo,"(Bloomberg) -- This earnings season has delivered plenty of good news for the artificial intelligence trade, but instead of bidding up Nvidia Corp. shares, investors have been dumping them.Most Read from BloombergUS Has Opened a Passage Through Hormuz, Central Command SaysUS Says Offensive Phase of Iran War Over as Ship Hit in StraitAnthropic Unveils AI Agents to Field Financial Services TasksTrump Pauses Plan to Guide Ships While Seeking Iran DealWhite House Weighs AI Working Group, Model Testi",https://finnhub.io/api/news?id=4dd918c8c490174770c831061fee6e56ebe6acc0901a3b0aa08e43b2131fd520
company,1778074523,"S&P 500, Nasdaq 100 Smash Records As AMD Jumps 16% On AI Hype: Stock Market Today",140193568,https://cdn.benzinga.com/files/images/story/2026/05/06/Charlotte--North-Carolina---November-11-_3.jpeg?width=2048&height=1536,AMD,Benzinga,"U.S. stocks hit records as Trump&#39;s Iran memo sinks oil 6%, AMD soars 17% on data-center beat.",https://finnhub.io/api/news?id=c3e975c900dfcbe366bfd1c16209b749b2d175371ab40b07f0e34a104890875e
company,1778074450,AMD Q1 2026 Earnings: Datacenter Sales Mark Shift In AI Purchase Cycles,140193153,https://static.seekingalpha.com/cdn/s3/uploads/getty_images/2214312305/image_2214312305.jpg?io=getty-c-w1536,AMD,SeekingAlpha,"Advanced Micro Devices, Inc.âs Q1 FY2026 results highlight surging datacenter revenue and EPS growthâplus key risks like TSMC reliance. Click for this AMD update.",https://finnhub.io/api/news?id=6b486d69d3362aecaa54104c3f4984c18966265d3d6efe1e4e7928cd9a33bb5e
company,1778074114,"AMD Soars 14%: Q1 Crusher, Q2 Guide Lift, Goldman $450 Price Target Ignite AI Frenzy",140189662,https://s.yimg.com/rz/stage/p/yahoo_finance_en-US_h_p_finance_2.png,AMD,Yahoo,"Shares of Advanced Micro Devices (NASDAQ:AMD) are up by about 14% in early Wednesday trading, changing hands near $406 after a triple-catalyst night that combined a Q1 2026 beat, a sharply higher Q2 2026 outlook, and a Goldman Sachs upgrade. Premarket gains ran closer to 20% before the open trimmed the move. The rally extends ... AMD Soars 14%: Q1 Crusher, Q2 Guide Lift, Goldman $450 Price Target Ignite AI Frenzy",https://finnhub.io/api/news?id=289bc593eb6999d3d31d2438d79415850c259f864ea5347ba5956512c36b59f7
company,1778073956,Prediction: Trump’s Iran Deal Will Spark a Stock Market Rally Into Midterms,140189665,https://s.yimg.com/rz/stage/p/yahoo_finance_en-US_h_p_finance_2.png,AMD,Yahoo,"Gas prices were rising fast enough to turn a geopolitical standoff into an economic problem for everyday Americans. Over the past two weeks, investors watched oil prices climb, inflation fears reawaken, and concerns grow that a broader Middle East conflict could push the economy off course just months before the midterm elections. But early Wednesday ... Prediction: Trump’s Iran Deal Will Spark a Stock Market Rally Into Midterms",https://finnhub.io/api/news?id=b1b2ab7df49ba88fcdad1c5b673f93fc73dbf117f053ba4104619682563a11ee
company,1778073840,Arm Is Shifting Its Business Model. Earnings Will Be a Test for the Stock.,140189677,https://s.yimg.com/rz/stage/p/yahoo_finance_en-US_h_p_finance_2.png,AMD,Yahoo,"Arm reports earnings Wednesday as investors focus on its move into data center CPUs, a business shift that could put the chip-design company in competition with some of its own customers.",https://finnhub.io/api/news?id=969a4ab1428e71ad1057305d3296f44b8d853dc877b6dac0f3975d7e52fd8f16
company,1778073287,"Bernstein Upgrades Advanced Micro Devices to Outperform, Raises Price Target to $525",140198027,,AMD,Benzinga,Bernstein  analyst Stacy Rasgon   upgrades Advanced Micro Devices (NASDAQ:AMD) from Market Perform to Outperform and raises the price target from $265 to $525.,https://finnhub.io/api/news?id=0d2287db6dd8d308e6e847c147456bd709d41917f98f4b224c1e8384aa3c3da7
company,1778073121,"Final Trades: Thermo Fisher, Blue Owl Technology, Morgan Stanley and the IYE",140192851,https://image.cnbcfm.com/api/v1/image/108303123-17780869051778086903-45749643732-1080pnbcnews.jpg?v=1778086904&w=1920&h=1080,AMD,CNBC,The Investment Committee give you their top stocks to watch for the second half.,https://finnhub.io/api/news?id=ff206456bb24cbf370655185c5672df4b24964accb2204c5f52370929c436909
company,1778073021,Micron Smashes $700B Market Cap as AI Memory Boom Ignites Historic Rally,140189674,https://s.yimg.com/rz/stage/p/yahoo_finance_en-US_h_p_finance_2.png,AMD,Yahoo,Micron (MU) Rockets 11% as AI Memory Crunch Pushes Market Cap Past $700B,https://finnhub.io/api/news?id=b000e07a11082dc24a9314a6aea0c2f669ca802a86870a3544c07284875849a1
company,1778072521,AMD : DZ Bank remains its Buy rating,140192499,,AMD,Finnhub,"In a research note published by Ingo Wermann, DZ Bank advises its customers to buy the stock.",https://finnhub.io/api/news?id=f34037241b8c7d0468622fa2023e18879dd98f46ad03a75f8e740158c7aa60a1
company,1778072400,"Zip Launches AI Agents for Accounting, Helping the World’s Most Complex Companies Close the Books Faster and More Accurately",140189782,https://s.yimg.com/rz/stage/p/yahoo_finance_en-US_h_p_finance_2.png,AMD,Yahoo,"SAN FRANCISCO, May 06, 2026--Zip, the leading AI platform for enterprise procurement, today launched AI Automation for Procure-to-Pay",https://finnhub.io/api/news?id=0c7a671c9c1a584ff6d73c32b9121e7e0f1545f1b067633cb650575755a2e7bc
company,1778072340,Nvidia Stock Isn’t Soaring With the Other Chip Players. Here’s Why.,140189783,https://s.yimg.com/rz/stage/p/yahoo_finance_en-US_h_p_finance_2.png,AMD,Yahoo,"Nvidia  was rising early Wednesday amid a broader chip-stocks rally.  The shares were up 2.4% to $201.20 in premarket trading.  While the move pushes it above the psychologically significantly $200 level, it was only a small boost compared with  Advanced Micro Devices  ’ 20% gain on the back of AMD’s strong earnings Tuesday afternoon.",https://finnhub.io/api/news?id=b6b3bc2f4cf8220b9161cb44708401a3c456e4fb280e5622cc6aaaf0acabb45c
company,1778072100,NYSE Content Update: Business Leaders Come Together for No Kid Hungry Campaign,140189784,https://s.yimg.com/rz/stage/p/yahoo_finance_en-US_h_p_finance_2.png,AMD,Yahoo,The New York Stock Exchange (NYSE) provides a daily pre-market update directly from the NYSE Trading Floor. Access today's NYSE Pre-market update for market insights before trading begins.,https://finnhub.io/api/news?id=3ae04c8167ee3fe9d23e76b5d52bef26667583eb3d48daffceadc0e188ffdc7f
company,1778072079,"Potential Middle East Peace Agreement, Oil Price Declines Drive US Equity Futures Higher Pre-Bell",140189712,https://s.yimg.com/rz/stage/p/yahoo_finance_en-US_h_p_finance_2.png,AMD,Yahoo,US equity futures were higher pre-bell Wednesday as oil prices slipped and a peace agreement between,https://finnhub.io/api/news?id=d7afaa56b966f9f95ef400340792677ff9c523beacc72e62913fc5743ac6ca62
company,1778071964,"Tech Stocks Rocket Higher on Chip Strength, Easing Oil and Iran Deal Hopes",140189786,https://s.yimg.com/rz/stage/p/yahoo_finance_en-US_h_p_finance_2.png,AMD,Yahoo,"Tech futures are pointing to a strong open, with the Nasdaq Composite (^IXIC) leading the charge with a 1% increase on the heels of yesterday’s record-setting performance. Gains arrive on the back of blowout chip earnings and a sharp retreat in crude prices tied to signs of diplomatic progress between Washington and Tehran. AMD (Nasdaq: ... Tech Stocks Rocket Higher on Chip Strength, Easing Oil and Iran Deal Hopes",https://finnhub.io/api/news?id=62f0b17db7bc72db88f1d8485a69d86c23d45a7176fa6c1abff7d4689dd6cf21
company,1778071451,"Is Semi Mania Leading To A 2000-Style Crash? US-Iran Proposal Lifts Market, Pressures Oil",140192386,,AMD,Benzinga,"



Semiconductor Mania Grows


",https://finnhub.io/api/news?id=4402222c5e7defbd765dd583c13329a0f424a83c179fda57ce5b6172a69a6c19
company,1778070939,The $120 Billion Growth Driver Sitting Inside AMD’s AI Juggernaut,140189787,https://s.yimg.com/rz/stage/p/yahoo_finance_en-US_h_p_finance_2.png,AMD,Yahoo,"Advanced Micro Devices (NASDAQ:AMD) used its Q1 FY2026 earnings report to reset the ceiling on its server business, and the figure that matters most is a forward-looking outlook. The Number AMD management told investors it now sees the server CPU total addressable market reaching $120 billion or more by 2030, with the market growing at ... The $120 Billion Growth Driver Sitting Inside AMD’s AI Juggernaut",https://finnhub.io/api/news?id=605f938e3fd0da123990543059b33b235c176dcd611b7bccaad4bcede6a78a2f
company,1778070904,These S&P500 stocks that are showing activity before the opening bell on Wednesday.,140198691,https://www.chartmill.com/images/uploads/CM_Premarket_Movers_Small_free_90289f6b81.webp,AMD,ChartMill,Stay updated with the S&P500 stocks that are on the move in today's pre-market session.,https://finnhub.io/api/news?id=ffd59d9916c79f919e51bc1d28eab653cbb25ef28f7a9f14601add20aa241e8e
company,1778070834,"S&P 500 Extends Record Run as Semis Soar, Oil Falls and Strait Traffic Flows",140189713,https://s.yimg.com/rz/stage/p/yahoo_finance_en-US_h_p_finance_2.png,AMD,Yahoo,"The S&P 500 (^GSPC) is set to extend a record run as crude tumbles and traders welcome signs the Iran conflict could be winding down. Stocks are soaring because the Strait of Hormuz appears clear and a chip-led rally is rolling into a second day. The PHLX Semiconductor Index (^SOX) has ballooned by 9.4% over the ... S&P 500 Extends Record Run as Semis Soar, Oil Falls and Strait Traffic Flows",https://finnhub.io/api/news?id=0152105e4523340525328fcb63e913f56516d20a09b8c5acb3fc595ec6bdbabb
company,1778070762,"Cantor Fitzgerald Maintains Overweight on Advanced Micro Devices, Raises Price Target to $500",140198029,,AMD,Benzinga,Cantor Fitzgerald  analyst C.J. Muse   maintains Advanced Micro Devices (NASDAQ:AMD) with a Overweight and raises the price target from $450 to $500.,https://finnhub.io/api/news?id=d8e495776a66da87d2fc7b9c26b83847d2ee37eec61b6088aae246ded8dc8d64
company,1778070753,"Exchange-Traded Funds, Equity Futures Higher Pre-Bell Wednesday Amid Potential US-Iran Truce",140189707,https://s.yimg.com/rz/stage/p/yahoo_finance_en-US_h_p_finance_2.png,AMD,Yahoo,The broad market exchange-traded fund SPDR S&P 500 ETF Trust (SPY) was up 1% and the actively traded,https://finnhub.io/api/news?id=74239c6c924fe35fcab94c85019c05e1a30b3b47f4298c512364916c91485f0b
company,1778070540,"Intel Stock Surges Again. Micron, Arm Also Jump on This Fresh AI Hope.",140189771,https://s.yimg.com/rz/stage/p/yahoo_finance_en-US_h_p_finance_2.png,AMD,Yahoo,"Intel stock, Micron, Arm and Qualcomm were all rising as AMD earnings propelled chip companies higher.",https://finnhub.io/api/news?id=aea4ceb8b1f601c1498a31516c334f7ab093529bcd4238104a236b0d927eed64
company,1778070300,"AMD Beats on Earnings, Raises Guidance on AI and Data Center Growth",140189791,https://s.yimg.com/rz/stage/p/yahoo_finance_en-US_h_p_finance_2.png,AMD,Yahoo,Advanced Micro Devices beats Q1 estimates and lifts outlook as AI-driven data center demand fuels strong revenue growth and record cash flow.,https://finnhub.io/api/news?id=ff7dfa2108f8b0a2e81bf9feec0cf5a86b9245bbbdf5a5d32b4a1e3000777bd3
company,1778070120,ETFs to Buy as AMD Shares Jump 15% Following Q1 Earnings Beat,140189741,https://s.yimg.com/rz/stage/p/yahoo_finance_en-US_h_p_finance_2.png,AMD,Yahoo,"AMD surges 15% after Q1 beat and strong outlook, boosting appeal of ETFs like SMH as investors seek growth with lower single-stock risk.",https://finnhub.io/api/news?id=170a3644153cd589f8110c2e353530b4dfc311b9864207cd5e0dd0814b4717c1
company,1778068678,Super Micro Computer Soars After Strong AI Server Forecast,140188065,https://s.yimg.com/rz/stage/p/yahoo_finance_en-US_h_p_finance_2.png,AMD,Yahoo,Company forecasts Q4 revenue above estimates despite Q3 miss,https://finnhub.io/api/news?id=b0a1f5164ceae2e2b72511e9658f513b4951f52e3d3bea82aead1c942426b23f
company,1778068264,"Here Are Wednesday’s Top Wall Street Analyst Research Calls: Advanced Micro Devices, American Eagle Outfitters, GlobalFoundries, IAC, Merck, Palantir Technologies, Reddit, and More",140188066,https://s.yimg.com/rz/stage/p/yahoo_finance_en-US_h_p_finance_2.png,AMD,Yahoo,"Pre-Market Stock Futures: Futures are trading higher on Wednesday as news of an impending end to the Iran war is sending oil prices dramatically lower. This news comes after a bounce-back Tuesday that benefited from lower oil prices, some strong earnings, and solid buying from retail investors. At the same time, hedge funds continue to ... Here Are Wednesday’s Top Wall Street Analyst Research Calls: Advanced Micro Devices, American Eagle Outfitters, GlobalFoundries, IAC, Merck, Palantir Technolo",https://finnhub.io/api/news?id=7bac9e5879f3e8f7994a3a71231cd5e5fecec3d04349c9ad6a9374f40f58f0d6
company,1778068161,"Oil Prices Slip, Potential Middle East Peace Agreement Drives US Equity Futures Higher Pre-Bell",140188067,https://s.yimg.com/rz/stage/p/yahoo_finance_en-US_h_p_finance_2.png,AMD,Yahoo,US equity futures were higher pre-bell Wednesday as oil prices slipped and a peace agreement between,https://finnhub.io/api/news?id=3d036c1ee27d4721e8fbf0c59dd3d54d70133741196490f81ab888734f01b077
company,1778067929,This AMD Analyst Turns Bullish; Here Are Top 5 Upgrades For Wednesday,140192659,https://cdn.benzinga.com/files/images/story/2026/05/06/AMD-Signboard-At-Headquarters.jpeg?width=2048&height=1536,AMD,Benzinga,Top Wall Street analysts upgraded several top stocks. See all changes and ratings on Benzinga&#39;s analyst ratings page. Analysts are bullish on AMD.,https://finnhub.io/api/news?id=f3b94aac3b50fa118a3007c2f27b70bb00ee64d0714518cd4181771a3b24db62
company,1778067466,AI Chips Update - AI Demand Fuels Growth in Advanced Computing Solutions,140187996,https://s.yimg.com/rz/stage/p/yahoo_finance_en-US_h_p_finance_2.png,AMD,Yahoo,"Recent developments in the AI chip sector underscore a significant surge in demand for high-performance computing solutions, particularly for AI infrastructure. AMD's latest financial results reveal robust growth in their Data Center segment, attributed to increasing demand for their AI-optimized processors and GPUs. Expansions in global compute infrastructure, marked by strategic collaborations with industry giants such as Meta, AWS, and Google Cloud, highlight the broader industry trend of...",https://finnhub.io/api/news?id=280eb743a489b87910e9ea736ba13fa6d528b6e10bb4725dac59d269b5448561
company,1778067333,What's Going On With NVIDIA Stock Wednesday?,140191933,https://cdn.benzinga.com/files/images/story/2026/05/06/Nvidia-Logo-On-Phone-And-Blurred-Ai-Chip.jpeg?width=2048&height=1536,AMD,Benzinga,"NVIDIA (NVDA) shares climb 5% amid AI rotation. Earnings, technical support, and analyst price targets—get the full market breakdown. %",https://finnhub.io/api/news?id=d97d4effe3a244b677686a2e24d344a80a3076f2d95da57a4e4b194103897421
company,1778066966,"Stocks Rise Pre-Bell, Oil Prices Fall After Report Says US, Iran Nearing Peace Agreement",140188069,https://s.yimg.com/rz/stage/p/yahoo_finance_en-US_h_p_finance_2.png,AMD,Yahoo,"The main US stock measures were pointing higher in Wednesday's premarket activity, while oil prices",https://finnhub.io/api/news?id=69f787d28927ed2b3a4614c1d358edbce5b3f6485995246689248c7a6f3633ec
company,1778066940,Does AMD's blowout quarter underpin the hyper-scaler thesis?,140188070,https://s.yimg.com/rz/stage/p/yahoo_finance_en-US_h_p_finance_2.png,AMD,Yahoo,"Data centre demand is outstripping supply, margins are expanding, and Wall Street's models may still be too conservative The numbers Advanced Micro Devices Inc (NASDAQ:AMD, XETRA:AMD) posted on Tuesday were impressive - so much so, the shares shot up 17%. But the more revealing detail was...",https://finnhub.io/api/news?id=e2e53770425d3cf0fdb1ce1e7c8a866452ba187195e16246041f85bb4859843e
company,1778066351,AMD: This AI Rally Is Not Over,140191269,https://static.seekingalpha.com/cdn/s3/uploads/getty_images/1679336666/image_1679336666.jpg?io=getty-c-w1536,AMD,SeekingAlpha,"Advanced Micro Devices, Inc. targets $500 as agentic AI drives repricing; Q1 2026 revenue surged. Click for this AMD earnings update.",https://finnhub.io/api/news?id=a87ca4b929813bfc51129e95a95adb7c21afbb3d43b3cfe65f09349dc3382c6b
company,1778066244,"Sinking Oil Prices, Possible Peace Talks Lift Wall Street Pre-Bell; Asia, Europe Rally",140188071,https://s.yimg.com/rz/stage/p/yahoo_finance_en-US_h_p_finance_2.png,AMD,Yahoo,Wall Street futures pointed to fresh record highs pre-bell Wednesday as oil prices fell following me,https://finnhub.io/api/news?id=8b28cf6945d081f38459fcace12112c883c9f5150bead775b7f688bafa6ce089
