category,datetime,headline,id,image,related,source,summary,url
company,1778094304,Wednesday's session: top gainers and losers in the S&P500 index,140198713,https://www.chartmill.com/images/uploads/CM_Top_Movers_Small_free_2b4ff2fc22.webp,BLDR,ChartMill,"Let's delve into the developments on the US markets one hour before the close of the markets on Wednesday. Below, you'll find the top gainers and losers within the S&P500 index during today's session.",https://finnhub.io/api/news?id=2f3ba7ac4b93a09eb4ebdf551ee3e78e54dbb14ecca215aa142fee88c7bc331e
company,1777034850,"X-Energy IPO Opens For Trade At $30.11/Share; IPO Priced At $23/Share On 44,254,659 Shares",139983169,,BLDR,Benzinga,,https://finnhub.io/api/news?id=975af2f337d72d70b61a69fd97e5afeca128898f530aa00c65a97c1b2b4f3894
company,1778071980,Comfort Systems USA and Builders FirstSource have been highlighted as Zacks Bull and Bear of the Day,140191556,https://s.yimg.com/rz/stage/p/yahoo_finance_en-US_h_p_finance_2.png,BLDR,Yahoo,"Comfort Systems USA surges on data center demand and strong earnings growth, while Builders FirstSource struggles amid housing slowdown and falling estimates.",https://finnhub.io/api/news?id=56c7b669d596011e629f0398063ae7c45d2c2bf102cd73d51ba7237e5805e630
company,1778065654,Builders FirstSource: Still Not The Time To Upgrade To Buy Yet,140190887,,BLDR,SeekingAlpha,,https://finnhub.io/api/news?id=c6f3f816cb8c73dc98c5305af51709ec2ec4ac58712b4f6cf7d5f418cf17df61
company,1778062140,Bear of the Day: Builders FirstSource (BLDR),140188425,https://s.yimg.com/rz/stage/p/yahoo_finance_en-US_h_p_finance_2.png,BLDR,Yahoo,The housing recovery is delayed until next year.,https://finnhub.io/api/news?id=4127ee3603717db28ecf052d34f3f66dcfa9810d1c848f3e004925d807fb0774
