category,datetime,headline,id,image,related,source,summary,url
company,1780437600,Onco-Innovations Advances 1kg Scale-Up of B4 Precursor Supporting ONC010 Manufacturing and Clinical Development Program,140506449,https://s.yimg.com/rz/stage/p/yahoo_finance_en-US_h_p_finance_2.png,CBOE,Yahoo,"Also Announces Marketing Program VANCOUVER, BC / ACCESS Newswire / June 2, 2026 / Onco-Innovations Limited (CBOE CA:ONCO)(OTCQB:ONNVF)(Frankfurt:W1H) (WKN: A3EKSZ) (""Onco"" or the ""Company"") announces, further to its news release dated May 19, 2026, ...",https://finnhub.io/api/news?id=8ba92076f5a3813fdbe67375872cfa79b1ac9be1d42793b8568b7783c43d8518
company,1780427600,"Coinbase, Kalshi's New Crypto Futures Send These Stocks Sprawling",140504356,https://s.yimg.com/rz/stage/p/yahoo_finance_en-US_h_p_finance_2.png,CBOE,Yahoo,"Coinbase, Kalshi launch perpetual futures backed by the CFTC. Cboe, CME, ICE stock tumble on the news.",https://finnhub.io/api/news?id=5f767b75dd367e02217bb861b7a1427367d1998fb15a9dfdbb3680f16356e94d
company,1780427101,Uncover the latest developments among S&P500 stocks in today's session.,140503590,https://www.chartmill.com/images/uploads/CM_Top_Movers_Small_free_2b4ff2fc22.webp,CBOE,ChartMill,Curious about the top performers within the S&P500 index one hour before the close of the markets on Tuesday? Dive into the list of today's session's top gainers and losers for a comprehensive overview.,https://finnhub.io/api/news?id=16a9eee97aeb42c5148c3a7f2a2b2964d966c9e7f6c4244f3ad2762ea69a42a2
company,1780425525,"CBOE, CME, ICE, NDAQ Stocks Take A Hit After Kalshi's Bitcoin Perps Approval – TD Cowen Sees Real Risk, But RBC Says It's ‘Manageable’",140504357,https://s.yimg.com/rz/stage/p/yahoo_finance_en-US_h_p_finance_2.png,CBOE,Yahoo,"While the two firms are divided on how serious the threat actually is, they agree that Cboe Global Markets is most at risk.",https://finnhub.io/api/news?id=f5445520a477aa57a4af3df9dc4ccd37aecc43510a7042c13cf3518fd258e04d
company,1780419900,Let's take a look at the S&P500 stocks that are experiencing unusual volume in today's session.,140501540,https://www.chartmill.com/images/uploads/CM_Unusual_Volume_Small_free_b9d2e60841.webp,CBOE,ChartMill,Let's have a look at the S&P500 stocks with an unusual volume in today's session.,https://finnhub.io/api/news?id=f5b710b68ada1e7810f9d4b4bc704cbbae789c927cfa9c634786275f98286600
company,1780419300,Prediction Markets Crushed Sportsbooks. Exchanges Could Be Next.,140502644,https://s.yimg.com/rz/stage/p/yahoo_finance_en-US_h_p_finance_2.png,CBOE,Yahoo,"Regulators approved perpetual futures, but they are only tradable on Kalshi, the prediction market platform. Shares of traditional exchanges are down since the decision.",https://finnhub.io/api/news?id=476816bdccf24c2b727821cea87613bef6e03be761af79aedd8b932bebdcf105
company,1780418100,Top S&P500 movers in Tuesday's session,140501252,https://www.chartmill.com/images/uploads/CM_Top_Movers_Small_free_2b4ff2fc22.webp,CBOE,ChartMill,Uncover the latest developments among S&P500 stocks in today's session. Stay tuned to the S&P500 index's top gainers and losers on Tuesday.,https://finnhub.io/api/news?id=957bd0c7422ec605a7c79bdbe2db072b9589e4da0ea2c05f63816c1c2570a6a6
company,1780410901,What's going on in today's session: S&P500 gap up and gap down stocks,140499827,https://www.chartmill.com/images/uploads/CM_Gap_Stocks_Small_free_ad767b11cf.webp,CBOE,ChartMill,Seeking insights into today's market movers? Discover the S&P500 gap up and gap down stocks in today's session on Tuesday. Stay informed about the latest market trends.,https://finnhub.io/api/news?id=b89fb308be105c9a23d5fca0f80211d10f38173c4bb721f6c9df29054bf195e8
company,1780405620,The Stack Behind the Stack: Tuttle Capital Launches Concentrated Memory Stack ETF (HBMX),140499394,https://s.yimg.com/rz/stage/p/yahoo_finance_en-US_h_p_finance_2.png,CBOE,Yahoo,"A High-Conviction, Actively Managed ETF Built Around the Memory Semiconductor Ecosystem - the Critical Bottleneck Powering Artificial Intelligence, High-Performance Computing, and Data Center InfrastructureTuttle Capital Management announces the launch of the Tuttle Capital Concentrated Memory Stack ETF (HBMX), a thematic, actively managed ETF designed to provide focused exposure to companies operating across the memory semiconductor ecosystem — from DRAM, NAND, and high-bandwidth memory (HBM)..",https://finnhub.io/api/news?id=95c9cc801ce0ddb77b130657318718be68c6d86e5b42232b7288cb5164330885
company,1780405200,"Leverage Shares by Themes Targets Semiconductor Demand, Adding ON and NXPI to Leveraged Singe Stock ETF Lineup",140499351,https://s.yimg.com/rz/stage/p/yahoo_finance_en-US_h_p_finance_2.png,CBOE,Yahoo,"GREENWICH, Conn., June 02, 2026 (GLOBE NEWSWIRE) -- Leverage Shares by Themes is pleased to announce the launch of two new 2X single-stock leveraged ETFs, available for trading beginning June 2, 2026. Built for active traders seeking dynamic ways to engage with potentially high-growth semiconductor innovators, these products are designed with the goal of helping investors amplify returns (up & down) while actively participating in the daily performance of ON Semiconductor Corp and NXP Semiconduc",https://finnhub.io/api/news?id=05833b6b176a5fd1db49583654df205c966de9e6fccbeb423e46c2d8cab54431
company,1732024876,"CNBC Halftime Report Final Trades: Nasdaq, D.R. Horton, CrowdStrike, iShares Core S&P Small-Cap ETF",139956959,,CBOE,Benzinga,,https://finnhub.io/api/news?id=ffadfc9ec21cf5d5d2aaf304368c94b9f02dcfd95a26c02c0b4c0134e79b8239
company,1780401600,VanEck Launches Data Center Supply Chain ETF (RACK) to Capture AI Infrastructure Buildout,140499396,https://s.yimg.com/rz/stage/p/yahoo_finance_en-US_h_p_finance_2.png,CBOE,Yahoo,"NEW YORK, June 02, 2026--VanEck launches RACK, focused on companies supplying semiconductors, power, cooling systems, grid equipment needed to support AI infrastructure demand",https://finnhub.io/api/news?id=e61fb3a22d601b47eea39908bb458b06bade47abefc7a0e94948f8213f28e265
company,1780401472,The CFTC has sparked a potential revolution on Wall Street. Exchange stocks are dropping,140502003,https://image.cnbcfm.com/api/v1/image/108233443-1764337969884-gettyimages-2246639666-CBOT_FUTURE.jpeg?v=1764338018&w=1920&h=1080,CBOE,CNBC,Investors are worried about increased competition for the traditional exchanges that have long dominated on Wall Street.,https://finnhub.io/api/news?id=27458f9aa5a9058797936578de331d1e8c1154c55a718c414d9de7125370284e
