category,datetime,headline,id,image,related,source,summary,url
company,1778109188,Cboe Global Markets (CBOE) Is Up 13.2% After Record Q1 And Major Strategic Realignment – What's Changed,140199455,https://s.yimg.com/rz/stage/p/yahoo_finance_en-US_h_p_finance_2.png,CBOE,Yahoo,"Cboe Global Markets, Inc. reported record first-quarter 2026 results, with revenue rising to US$1,272.8 million and net income to US$385.7 million, and announced a major realignment that includes a 20% workforce reduction and planned exits from Cboe Canada and Cboe Australia. The company is sharpening its focus on core derivatives and index products while exploring new areas such as event and prediction markets, signaling a shift in how it intends to use its exchange infrastructure and...",https://finnhub.io/api/news?id=1d773f1705da15b77e903447f1643ff8b0a74a64de50c7439e02db09b15a78a8
company,1778103000,Zefiro Closes Acquisition of Rigs and Equipment Set to Boost Annual Revenue by over USD $10 Million,140197501,https://s.yimg.com/rz/stage/p/yahoo_finance_en-US_h_p_finance_2.png,CBOE,Yahoo,"Zefiro has successfully closed on a USD $4.3 million agreement to acquire the equipment of Viking Well Service which includes five derrick rigs as well as several other key units of machinery to be added to Zefiro's fleet.As a result of this acquisition, Zefiro will have coverage in five new states where it has not previously operated (New Jersey, Michigan, Indiana, Illinois, and Iowa) while also expanding its footprint in four existing states.This added geographical coverage and increased total",https://finnhub.io/api/news?id=86fabb649fee88a72dd7f16fcade71e7b15029a2da1b5e26b56b8ecca109103d
company,1778097900,Global Crossing Airlines Reports First Quarter 2026 Financial Results,140197502,https://s.yimg.com/rz/stage/p/yahoo_finance_en-US_h_p_finance_2.png,CBOE,Yahoo,"Strong Aircraft Utilization and Block Hour Growth Drive 15% Year-Over-Year Increase in Revenue to $76.6 Million Increased GAAP Net Income 14x Year-Over-Year to $2.7 Million or $0.04 per Share and EBITDAR by 17% Year-Over-Year to $24.2 Million MIAMI, May 06, 2026 (GLOBE NEWSWIRE) -- Global Crossing Airlines Group, Inc. (Cboe CA: JET, Cboe CA: JET.B, OTCQB: JETMF) (the “Company” or “GlobalX”), The Nation's Fastest Growing Charter Airline®, today announced its financial and operating results for th",https://finnhub.io/api/news?id=48b6af630a2c1f9a0e5da899d096207051cf52baaf43da565b70dd2c33799da2
company,1778082360,5 Stocks to Watch From the Prospering Securities & Exchanges Industry,140193688,https://s.yimg.com/rz/stage/p/yahoo_finance_en-US_h_p_finance_2.png,CBOE,Yahoo,"Zacks Securities and Exchanges industry players like SPGI, CME, ICE, NDAQ and CBOE gain from rising crypto adoption, trading volumes, a higher non-trading revenue base and tech investments.",https://finnhub.io/api/news?id=ccef0e377789a2079c4404482a1aeb3608fa624a8163b9fe77891a07b37cc9fc
company,1778076536,CBOE VIX Slides Toward 17 as Oil Retreat and Tech Stock Surge Restore Risk Appetite,140191419,https://s.yimg.com/rz/stage/p/yahoo_finance_en-US_h_p_finance_2.png,CBOE,Yahoo,"The CBOE Volatility Index (^VIX) is drifting back toward the 17 line as optimism returns to the S&P 500 and capital rotates into stocks. The VIX closed near 18 on Monday after dipping to almost 17 late last week, well below the peak above 31 recorded in late March. In a display of a shifting ... CBOE VIX Slides Toward 17 as Oil Retreat and Tech Stock Surge Restore Risk Appetite",https://finnhub.io/api/news?id=25d359e4705088b7f1506073ff4f7c62c2bd5b0cc67ab732efc475dc0352dff8
company,1778075121,HIMU Sits Vulnerable to a Double Risk: Slowing Growth and Stuck Interest Rates,140189657,https://s.yimg.com/rz/stage/p/yahoo_finance_en-US_h_p_finance_2.png,CBOE,Yahoo,"The iShares High Yield Muni Active ETF (CBOE:HIMU) sits in one of the more specialized corners of the bond market: actively managed, below-investment-grade and non-rated municipal debt, wrapped in an ETF and pitched at investors hunting tax-advantaged income that ordinary muni funds cannot match. Shares are around $49 today, with a one-year total return of ... HIMU Sits Vulnerable to a Double Risk: Slowing Growth and Stuck Interest Rates",https://finnhub.io/api/news?id=97d567b5909596a130398bacc138e04ff0fb5a9ccd7a12c882053792082178d2
company,1778067000,BTQ Technologies' QSSN Selected as Core Security Infrastructure for South Korea's First Bank-Led KRW Stablecoin Proof-of-Concept,140216965,https://s.yimg.com/rz/stage/p/yahoo_finance_en-US_h_p_finance_2.png,CBOE,Yahoo,"BTQ Technologies Corp. (""BTQ"" or the ""Company"") (Nasdaq: BTQ) (CBOE CA: BTQ), a global quantum technology company focused on securing mission-critical networks, today announced that it it has been selected as the core PQC security technology provider through its Quantum Secure Stablecoin Settlement Network (""QSSN"") in a proof-of-concept with its Korean strategic partner, Finger Inc. (""Finger""), and iM Bank, a leading Korean commercial bank, for South Korea's first bank-led Korean won stablecoin",https://finnhub.io/api/news?id=ab4a4bc04e760b7bfb2c58f0eabd229e75a54f81dd281156c15c42ed1aa85e7a
company,1778067000,Abaxx Signs MoU to Support Development of Cambodian National Futures Exchange,140188315,https://s.yimg.com/rz/stage/p/yahoo_finance_en-US_h_p_finance_2.png,CBOE,Yahoo,"Agreement establishes framework for cooperation on market infrastructure development using Abaxx’s MarketOS™ technologyTORONTO, May 06, 2026 (GLOBE NEWSWIRE) -- Abaxx Technologies Inc. (CBOE:ABXX)(OTCQX:ABXXF) (“Abaxx” or the “Company”), a financial software and market infrastructure company and indirect majority shareholder of Abaxx Singapore Pte Ltd. (“Abaxx Singapore”), the owner of Abaxx Commodity Exchange and Clearinghouse (individually, “Abaxx Exchange” and “Abaxx Clearing”), today announc",https://finnhub.io/api/news?id=9004e8f15eb24cf937b24dfe8b0e252fb98768eb1a80927220fb7fdf91dcb84e
company,1778067000,Glass House Brands Announces Application for DEA Registration of Certain Medical Operations,140188313,https://s.yimg.com/rz/stage/p/yahoo_finance_en-US_h_p_finance_2.png,CBOE,Yahoo,"LONG BEACH, Calif. and TORONTO, May 06, 2026 (GLOBE NEWSWIRE) -- Glass House Brands Inc. (""Glass House"") (CBOE CA: GLAS.A.U) (CBOE CA: GLAS.WT.U) (OTCQX: GLASF) (OTCQX: GHBWF) today announced that it has submitted applications to register certain California-licensed medical cannabis operations with the U.S. Drug Enforcement Administration (DEA) pursuant to the expedited registration pathway established by the recent rescheduling of medical cannabis to Schedule III under the Controlled Substances",https://finnhub.io/api/news?id=9218df6b59df469a689ce977942cf7ea682fc8e5c542b4d7a158ca95d18fa42b
