category,datetime,headline,id,image,related,source,summary,url
company,1778083943,Betting giant Flutter overhauls management at US FanDuel unit,140195633,,CME,Finnhub,"Betting giant Fluttermade major management changes at its U.S. FanDuel brand onWednesday, saying FanDuel CEO Amy Howe had left the company andthat Flutter veteran Dan Taylor would oversee the U.S....",https://finnhub.io/api/news?id=28c3642a4ed0e3f69df432c8574d9342faf916972d139bf9d528aad17c6cc0da
company,1778082360,5 Stocks to Watch From the Prospering Securities & Exchanges Industry,140193688,https://s.yimg.com/rz/stage/p/yahoo_finance_en-US_h_p_finance_2.png,CME,Yahoo,"Zacks Securities and Exchanges industry players like SPGI, CME, ICE, NDAQ and CBOE gain from rising crypto adoption, trading volumes, a higher non-trading revenue base and tech investments.",https://finnhub.io/api/news?id=ccef0e377789a2079c4404482a1aeb3608fa624a8163b9fe77891a07b37cc9fc
company,1778080087,CME Group Announces First Trades of New Avalanche and Sui Cryptocurrency Futures between G-20 Group and FalconX,140194554,,CME,Finnhub,"CHICAGO, May 6, 2026 /PRNewswire/ -- CME Group, the world's leading derivatives marketplace, announced its new Avalanche and Sui futures are now available for trading. First trades were executed as...",https://finnhub.io/api/news?id=9426f3eb29cfe6e93a759b3a2ea15ef9e104b4ae56089575ac23c336d6d33b4f
company,1778079600,CME Group Launches New Benchmark to Track Overnight Funding Costs,140191607,https://s.yimg.com/rz/stage/p/yahoo_finance_en-US_h_p_finance_2.png,CME,Yahoo,"CME Group, the world's leading derivatives marketplace, today announced it has launched the U.S. dollar RepoFunds Rate (RFR USD) to provide a robust measure of overnight funding costs in U.S. repo markets.",https://finnhub.io/api/news?id=d2c1816f0b65b1ec10281fb8e9bac307f5b9f3407f1d1fc8e3340a5e8be3320e
company,1778077987,CME : WTI Crude Oil futures hit one-month low on Iran progress.,140194306,,CME,Finnhub,"June WTI Crude Oil futures experienced a significant sell-off, breaking below the $100 psychological level to reach a new one-month low. The downturn was driven by a shift in the geopolitical...",https://finnhub.io/api/news?id=e24f486e850e0632ba40fc10797abad5767175c8d75cd37bbe4d9e0f188acbbf
company,1778071148,CME : Stocks hit record highs as tensions shift.,140192173,,CME,Finnhub,Bob Iaccino analyzes the latest market movements as stock futures reach all-time highs amid falling Treasury yields. He discusses the geopolitical impact of Project Freedom in the Strait of Hormuz and...,https://finnhub.io/api/news?id=74660fb24bf0f5d67b2a2014be4df0e46550b804085dca2c75f5f534a6632148
company,1778070290,"Copper, Silver, Gold Price Jump As Oil Dives. These Stocks Are Near Buy Points.",140189949,https://s.yimg.com/rz/stage/p/yahoo_finance_en-US_h_p_finance_2.png,CME,Yahoo,"Copper and gold prices jumped over 3% early Wednesday, while silver surged around 6% after President Donald Trump called off ""Project Freedom,"" which had threatened the ceasefire between Iran and the U.S. military in the Strait of Hormuz.  Copper giant Freeport-McMoRan and gold and silver miner Newmont were among the top S&P 500 stock advancers ahead of the open.  The list includes BHP Group, Rio Tinto, Vale.",https://finnhub.io/api/news?id=f452b39e40d540131b53edb4ec219205a4ab568a7e0f1891c7c0c96b9ec52d1b
company,1778065930,CME Group Introduces U.S. Dollar RepoFunds Rate,140195727,,CME,Benzinga,"CME Group, the world&#39;s leading derivatives marketplace, today announced it has launched the U.S. dollar RepoFunds Rate (RFR USD) to provide a robust measure of overnight funding costs in U.S. repo markets.The new",https://finnhub.io/api/news?id=b5810c2f4792587f759dff9ba29413f088d7c06fd92a54fa6504b4d047851395
