category,datetime,headline,id,image,related,source,summary,url
company,1780432354,Stock Indexes Post New Record Highs Amid AI Enthusiasm,140509474,https://s.yimg.com/rz/stage/p/yahoo_finance_en-US_h_p_finance_2.png,DDOG,Yahoo,"The S&P 500 Index ($SPX ) (SPY ) on Tuesday closed up +0.13%, the Dow Jones Industrial Average ($DOWI ) (DIA ) closed up +0.45%, and the Nasdaq 100 Index ($IUXX ) (QQQ ) closed up +0.48%. June E-mini S&P futures (ESM26 ) rose +0.14%, and June E-mini Nasdaq futures...",https://finnhub.io/api/news?id=96cb56dea8cd225ccd9fa9fa537bf8f06353dc30d772de14741f4d863c9c2f5f
company,1780413943,Stocks Push Higher on US Labor Market Strength and AI Spending,140506192,https://s.yimg.com/rz/stage/p/yahoo_finance_en-US_h_p_finance_2.png,DDOG,Yahoo,"The S&P 500 Index ($SPX ) (SPY ) today is up +0.24%, the Dow Jones Industrial Average ($DOWI ) (DIA ) is up +0.26%, and the Nasdaq 100 Index ($IUXX ) (QQQ ) is up +0.29%. June E-mini S&P futures (ESM26 ) are up +0.20%, and June E-mini Nasdaq futures...",https://finnhub.io/api/news?id=55d7af628b73d70bf86aa7192673d2df25611841953752dbcc9fd0a53f162159
company,1780409330,Stocks Pressured by Uncertainty of US-Iran Ceasefire Prospects,140506194,https://s.yimg.com/rz/stage/p/yahoo_finance_en-US_h_p_finance_2.png,DDOG,Yahoo,"The S&P 500 Index ($SPX ) (SPY ) today is down -0.20%, the Dow Jones Industrial Average ($DOWI ) (DIA ) is down -0.23%, and the Nasdaq 100 Index ($IUXX ) (QQQ ) is down -0.33%. June E-mini S&P futures (ESM26 ) are down -0.18%, and June E-mini Nasdaq futures...",https://finnhub.io/api/news?id=6fc72df72d8a231b36309fc2398f3d8d087b2c30604a756a7611ccddf00eaaf4
company,1780403700,These S&P500 stocks are moving in today's pre-market session,140498735,https://www.chartmill.com/images/uploads/CM_Premarket_Movers_Small_free_90289f6b81.webp,DDOG,ChartMill,"The US market session of Tuesday has yet to be opened, let's have a look at the top S&P500 gainers and losers in the pre-market session today.",https://finnhub.io/api/news?id=f63e4f09c34bff442d883c8978f0d33d49fd950ecefedda16e11e22f81b6ff4f
company,1780396724,"Stock Index Futures Muted as Investors Parse Middle East Developments, U.S. JOLTS Report in Focus",140502501,https://s.yimg.com/rz/stage/p/yahoo_finance_en-US_h_p_finance_2.png,DDOG,Yahoo,"June S&P 500 E-Mini futures (ESM26) are down -0.14%, and June Nasdaq 100 E-Mini futures (NQM26) are down -0.01% this morning, taking a breather after a recent rally, while investors assess the prospects for an end to the Middle East conflict.",https://finnhub.io/api/news?id=d9bd843b4ff7c4c84c9e8dac91cc963f6cc32ce6e3df5257c1cfc48b8dbd94ac
