category,datetime,headline,id,image,related,source,summary,url
company,1780391580,HPE Stock Jumps 25% After Earnings Beat. It’s Another AI Beneficiary.,140498451,https://s.yimg.com/rz/stage/p/yahoo_finance_en-US_h_p_finance_2.png,DELL,Yahoo,Hewlett Packard Enterprise  stock soared after the information technology company reported better-than-expected financial results and raised its fiscal year outlook as artificial intelligence demand continues to benefit growth.  HPE’s earnings follow strong financial results from peer  Dell Technologies  proving yet again that demand for servers is strong as customers buy up the hardware needed to power AI.  Dell reported much better-than-expected financial results for its first-quarter and boosted its revenue outlook for the fiscal year on May 28.,https://finnhub.io/api/news?id=80b9575e43323a35d4f23152b6fe7e112a82ff0c23209dc7e6de555921e60c0f
company,1780388951,HPE surges 29% as AI infrastructure boom boosts server demand,140497723,https://s.yimg.com/rz/stage/p/yahoo_finance_en-US_h_p_finance_2.png,DELL,Yahoo,"Hewlett Packard Enterprise shares rallied nearly 29% in premarket trade on Tuesday, as investors cheered ‌the AI server maker pulling forward its long-term financial ‌targets by two years, buoyed by strong AI infrastructure demand.  HPE, which competes with ​Dell Technologies and Super Micro Computer in enterprise servers, is seeing sustained demand as large enterprises bring forward purchases to avoid supply risks amid surging memory chip prices.  Hyperscalers including Alphabet and Amazon ‌are set to spend ⁠more than $700 billion on AI infrastructure this year, likely boosting demand for HPE's server and networking ⁠products.",https://finnhub.io/api/news?id=d182b807d5316633f044b3d5f3f0c0ec58285e5a273050f69db55bb071beaafa
company,1780387680,"The Zacks Analyst Blog Highlights Microsoft, Dell, Thermo Fisher,Village Super Market and  Comstock",140497719,https://s.yimg.com/rz/stage/p/yahoo_finance_en-US_h_p_finance_2.png,DELL,Yahoo,"MSFT is benefiting from AI momentum, Copilot adoption and accelerating Azure growth, even as capacity constraints persist.",https://finnhub.io/api/news?id=97b33736ebe463721d60dcc00ecbb97f2f54e3506068befe77eb984171b8139d
company,1780387671,"Nutanix, nCino, and DoubleVerify Shares Skyrocket, What You Need To Know",140497826,https://s.yimg.com/rz/stage/p/yahoo_finance_en-US_h_p_finance_2.png,DELL,Yahoo,"A number of stocks jumped in the afternoon session after software stocks extended their rally, carrying momentum from one of the sharpest sector reversals of 2026.",https://finnhub.io/api/news?id=7c55803aa91cada4a1742600805c012ad46f5cdee9c6fb3e909f0fb8bf060652
company,1780387201,Nvidia's new PC chips represent CEO Huang's bid to win at every layer of AI stack,140501577,https://image.cnbcfm.com/api/v1/image/108314509-1780318212098-gettyimages-2278510024-TAIWAN_COMPUTEX.jpeg?v=1780318269&w=1920&h=1080,DELL,CNBC,"Nvidia's announced entry into the PC chip market sent shares of AMD, Intel and Qualcomm lower as Wall Street recognized the threat.",https://finnhub.io/api/news?id=bc921004a97c5964dbcf5d5e8de905b9580fd2b6cd3eac41242a8ed2e2455299
company,1780383805,What's Going On With Super Micro Stock Tuesday?,140500064,https://cdn.benzinga.com/files/images/story/2026/06/02/November-1--2024--Portugal--In-This-Phot.jpeg?width=2048&height=1536,DELL,Benzinga,"Super Micro Computer (SMCI) stock surges 5.5% premarket, bucking broader index weakness on persistent AI demand.",https://finnhub.io/api/news?id=925fe5d14eb90f3c3a5c397495bfe06d2c5927478e5f432b7de082e0a3f56b0a
company,1780381800,Even Nvidia Will Struggle to Save the PC,140497243,https://s.yimg.com/rz/stage/p/yahoo_finance_en-US_h_p_finance_2.png,DELL,Yahoo,"Chip stocks, led by Intel and  Qualcomm  fell sharply, while PC stocks, led by  Dell Technologies  and  HP  jumped.  A new kind of PC, even one armed with an Nvidia chip, will be an uphill climb.  Amid a memory shortage, it could hardly be a worse moment to be launching a new PC platform.",https://finnhub.io/api/news?id=d80e33df4b8b121f0708c0ab9cdd07465e6a0c7b5ea99034762ac381d7c453f1
company,1780380300,ValuEngine Weekly Market Summary And Commentary,140497885,https://static.seekingalpha.com/cdn/s3/uploads/getty_images/2205178605/image_2205178605.jpg?io=getty-c-w1536,DELL,SeekingAlpha,"US markets ended the week with a clear risk-on tilt, led by a strong rebound in technology- and growth-oriented names. QQQM gained 2.88%, while XLK surged 5.89%. Read more here.",https://finnhub.io/api/news?id=309c6a92d1089601acc42e6914a5bbb020a5e1563b8b48cfb902a3854dde2a98
company,1780375572,Stock Market: Will S&P 500 Open Up Or Down Today?,140500065,https://cdn.benzinga.com/files/images/story/2026/06/02/Cyberpunk-Photo-Of-An-Upward-trending-Sa.jpeg?width=2048&height=1536,DELL,Benzinga,"June 2, 2026, Tuesday: Polymarket traders slightly favor an S&amp;P 500 dip despite record highs, rising oil prices and AI momentum.",https://finnhub.io/api/news?id=d15c10641351b979b763c5f4a33be67eb5610378759952a1b92c0fa2eebcc6d6
company,1780374789,Jim Cramer Is Furious That He “Missed” Dell (DELL),140496812,https://s.yimg.com/rz/stage/p/yahoo_finance_en-US_h_p_finance_2.png,DELL,Yahoo,We recently published Jim Cramer Warned About Market Manipulation & Discussed These 22 Stocks. Dell Technologies Inc. (NYSE:DELL) is one of the stocks discussed by Jim Cramer. Computer hardware firm Dell Technologies Inc. (NYSE:DELL) was in the news earlier this week after its latest financial results saw the firm post meteoric revenue and net income […],https://finnhub.io/api/news?id=2453fde6d786d50402096a65d6820664b6898d0bf929fbba38977a12a9d92623
company,1780374771,"Rapid7, Sprinklr, and Paychex Stocks Trade Up, What You Need To Know",140496813,https://s.yimg.com/rz/stage/p/yahoo_finance_en-US_h_p_finance_2.png,DELL,Yahoo,"A number of stocks jumped in the afternoon session after software stocks extended their rally, carrying momentum from one of the sharpest sector reversals of 2026.",https://finnhub.io/api/news?id=0e6235ab176612a16805f3a21f1f0abc9ce87095cad0300f5f11d16f429f90d3
company,1780374749,Jim Cramer Predicts Hewlett Packard Enterprise (HPE) Will Go Up,140496814,https://s.yimg.com/rz/stage/p/yahoo_finance_en-US_h_p_finance_2.png,DELL,Yahoo,We recently published Jim Cramer Warned About Market Manipulation & Discussed These 22 Stocks. Hewlett Packard Enterprise Company (NYSE:HPE) is one of the stocks discussed by Jim Cramer. Enterprise hardware firm Hewlett Packard Enterprise Company (NYSE:HPE)’s shares are up by 149% over the past year and by 78% year-to-date. JPMorgan discussed the firm on May […],https://finnhub.io/api/news?id=4dd11ef04b66cd1f222744df5e4a5b6ded72a59d34f383b87a59f81882d7bac2
company,1780374710,Jim Cramer Predicts Super Micro (SMCI) Will Go Up,140496815,https://s.yimg.com/rz/stage/p/yahoo_finance_en-US_h_p_finance_2.png,DELL,Yahoo,"We recently published Jim Cramer Warned About Market Manipulation & Discussed These 22 Stocks. Super Micro Computer Inc. (NASDAQ:SMCI) is one of the stocks discussed by Jim Cramer. Server hardware firm Super Micro Computer Inc. (NASDAQ:SMCI)’s shares are up by 48% year-to-date and by 15% over the year. Recently, the firm is once again under […]",https://finnhub.io/api/news?id=e59bb1cb8ae9cd5c652805ce5288cd7af0e3985bc0fe641046ec003ad7505369
company,1780374677,Jim Cramer Can’t Understand Why NVIDIA (NVDA) Won’t Go Up,140496733,https://s.yimg.com/rz/stage/p/yahoo_finance_en-US_h_p_finance_2.png,DELL,Yahoo,"We recently published Jim Cramer Warned About Market Manipulation & Discussed These 22 Stocks. NVIDIA Corporation (NASDAQ:NVDA) is one of the stocks discussed by Jim Cramer. AI GPU giant NVIDIA Corporation (NASDAQ:NVDA) is one of Jim Cramer’s favorite stocks even though the shares have remained lackluster this year. Year-to-date, the stock is up by a […]",https://finnhub.io/api/news?id=5708ffb5be42ff48dfe7228016a5c9418b30afd03ee43d6ec85f0db7a6a52625
company,1780374291,Why Adobe (ADBE) Stock Is Up Today,140496811,https://s.yimg.com/rz/stage/p/yahoo_finance_en-US_h_p_finance_2.png,DELL,Yahoo,"Shares of creative software giant Adobe (NASDAQ:ADBE) jumped 5.8% in the afternoon session after software stocks extended their rally, carrying momentum from one of the sharpest sector reversals of 2026.",https://finnhub.io/api/news?id=6836050b52fcc268158871854c388b92592bae1708b15162c23630ba5c2e879c
company,1780374240,Qualcomm (QCOM) Loses 8.8% on Nvidia Competition Fears,140496735,https://s.yimg.com/rz/stage/p/yahoo_finance_en-US_h_p_finance_2.png,DELL,Yahoo,"Qualcomm Inc. (NASDAQ:QCOM) is one of the 10 Stocks Entering June in the Wrong Direction. Qualcomm snapped a two-day winning streak on Monday, shedding 8.78 percent to finish at $228.99 apiece, as investors resorted to profit-taking following the previous trading day’s record high, while digesting the impact of Nvidia Corp.’s foray into the devices market. […]",https://finnhub.io/api/news?id=649a3f44710286650eb4e13225344876c61311a628d8976197a786939b7f0390
company,1780373811,"Pegasystems, Unity, and Workiva Stocks Trade Up, What You Need To Know",140496819,https://s.yimg.com/rz/stage/p/yahoo_finance_en-US_h_p_finance_2.png,DELL,Yahoo,"A number of stocks jumped in the afternoon session after software stocks extended their rally, carrying momentum from one of the sharpest sector reversals of 2026.",https://finnhub.io/api/news?id=59240e45ba5b9d02a7c38ec76a7be3d91fb874adf0f661ecb7d202ca3f4db6cb
company,1780373331,"Dropbox, Paylocity, and Agilysys Shares Are Soaring, What You Need To Know",140496348,https://s.yimg.com/rz/stage/p/yahoo_finance_en-US_h_p_finance_2.png,DELL,Yahoo,"A number of stocks jumped in the afternoon session after software stocks extended their rally, carrying momentum from one of the sharpest sector reversals of 2026.",https://finnhub.io/api/news?id=bfd94a105c30c839642fc7e21e3f6fad3b8f0ab845aeb7b5ad00a2e5eb480024
company,1780372851,"Box, Asure Software, and Flywire Stocks Trade Up, What You Need To Know",140496821,https://s.yimg.com/rz/stage/p/yahoo_finance_en-US_h_p_finance_2.png,DELL,Yahoo,"A number of stocks jumped in the afternoon session after software stocks extended their rally, carrying momentum from one of the sharpest sector reversals of 2026.",https://finnhub.io/api/news?id=337cb962afba8564de083340f08cf77ed5717451ec50ffec4e0e6c2c4a374dbf
company,1780372371,"8x8, BlackLine, and Marqeta Shares Are Soaring, What You Need To Know",140496261,https://s.yimg.com/rz/stage/p/yahoo_finance_en-US_h_p_finance_2.png,DELL,Yahoo,"A number of stocks jumped in the afternoon session after software stocks extended their rally, carrying momentum from one of the sharpest sector reversals of 2026.",https://finnhub.io/api/news?id=b24de46406733105903d0e6cf58c4d3d9e06de1dea21a04e5d386ed2143d7075
company,1780371891,Why Is Nvidia (NVDA) Stock Soaring Today,140496176,https://s.yimg.com/rz/stage/p/yahoo_finance_en-US_h_p_finance_2.png,DELL,Yahoo,Shares of leading designer of graphics chips Nvidia (NASDAQ:NVDA) jumped 6.3% in the afternoon session after over 150 million shares traded hands (well above average) as CEO Jensen Huang's keynote at Computex in Taipei delivered two major announcements.,https://finnhub.io/api/news?id=557ccbb136c52590365e422d53d498e09c10663429f08de062c144595e93536c
company,1780368480,Why Is Hewlett Packard Enterprise (HPE) Stock Rocketing Higher Today,140496182,https://s.yimg.com/rz/stage/p/yahoo_finance_en-US_h_p_finance_2.png,DELL,Yahoo,Shares of enterprise technology company Hewlett Packard Enterprise (NYSE:HPE) jumped 9.4% in the afternoon session after the company benefited from a sector-wide rally in artificial intelligence (AI) server stocks and announced a new server designed for AI workloads.,https://finnhub.io/api/news?id=447d55c043a50a81855a2c7c14dcdd9f8582b676e5316401fdb7db91b0ff4a6d
company,1780367371,"HPE stock soars on record backlog, booming AI server business",140496822,https://s.yimg.com/rz/stage/p/yahoo_finance_en-US_h_p_finance_2.png,DELL,Yahoo,HPE stock was poised to open sharply higher on Tuesday after a blowout quarter for the maker of servers and networking products.,https://finnhub.io/api/news?id=6fa8d7b6d9f4c6269435e119e1668b2325ca4bc0e9a55bd9dd5e9e471ee40ca8
company,1780367160,CNBC Daily Open: Trading the signals vs the noise,140501582,https://image.cnbcfm.com/api/v1/image/108257482-1769516882258-gettyimages-2235057548-yeh_8167_n0lplzwh_xmzisqlh_vtemfgh3.jpeg?v=1776020277&w=1920&h=1080,DELL,CNBC,"Anthropic files for its IPO and OpenAI's Sam Altman discusses going public with CNBC, while Iran uncertainty continues to move oil markets.",https://finnhub.io/api/news?id=880f3739da7b6bcea6d3c897e5bc5a91ed3f13e5de3c77471b1ab254009062b5
company,1780366289,Microsoft And Nvidia RTX Spark Puts AI PCs In Investor Focus,140496188,https://s.yimg.com/rz/stage/p/yahoo_finance_en-US_h_p_finance_2.png,DELL,Yahoo,"Nvidia and Microsoft have launched the RTX Spark AI superchip for Windows PCs, targeting AI powered personal computing. Spark enabled Windows devices from Microsoft, Dell, HP, Lenovo and others are expected to arrive this fall. The partnership aims to support local AI, personal agents running directly on devices, and new security features. For investors watching NasdaqGS:MSFT, the RTX Spark launch adds a fresh angle to the Windows story by linking the operating system directly to on device...",https://finnhub.io/api/news?id=655e1e17aa22449d09ce55fc87c6aef44c4097bd759f6495f69b29b8a2e176cc
company,1780366242,Nvidia Expands Into CPUs As AI Partnerships Grow And Valuation Stretches,140496189,https://s.yimg.com/rz/stage/p/yahoo_finance_en-US_h_p_finance_2.png,DELL,Yahoo,"Nvidia (NasdaqGS:NVDA) announced the RTX Spark superchip platform for Windows PCs and the Vera CPU for data centers, expanding into CPU markets that have traditionally centered on other large chip suppliers. The company introduced open source physical AI tools and agentic AI platforms, including Agent Toolkit, Cosmos, Alpamayo, Isaac Groot for robotics, and Vera Rubin for AI factories. Nvidia also disclosed new partnerships with Microsoft, MediaTek, Dell, TSMC, Uber, VinFast, and Foxconn,...",https://finnhub.io/api/news?id=4b17d7c81ee81117c2515a5622b50e51567b86b5c1856b170e24d569137df470
company,1780366131,"ServiceNow (NOW) Shares Skyrocket, What You Need To Know",140496190,https://s.yimg.com/rz/stage/p/yahoo_finance_en-US_h_p_finance_2.png,DELL,Yahoo,"Shares of enterprise workflow automation company ServiceNow (NYSE:NOW) jumped 9.4% in the afternoon session after it continued to rally extending double digit gains from the previous session, which was driven by two forces: Snowflake's blowout Q1 results showing enterprise AI adoption is accelerating rather than disrupting software demand, and Dell's confirmation that enterprises are committing to full-stack AI infrastructure at a scale nobody had modelled.",https://finnhub.io/api/news?id=d8c11b82eb6b4254b79f2f0100e183f0c1eaa50ca93b577bf4a5cabbb4773bdc
company,1780365651,Why Qualcomm (QCOM) Shares Are Trading Lower Today,140496192,https://s.yimg.com/rz/stage/p/yahoo_finance_en-US_h_p_finance_2.png,DELL,Yahoo,"Shares of wireless chipmaker Qualcomm (NASDAQ:QCOM) fell 7.7% in the afternoon session after competitor Nvidia unveiled its new RTX Spark superchip, a powerful processor for Windows PCs that directly challenges Qualcomm's Snapdragon series.",https://finnhub.io/api/news?id=e0cbbfb9af307e7aafe1d6b14c601d82c0ee8eff987a3b90b7b4bffa48f1d9e0
company,1780362771,Why Dell (DELL) Stock Is Trading Up Today,140495481,https://s.yimg.com/rz/stage/p/yahoo_finance_en-US_h_p_finance_2.png,DELL,Yahoo,Shares of computer hardware and IT solutions company Dell (NYSE:DELL) jumped 9.5% in the afternoon session after it continued a rally from the previous trading session as the company posted record-breaking fiscal first-quarter results driven by surging demand for its artificial intelligence (AI) servers.,https://finnhub.io/api/news?id=9a5185c7f958fa7873a11f9d6835865b77ff09cde5ffd8a8e060f6579959eb19
company,1780359036,Encourage profit-taking as equity pullback looks likely: Barnum Financial Group,140501744,https://image.cnbcfm.com/api/v1/image/108314954-17803603171780360314-46296475621-1080pnbcnews.jpg?v=1780360317&w=1920&h=1080,DELL,CNBC,"Chris Kampitsis, Managing Partner at Barnum Financial Group, says that he is encouraging his clients to take in profits if they have are exposed to assets that have seen tremendous growth in the last 9 weeks. He explains that a pull back is inevitable and that they are expecting pre U.S. mid-term election jitters to rattle the market.",https://finnhub.io/api/news?id=937bcfb73e65378f56288857901a09888ac901625838ce773c03c4bebb041fe9
