category,datetime,headline,id,image,related,source,summary,url
company,1780416120,Can Hasbro's Digital Push Unlock a New Growth Runway for MAGIC?,140502772,https://s.yimg.com/rz/stage/p/yahoo_finance_en-US_h_p_finance_2.png,HAS,Yahoo,HAS' MAGIC goes deeper into digital: Arena gets Marvel rights as Wizards & Digital Gaming revenues jump 26% and margins hit 51.2%.,https://finnhub.io/api/news?id=e039ff0607f6acfc13c93a94e75bf85f70eb40b7a8c0e7d23c80b85bdbac128d
company,1780416002,All You Need to Know About Hasbro (HAS) Rating Upgrade to Strong Buy,140502773,https://s.yimg.com/rz/stage/p/yahoo_finance_en-US_h_p_finance_2.png,HAS,Yahoo,"Hasbro (HAS) might move higher on growing optimism about its earnings prospects, which is reflected by its upgrade to a Zacks Rank #1 (Strong Buy).",https://finnhub.io/api/news?id=ee5f994f5972e2e15a08ea6afa90a8a3d0871039ac04786e1a25398202a854e0
company,1780408501,"Bears are Losing Control Over Hasbro (HAS), Here's Why It's a 'Buy' Now",140500784,https://s.yimg.com/rz/stage/p/yahoo_finance_en-US_h_p_finance_2.png,HAS,Yahoo,"Hasbro (HAS) appears to have found support after losing some value lately, as indicated by the formation of a hammer chart. In addition to this technical chart pattern, strong agreement among Wall Street analysts in revising earnings estimates higher enhances the stock's potential for a turnaround in the near term.",https://finnhub.io/api/news?id=ce3ccefa4bd697d3a73acf8574df4bad77451f39daf3637b1137bc8b2f02ff36
company,1780407602,Are Consumer Discretionary Stocks Lagging  Hasbro (HAS) This Year?,140500785,https://s.yimg.com/rz/stage/p/yahoo_finance_en-US_h_p_finance_2.png,HAS,Yahoo,Here is how Hasbro (HAS) and Honest (HNST) have performed compared to their sector so far this year.,https://finnhub.io/api/news?id=215764ddb0541da9400ed234e7205ab6ed7ff557a78f89c54565cde48660028c
company,1780386120,Best Income Stocks to Buy for June 2nd,140497863,https://s.yimg.com/rz/stage/p/yahoo_finance_en-US_h_p_finance_2.png,HAS,Yahoo,"CRGY, HAS and PLGO made it to the Zacks Rank #1 (Strong Buy) income stocks list on June 2nd, 2026.",https://finnhub.io/api/news?id=a706b608b03f78afc6845a8f2fef4b4e6d27e6c7f6855235107b6e8e4eac752e
