category,datetime,headline,id,image,related,source,summary,url
company,1780427600,"Coinbase, Kalshi's New Crypto Futures Send These Stocks Sprawling",140504356,https://s.yimg.com/rz/stage/p/yahoo_finance_en-US_h_p_finance_2.png,ICE,Yahoo,"Coinbase, Kalshi launch perpetual futures backed by the CFTC. Cboe, CME, ICE stock tumble on the news.",https://finnhub.io/api/news?id=5f767b75dd367e02217bb861b7a1427367d1998fb15a9dfdbb3680f16356e94d
company,1780404900,NYSE Content Update: Impulse Space Scores $500 Million in Series D Funding,140499349,https://s.yimg.com/rz/stage/p/yahoo_finance_en-US_h_p_finance_2.png,ICE,Yahoo,The New York Stock Exchange (NYSE) provides a daily pre-market update directly from the NYSE Trading Floor. Access today's NYSE Pre-market update for market insights before trading begins.,https://finnhub.io/api/news?id=18fa9af7c30c6b97cf018ffdf16692bc9da797d731899c65516ded3ee68a7cbc
company,1732024876,"CNBC Halftime Report Final Trades: Nasdaq, D.R. Horton, CrowdStrike, iShares Core S&P Small-Cap ETF",139956959,,ICE,Benzinga,,https://finnhub.io/api/news?id=ffadfc9ec21cf5d5d2aaf304368c94b9f02dcfd95a26c02c0b4c0134e79b8239
company,1780401472,The CFTC has sparked a potential revolution on Wall Street. Exchange stocks are dropping,140502003,https://image.cnbcfm.com/api/v1/image/108233443-1764337969884-gettyimages-2246639666-CBOT_FUTURE.jpeg?v=1764338018&w=1920&h=1080,ICE,CNBC,Investors are worried about increased competition for the traditional exchanges that have long dominated on Wall Street.,https://finnhub.io/api/news?id=27458f9aa5a9058797936578de331d1e8c1154c55a718c414d9de7125370284e
company,1780362478,How The Quiet Analyst Outlook Is Shaping Intercontinental Exchange (ICE)’s Evolving Investment Narrative,140495639,https://s.yimg.com/rz/stage/p/yahoo_finance_en-US_h_p_finance_2.png,ICE,Yahoo,"Intercontinental Exchange has no price target changes in the latest analyst update, which on its own can be just as informative for you as a headline move. With no new commentary from analysts this time, the focus shifts to how existing expectations and prior narratives might still be shaping sentiment around the stock. Read on to see how to track these quiet periods and keep up with the evolving story as new information emerges. Stay updated as the Fair Value for Intercontinental Exchange...",https://finnhub.io/api/news?id=310a771c262e56037aa2a0f73611c6f908651bab37fd144e2582f0f1f4de5da3
