category,datetime,headline,id,image,related,source,summary,url
company,1780391030,SK Hynix Plans to Double Capacity to Ease Memory Chip Crunch,140497739,https://s.yimg.com/rz/stage/p/yahoo_finance_en-US_h_p_finance_2.png,META,Yahoo,"(Bloomberg) -- SK Hynix Inc. plans to double its memory chip capacity over the coming half-decade, a major expansion that should help ease a global shortage of an essential component of AI.Most Read from BloombergRussia Finance Officials Tell Putin War Spending Is UnaffordableCanada Dips Into Technical Recession for First Time Since 2020Alphabet to Raise $80 Billion in Equity for AI SpendingUS Says Deals With Iran for Safe Hormuz Transit Are ProhibitedAndrew Left Found Guilty in Case That Spooke",https://finnhub.io/api/news?id=06dc50588dbefcdeae87c84d49fe6ca249e5ab13061fc9cd87f411e1efa9cf9d
company,1780390611,Google Has $126 Billion In Cash. Why Is Wall Street Funding Its AI Push?,140501001,https://cdn.benzinga.com/files/images/story/2026/06/02/Nyc--Ny-usa--July-16-2020--Googles-Ny-Of.jpeg?width=2048&height=1536,META,Benzinga,Alphabet&#39;s reported $80 billion AI fundraising plan raises a key question for investors: why tap Wall Street when the company already has $126 billion in cash?,https://finnhub.io/api/news?id=8ca710e0edcd5e41af408cf4073ce621d19c7d51cda04df0564da2f4130ddb8e
company,1780389047,OpenAI's Sam Altman Is Reportedly Backing A Little-Known Startup That Wants To Bring AI Into The Physical World,140501439,https://cdn.benzinga.com/files/images/story/2026/06/02/Openai-Ceo-Sam-Altman-Attends-The-Artifi.jpeg?width=2048&height=1536,META,Benzinga,"OpenAI CEO Sam Altman backs Alfred, a 9-month-old physical AI startup founded by former Tesla and Meta employees.",https://finnhub.io/api/news?id=ecba391885c2e7a04fc74179af59929f9824640b55b8ddeb252c29d842ba5fb2
company,1780387201,Nvidia's new PC chips represent CEO Huang's bid to win at every layer of AI stack,140501577,https://image.cnbcfm.com/api/v1/image/108314509-1780318212098-gettyimages-2278510024-TAIWAN_COMPUTEX.jpeg?v=1780318269&w=1920&h=1080,META,CNBC,"Nvidia's announced entry into the PC chip market sent shares of AMD, Intel and Qualcomm lower as Wall Street recognized the threat.",https://finnhub.io/api/news?id=bc921004a97c5964dbcf5d5e8de905b9580fd2b6cd3eac41242a8ed2e2455299
company,1780385468,Dan Loeb Touted Semiconductors As The 'Most Attractive Sector' In AI Boom— But His Nvidia Sell-Off Tells A Different Story,140501004,https://cdn.benzinga.com/files/images/story/2026/06/02/New-York--Usa--24-Mar-2025-Selective-Foc.jpeg?width=2048&height=1536,META,Benzinga,"Despite praising Nvidia&#39;s &#34;monster quarter,&#34; billionaire Dan Loeb&#39;s Q1 13F reveals Third Point dumped nearly 90% of its NVDA stock.",https://finnhub.io/api/news?id=b48a2062c45df4ff9c6c6ed721b213d467e2296d8c9f1035c54443c2c8816430
company,1780381621,"EXCLUSIVE: Bear Cave Founder Backs Andrew Left, Hopes Citron Short Seller's Conviction Is 'Reversed On Appeal' As Disclosure Rules Remain 'Unclear'",140501441,https://cdn.benzinga.com/files/images/story/2026/06/02/Close-up-Of-A-Stock-Market-Candlestick-C.jpeg?width=2048&height=1536,META,Benzinga,"Exclusive: Bear Cave founder Edwin Dorsey backs Andrew Left after fraud conviction, citing unclear disclosure rules for short sellers.",https://finnhub.io/api/news?id=96c803e4be265f549b1fa20670b248d844730a3e5e9666f5dd2c924027e3aa82
company,1780380682,Former Meta CTO Says Industrial Robotics Will Scale Faster Than Home Robots,140501442,https://cdn.benzinga.com/files/images/story/2026/06/02/Woman-And-Ai-Robot-Working-Together-In-T.jpeg?width=2048&height=1536,META,Benzinga,Former Meta CTO Mike Schroepfer says industrial robotics will scale faster than home robots due to controlled environments.,https://finnhub.io/api/news?id=ee9694b0d52a83910792e29f2881e9094c4ece6518e4b3eafc71e94db622965c
company,1780380408,AMD Bets On The Next AI Bottleneck As DriveNets Raises $410 Million,140501005,https://cdn.benzinga.com/files/images/story/2026/06/02/AMD-Signboard-At-Headquarters.jpeg?width=2048&height=1536,META,Benzinga,DriveNets raised $410 million with new backing from AMD as investor focus expands beyond AI chips to networking infrastructure.,https://finnhub.io/api/news?id=2ca318ee714b795a023f85aaf84e2262929a25bbf0d14eec049bed2d24434c3f
company,1780379672,"EU Moves To Tighten Cloud Rules In State Tenders, Raising Pressure On Amazon, Microsoft And Google: Report",140501006,https://cdn.benzinga.com/files/images/story/2026/06/02/Big-Five-Companies--Big-Tech-Company-Log.jpeg?width=2048&height=1536,META,Benzinga,EU plans stricter cloud procurement rules to cut reliance on U.S. tech giants and boost digital sovereignty.,https://finnhub.io/api/news?id=a99bb1bbb1c20d9eca11362cc9ced48e4ca7605ed69fe0a225cbda511875682b
company,1780375599,Softbank's Masayoshi Son Isn't Worried About An AI Bubble— He's Hunting For The Next Trillion-Dollar Industry: 'Just The Beginning',140500032,https://cdn.benzinga.com/files/images/story/2026/06/02/Taipei-City--Taiwan---Jun-22--2019masayo.jpeg?width=2048&height=1536,META,Benzinga,SoftBank CEO Masayoshi Son says physical AI and robotics are trillion-dollar opportunities and AI is just beginning.,https://finnhub.io/api/news?id=17cef5d53e7198dbec4c2c15ba4a7db0efedad19c15f864fda206d39b3fa86ff
company,1780374275,"Oracle Joins Arm's AGI CPU Ecosystem As Agentic AI Boom Draws Meta, OpenAI And ByteDance",140499996,https://cdn.benzinga.com/files/images/story/2026/06/02/Arm-Company-Logo-Seen-On-Stm32-Microchip.jpeg?width=2048&height=1536,META,Benzinga,Oracle joins Arm&#39;s AGI CPU ecosystem as CEO Rene Haas reveals ByteDance is also adopting the AI-focused chips.,https://finnhub.io/api/news?id=59d5ec4d32d3806f27da2ae36249a5a4dee0a9d16a546a9d6a25a3c8c7ff5821
company,1780369993,A Look At Snap (SNAP) Valuation After Meta Hires Key Content Partnerships Executive,140496200,https://s.yimg.com/rz/stage/p/yahoo_finance_en-US_h_p_finance_2.png,META,Yahoo,"Snap (SNAP) has come under fresh scrutiny after Meta hired Jim Shepherd, the company’s former senior director of global content partnerships, to lead creator and content initiatives for its growing wearables business. See our latest analysis for Snap. The latest 1-day share price return of 2.63% and 90-day share price return of 11.62% sit against a year-to-date share price decline of 27.92% and a 5-year total shareholder return decline of 90.45%. This points to short term momentum but a weak...",https://finnhub.io/api/news?id=440d11a1d0d0c3d65fe4fc6902407bafaa2cbc4f63d53fb66df344c116c95ebb
company,1780368475,"META Stock Still Trails Mag 7 Peers Even After New Subscriptions, Layoffs, Cloud Plans — Retail Sniffs Buying Opportunity",140496201,https://s.yimg.com/rz/stage/p/yahoo_finance_en-US_h_p_finance_2.png,META,Yahoo,"Meta shares fell sharply on Monday without a clear trigger, while retail sentiment moved up.",https://finnhub.io/api/news?id=bd5cce3c4b10db4323ccdb9e058bdc1c7df216c4b77ad5e0f1c814e211e7a95c
company,1780362180,TSMC executive drops blunt message on AI chip’s next frontier,140495484,https://s.yimg.com/rz/stage/p/yahoo_finance_en-US_h_p_finance_2.png,META,Yahoo,"Wall Street has spent years pricing AI chip stocks on one core assumption: raw computing power wins. More transistors, more speed, more performance. That was the race, and investors bid up names including Nvidia (NVDA), Taiwan Semiconductor Manufacturing Company (TSM), and Broadcom (AVGO) ...",https://finnhub.io/api/news?id=a529cfbde4489d965648b197484e1491944c43d222501972382afe2fd1dcccb3
company,1780360620,Bank of America reiterates Amazon stock forecast at tipping point,140495487,https://s.yimg.com/rz/stage/p/yahoo_finance_en-US_h_p_finance_2.png,META,Yahoo,"Amazon (AMZN) stock is up about 14.63% year to date, at the time of writing, Monday afternoon, June 1. Meanwhile, the SPDR S&P 500 Index (SPY) is up about 11.01% in the same period. And while Amazon has just slightly outpaced the S&P 500, it has also outpaced all but two Magnificent 7 ...",https://finnhub.io/api/news?id=3d6b65a46fa1e02221f3cf46a7aac3f8b9ba3fc527b7e1ee9c6bf9d4adaefa27
company,1780358786,Jim Cramer Says It Seems OpenAI Wants To Go Public 'Real Soon' But Wonders If There's 'Enough Money Around' With SpaceX And Anthropic Vying For Funds,140501011,https://cdn.benzinga.com/files/images/story/2026/06/02/Chinas-Exports-Surge-Despite-US-Shortfal.jpeg?width=2048&height=1536,META,Benzinga,"Jim Cramer believes OpenAI may be nearing an IPO, warning that investor capital could be stretched by the AI boom.",https://finnhub.io/api/news?id=04eadb280334c1b105f7bae166a420887b8509c7a16d986edad179cf6376d332
