category,datetime,headline,id,image,related,source,summary,url
company,1778093720,Analyst Raises Merck (MRK) Price Target by $1 After Beating Q1 Estimates,140195104,https://s.yimg.com/rz/stage/p/yahoo_finance_en-US_h_p_finance_2.png,MRK,Yahoo,"With an upside potential of 21.26% as of May 3, Merck & Co., Inc. (NYSE:MRK) is included among the 10 Best Fortune 500 Stocks to Buy According to Analysts. Merck & Co., Inc. (NYSE:MRK) is a global health care company working to deliver innovative health solutions through our medicines, vaccines, biologic therapies, and animal health products. […]",https://finnhub.io/api/news?id=fb59635e632bc5289f442db425ebea4e719ecc5c7baa1eabaec5cf28b0d47411
company,1778083140,"EXEL Q1 Earnings Top Estimates, Colorectal Cancer Drug in Focus",140193629,https://s.yimg.com/rz/stage/p/yahoo_finance_en-US_h_p_finance_2.png,MRK,Yahoo,EXEL beats Q1 EPS estimates on lower costs and buybacks but misses on revenues; Cabometyx sales lag estimates as pipeline progress and new buybacks stay in focus.,https://finnhub.io/api/news?id=e70e33e771426734c94983610aecbe5831aba37705f40a831be409c0a915cf0e
company,1778077951,6 Pharma Dividend Stocks Yielding Up to 6.44% — and They’ve Survived Every Market Crash,140191445,https://s.yimg.com/rz/stage/p/yahoo_finance_en-US_h_p_finance_2.png,MRK,Yahoo,"Dividend income arrives whether markets rally or sell off. For investors seeking recurring cash flow, high-yield equities remain the cleanest source outside a paycheck. They settle in cash, clear immediately, and can be redeployed or spent without selling property or waiting on private placements. Pharma is one of the few sectors where mature franchises, regulatory ... 6 Pharma Dividend Stocks Yielding Up to 6.44% — and They’ve Survived Every Market Crash",https://finnhub.io/api/news?id=4e09d8ab6bb836c11253912678951eee7781a9a74dfdf34fc85e358cc30d34d7
company,1778076970,Is Merck (MRK) Still Attractive After Recent Pullback And Conflicting Valuation Signals,140191499,https://s.yimg.com/rz/stage/p/yahoo_finance_en-US_h_p_finance_2.png,MRK,Yahoo,"Wondering whether Merck’s current share price reflects its real value, or if the stock might be pricing in more than it should. Merck closed at US$113.15, with returns of 2.8% over 7 days, a 6.4% decline over 30 days, 6.3% year to date and 48.4% over the last year. Recent headlines around Merck have kept investors focused on how the company is being priced, with attention on its long term prospects and capital allocation decisions. This context helps explain why the stock’s recent moves have...",https://finnhub.io/api/news?id=0b7cc9e16f3b9a59beee54ce70da30cb0f104b755cff581c866fe520ec5bf3f9
company,1778074733,"AMD upgraded, Reddit downgraded: Wall Street's top analyst calls",140189776,https://s.yimg.com/rz/stage/p/yahoo_finance_en-US_h_p_finance_2.png,MRK,Yahoo,"AMD upgraded, Reddit downgraded: Wall Street's top analyst calls",https://finnhub.io/api/news?id=0a45d20ef110269920ebbff738b53b9b2404cd5b2b7599db2278b27647105637
company,1778074270,Why The Dip In TEM Stock Is A Buying Window,140189848,https://s.yimg.com/rz/stage/p/yahoo_finance_en-US_h_p_finance_2.png,MRK,Yahoo,"Beneath the headline noise of a Q1 2026 beat and raised guidance, the critical insight for Tempus AI lies in a structural tug of war between an accelerating data moat and a currently elevated cost structure. The market is focusing on the 36% year over year top line growth to $348.1 million. The true alpha driver is hidden within the unit economics of the Data and Applications segment. This division is actively shifting the company from a traditional diagnostics provider to a recurring revenue he",https://finnhub.io/api/news?id=85ab3efeb205d11801a114c96726bada04e41605fe80bd4d9d204668221968d0
company,1778073347,Can Pfizer Stock Outrun A $17B Revenue Void?,140189759,https://s.yimg.com/rz/stage/p/yahoo_finance_en-US_h_p_finance_2.png,MRK,Yahoo,"The true narrative for Pfizer (PFE) is not its recent top line earnings beat but the escalating structural tension between its required research spending and an impending revenue void. First quarter 2026 results showed an adjusted earnings per share of $0.75 on $14.5 billion in revenue. While these numbers exceeded consensus estimates, they mask a deeper profitability issue. The primary insight hiding within the earnings noise is that Pfizer is funding its future growth at the direct expense of",https://finnhub.io/api/news?id=d24510dacd9f86d4bc2443c67032898ed4484be2eb62892acb578316290a9f6e
company,1778072400,Merck Animal Health Selects Salesforce’s Agentforce Life Sciences for Customer Engagement to Transform Animal Care and Enhance Support Experiences for Employees,140189850,https://s.yimg.com/rz/stage/p/yahoo_finance_en-US_h_p_finance_2.png,MRK,Yahoo,"SAN FRANCISCO & RAHWAY, N.J., May 06, 2026--Salesforce (NYSE: CRM), the world’s #1 AI CRM, and Merck Animal Health, known as MSD Animal Health outside of the United States and Canada, a division of Merck & Co., Inc. (NYSE: MRK), today announced that Merck Animal Health has selected Agentforce Life Sciences for Customer Engagement to create a unified, 360-degree view and support experience for veterinarians, pet owners, and production animal farmers across all channels.",https://finnhub.io/api/news?id=ff7890b266af86eb4bf7007cbbd788fd5f8c55a599d228648aaa043d9787f746
company,1778068800,Timothy P. Walbert Joins Patient Square Capital as a Senior Advisor,140189819,https://s.yimg.com/rz/stage/p/yahoo_finance_en-US_h_p_finance_2.png,MRK,Yahoo,"MENLO PARK, Calif., May 06, 2026--Patient Square Capital, a leading health care investment firm, today announced that Timothy P. Walbert has joined the firm as a Senior Advisor.",https://finnhub.io/api/news?id=376a85cdf876d297d0512e9ace99f97fc4b3b8fe74e7dc9e472b0500a2c5c6cf
company,1778068264,"Here Are Wednesday’s Top Wall Street Analyst Research Calls: Advanced Micro Devices, American Eagle Outfitters, GlobalFoundries, IAC, Merck, Palantir Technologies, Reddit, and More",140188066,https://s.yimg.com/rz/stage/p/yahoo_finance_en-US_h_p_finance_2.png,MRK,Yahoo,"Pre-Market Stock Futures: Futures are trading higher on Wednesday as news of an impending end to the Iran war is sending oil prices dramatically lower. This news comes after a bounce-back Tuesday that benefited from lower oil prices, some strong earnings, and solid buying from retail investors. At the same time, hedge funds continue to ... Here Are Wednesday’s Top Wall Street Analyst Research Calls: Advanced Micro Devices, American Eagle Outfitters, GlobalFoundries, IAC, Merck, Palantir Technolo",https://finnhub.io/api/news?id=7bac9e5879f3e8f7994a3a71231cd5e5fecec3d04349c9ad6a9374f40f58f0d6
company,1778060864,MSD concludes Terns acquisition to expand CML pipeline,140188097,https://s.yimg.com/rz/stage/p/yahoo_finance_en-US_h_p_finance_2.png,MRK,Yahoo,The FDA granted breakthrough therapy designation to TERN-701 for adults with Philadelphia chromosome-positive CML without the T315I mutation.,https://finnhub.io/api/news?id=d6a2d66a9a01cb8c19e4e10fdc69bacd2c47981d0a8eca8a7275d5405ac361ea
company,1778047946,Tempus AI's Big Pharma AI Partnerships Are Getting Bigger And Stickier,140191891,https://cdn.benzinga.com/files/images/story/2026/05/06/Tempus-AI-Logo-On-Mobile-Phone.jpeg?width=2048&height=1536,MRK,Benzinga,"Tempus AI (TEM) Q1 results: Revenue up 36.1% to $348.1M, beating estimates. TEM raises 2026 outlook amid strong AI &amp; diagnostic demand.",https://finnhub.io/api/news?id=6337558b0308c69e5fe20a69649297df8d3bc0cd799aa4729f994711b44577c7
company,1778036951,Tempus AI Q1 Earnings Call Highlights,140184444,https://s.yimg.com/rz/stage/p/yahoo_finance_en-US_h_p_finance_2.png,MRK,Yahoo,"Tempus AI (NASDAQ:TEM) reported first-quarter 2026 revenue of $348.1 million, up a little over 36% year over year, as the company posted growth across both its diagnostics and data and applications segments and raised its full-year outlook. Founder and CEO Eric Lefkofsky said diagnostics revenue ca",https://finnhub.io/api/news?id=2e6f642a42ac2736c192079bec29a04706c7f14b8b5a510adf61d2bd94e6489f
company,1778031348,Halozyme Therapeutics AGM: Shareholders Elect Directors as CEO Torley Raises 2026 Guidance,140183673,https://s.yimg.com/rz/stage/p/yahoo_finance_en-US_h_p_finance_2.png,MRK,Yahoo,"Halozyme Therapeutics (NASDAQ:HALO) stockholders elected two Class I directors and approved several governance items at the company’s annual meeting, while President and CEO Helen Torley highlighted 2025 execution, recent acquisitions, new commercial agreements, and updated financial guidance. Stoc",https://finnhub.io/api/news?id=d2b3da3b1dfcab71cd616171f39484d18561d77f8cfae3bbb979260013b9774e
company,1778026867,"Arcus Biosciences, Inc. Q1 2026 Earnings Call Summary",140188098,https://s.yimg.com/rz/stage/p/yahoo_finance_en-US_h_p_finance_2.png,MRK,Yahoo,"Moby summary of Arcus Biosciences, Inc.'s Q1 2026 earnings call",https://finnhub.io/api/news?id=086b01ad0045762f8e1ec837829a574e18c84c5673771987c4bbd65521bf365c
