category,datetime,headline,id,image,related,source,summary,url
company,1778106540,3 Companies Reporting Record Results This Earnings Season,140199387,https://s.yimg.com/rz/stage/p/yahoo_finance_en-US_h_p_finance_2.png,NEM,Yahoo,"The 2026 Q1 earnings season continues to be one of positivity, with many notable companies - Newmont (NEM), Interactive Brokers (IBKR), and Quanta Services (PWR) - all knocking it out of the park, reporting quarterly records in one way or another.",https://finnhub.io/api/news?id=14f5f42b2941beea75f6005b880228b977b52131944d11108b35702cb2d888f0
company,1778099053,Inside India newsletter: Social media is reshaping the world's fastest-growing market for global brands,140209446,https://image.cnbcfm.com/api/v1/image/108303404-1778117979048-gettyimages-2237854452-DSC_4860.jpeg?v=1778118020&w=1920&h=1080,NEM,CNBC,Social media influencers are urging consumers to read labels and pushing traditional companies to make healthier products or risk being replaced by newer entrants.,https://finnhub.io/api/news?id=01cd630750e0d1f2edb8898d254f8004bcb902626994af5a64904618bd5f3367
company,1778089551,This $4 Million NMI Holdings Sale Comes as the Insurer Grows Book Value 15%,140193698,https://s.yimg.com/rz/stage/p/yahoo_finance_en-US_h_p_finance_2.png,NEM,Yahoo,This specialty insurer provides private mortgage guaranty solutions and loan review services to U.S. mortgage lenders and investors.,https://finnhub.io/api/news?id=ae8de25408fd681b941308c9256e79916439763365b40d5152d8ccb5802e09cf
company,1778071200,Barrick Mining Stock Down 6% in a Month: What Should Investors Do Now?,140189948,https://s.yimg.com/rz/stage/p/yahoo_finance_en-US_h_p_finance_2.png,NEM,Yahoo,"B shares drop 6% in a month on weaker gold prices, but strong cash flows, growth projects and a solid dividend keep the investment case intact.",https://finnhub.io/api/news?id=a37ef42602cc77d88d2f0b09159a3669ed29bc9840a865c3f0157b53b98d845d
company,1778070290,"Copper, Silver, Gold Price Jump As Oil Dives. These Stocks Are Near Buy Points.",140189949,https://s.yimg.com/rz/stage/p/yahoo_finance_en-US_h_p_finance_2.png,NEM,Yahoo,"Copper and gold prices jumped over 3% early Wednesday, while silver surged around 6% after President Donald Trump called off ""Project Freedom,"" which had threatened the ceasefire between Iran and the U.S. military in the Strait of Hormuz.  Copper giant Freeport-McMoRan and gold and silver miner Newmont were among the top S&P 500 stock advancers ahead of the open.  The list includes BHP Group, Rio Tinto, Vale.",https://finnhub.io/api/news?id=f452b39e40d540131b53edb4ec219205a4ab568a7e0f1891c7c0c96b9ec52d1b
