category,datetime,headline,id,image,related,source,summary,url
company,1778095709,Jim Cramer talks the record rally in semi stocks,140209447,https://image.cnbcfm.com/api/v1/image/108303382-4ED1-REQ-050626-MMABLOCK.jpg?v=1778106787&w=1920&h=1080,NOW,CNBC,'Mad Money' host Jim Cramer talks semiconductor stocks ripping higher in Wednesday's trading session.,https://finnhub.io/api/news?id=8579aece4c60ffe1d5a10a5e0d186d4bf67d099b4cdfa86df044a45567bd9d1e
company,1778095678,ServiceNow And NVIDIA Project Arc Puts AI Agents At Center Stage,140194966,https://s.yimg.com/rz/stage/p/yahoo_finance_en-US_h_p_finance_2.png,NOW,Yahoo,"ServiceNow (NYSE:NOW) and NVIDIA have expanded their partnership with Project Arc, an autonomous desktop AI agent for enterprises. Project Arc is designed to run under ServiceNow's AI Control Tower with security supported by NVIDIA OpenShell. The collaboration targets production ready, governed AI agents that can handle complex, multi step enterprise workflows. ServiceNow, trading at $92.01, is moving through this launch after a 37.6% decline year to date and a 52.3% decline over the past...",https://finnhub.io/api/news?id=24fff21d4c290b54f6b8a81961bee9dac630dd1a2d52d72f5c5ebdc88b9fa123
company,1778091605,ServiceNow (NOW) Valuation Check After Knowledge 2026 AI Partnerships And Product Launches,140194993,https://s.yimg.com/rz/stage/p/yahoo_finance_en-US_h_p_finance_2.png,NOW,Yahoo,"ServiceNow (NOW) is back in focus after a packed Knowledge 2026 event, where it expanded partnerships with Nvidia, Microsoft, Google Cloud, and Lenovo and unveiled Project Arc, ServiceNow Otto, and an expanded AI Control Tower. See our latest analysis for ServiceNow. Despite all the AI news and partnerships, the stock is still working through a reset. It has a 30 day share price return of 9.79% and a year to date share price return of 37.60%, while the 1 year total shareholder return of...",https://finnhub.io/api/news?id=1194615f125613d779bf2a044d56d8a8aa21fd808d1302864bb31faa7ac5999a
company,1778090400,Gotransverse and GQI Align Enterprise Workflows with Monetization Execution,140195347,https://s.yimg.com/rz/stage/p/yahoo_finance_en-US_h_p_finance_2.png,NOW,Yahoo,"AUSTIN, Texas, May 06, 2026--Gotransverse, a leader in enterprise monetization and revenue management, today announced a partnership with Gibson Quai International (GQI), a global technology consulting and ICT services organization specializing in ServiceNow® and enterprise workflow transformation.",https://finnhub.io/api/news?id=a5a8e04e799cc31894ba230b6b40efcf21ddea7f044880e94b2c0d4510e0f610
company,1778086800,ServiceNow and Accenture launch forward deployed engineering program to scale agentic AI across the enterprise,140193703,https://s.yimg.com/rz/stage/p/yahoo_finance_en-US_h_p_finance_2.png,NOW,Yahoo,"LAS VEGAS, May 06, 2026--Knowledge 2026 – Today, ServiceNow (NYSE: NOW), the AI control tower for business reinvention, and Accenture (NYSE: ACN) announced a forward deployed engineering (FDE) program to help enterprises take agentic AI from enterprise pilot to production at scale.",https://finnhub.io/api/news?id=f56ee5ec655223aeabc4d0d4f1a898a1917aaf42175c289ec07e33cd07e6724b
company,1778086800,"ServiceNow Build Agent now works inside every major AI coding tool, governed by default",140193718,https://s.yimg.com/rz/stage/p/yahoo_finance_en-US_h_p_finance_2.png,NOW,Yahoo,"LAS VEGAS, May 06, 2026--ServiceNow Build Agent now works inside every major AI coding tool, governed by default",https://finnhub.io/api/news?id=33249c666d068a8ae1c6cf25cc6a8d1b876a715a596033db5a7992fae36abb58
company,1778086800,ServiceNow launches the real-time data foundation that puts autonomous AI to work across the enterprise,140193717,https://s.yimg.com/rz/stage/p/yahoo_finance_en-US_h_p_finance_2.png,NOW,Yahoo,"LAS VEGAS, May 06, 2026--Knowledge 2026 – Today, at ServiceNow’s annual customer and partner event, Knowledge 2026, ServiceNow (NYSE: NOW), the AI control tower for business reinvention, launched new data capabilities that put autonomous AI to work on live, governed enterprise intelligence. The announcement helps resolve the data fragmentation siloed across systems that has held enterprise AI back, and delivers the live intelligence, execution, and agent governance that autonomous AI requires.",https://finnhub.io/api/news?id=6e978b5fa986b277ede3c12dc81c0f2644ebfe84c1ba2ea59b06531028b2c268
company,1778086800,ServiceNow hits $1 billion in AWS Marketplace transactions as enterprises rapidly adopt AI at scale,140193437,https://s.yimg.com/rz/stage/p/yahoo_finance_en-US_h_p_finance_2.png,NOW,Yahoo,"LAS VEGAS, May 06, 2026--ServiceNow and Amazon Web Services announced a platform expansion as companies rapidly deploy and scale agentic AI across the enterprise",https://finnhub.io/api/news?id=7a87a8b9e0f7d72aa493a26c2ad6ee224a2937a2e2f4144fcf50858b121e0961
company,1778083214,ServiceNow just told Wall Street it’s going to double again. Here’s why $30 billion of revenue isn’t crazy,140195348,https://s.yimg.com/rz/stage/p/yahoo_finance_en-US_h_p_finance_2.png,NOW,Yahoo,The enterprise software company grew from $3.5 billion to nearly $16 billion in six years. Now it says $30 billion by 2030 is conservative.,https://finnhub.io/api/news?id=60732750c7fbd4f58e80606942f5b5f5fb9b39698caebc6449c5fe89757d1b59
company,1778081968,Bernstein Hikes ServiceNow Price Target to $236: Was the Analyst Day a Win or a Trap?,140191350,https://s.yimg.com/rz/stage/p/yahoo_finance_en-US_h_p_finance_2.png,NOW,Yahoo,"Bernstein analyst Peter Weed raised his price target on ServiceNow (NYSE:NOW) to $236 from $226 while maintaining an Outperform rating, framing the company’s Analyst Day as a long-term margin and free cash flow win. The catch: the same event armed the bears with a 2030 subscription revenue target of $30 billion that implies growth decelerating ... Bernstein Hikes ServiceNow Price Target to $236: Was the Analyst Day a Win or a Trap?",https://finnhub.io/api/news?id=66e8b7d61bcd3def6d798ef1c05d3d18b151b9cf8c9f206d8e61f61390f16c62
company,1778081477,"ServiceNow, Inc. (NOW) Analyst/Investor Day Transcript",140194798,https://static.seekingalpha.com/assets/og_image_1200-29b2bfe1a595477db6826bd2126c63ac2091efb7ec76347a8e7f81ba17e3de6c.png,NOW,SeekingAlpha,"ServiceNow, Inc. (NOW) Analyst/Investor Day May 4, 2026 4:30 PM EDTCompany ParticipantsDarren Yip - Head of Investor RelationsWilliam McDermott - Chairman...",https://finnhub.io/api/news?id=a3588b6406639e41aabdb2cfdec28237a5f04e7e85fe3ee4b822ffaa6e16fdc3
company,1778081400,Anthropic CEO warns software companies can 'go bust' without AI,140191482,https://s.yimg.com/rz/stage/p/yahoo_finance_en-US_h_p_finance_2.png,NOW,Yahoo,"Anthropic (ANTH.PVT) co-founder and CEO Dario Amodei warned that some software companies could ""completely go bust"" while speaking at the AI developer's The Briefing: Financial Services event.. Morning Brief Host Julie Hyman and Yahoo Finance Head of News Myles Udland highlight Amodei's comments and the factors that could raise alarm bells for tech companies this late in the AI Boom.",https://finnhub.io/api/news?id=26e390080adf72847c5e2774b693113b436cc65221f7b7e9394e435f3e348572
company,1778080500,Tanium Combines Forces with ServiceNow to Deliver New Autonomous IT Solution Powered by Industry-Leading Platforms,140191617,https://s.yimg.com/rz/stage/p/yahoo_finance_en-US_h_p_finance_2.png,NOW,Yahoo,"LAS VEGAS, May 06, 2026--The Venetian, ServiceNow Knowledge 2026 – Tanium, a leader in Autonomous IT, today announced at ServiceNow Knowledge 2026 a partnership with ServiceNow to deliver a joint Autonomous IT solution – ITOM AI Prime powered by Tanium.",https://finnhub.io/api/news?id=6586df492a7e3ad1bd7da3d7762ccb8645766532e681b0dbfde02dbc91a4fb27
company,1778079780,Outreach Announces Integration with ServiceNow to Accelerate Revenue Execution Across the Entire Revenue Cycle,140191618,https://s.yimg.com/rz/stage/p/yahoo_finance_en-US_h_p_finance_2.png,NOW,Yahoo,"SEATTLE, May 06, 2026--Outreach, the agentic AI platform for revenue teams, announced a new integration with ServiceNow at Knowledge 2026. The integration brings revenue orchestration directly into ServiceNow’s Customer Relationship Management (CRM), enabling go-to-market teams to move faster, stay in flow, and take action across critical sales workflows. The integration enables revenue teams to execute key sales workflows across the full revenue motion in ServiceNow while keeping data aligned a",https://finnhub.io/api/news?id=768183ff209b6d1b3430a1756b1241e66ca1bc0315139c043d42a07ebbbb28b1
company,1778078711,Your company’s AI could delete everything in 9 seconds. ServiceNow wants to be the kill switch,140193720,https://s.yimg.com/rz/stage/p/yahoo_finance_en-US_h_p_finance_2.png,NOW,Yahoo,"Enterprises are deploying AI agents without identities, audit trails, or guardrails. Bill McDermott is betting $30 billion on fixing it.",https://finnhub.io/api/news?id=7374c6eef35afb085fa046b81a762c7aef50f9b07b2c18ebb1daf510fb240a2a
company,1778073959,"Bernstein Maintains Market Perform on ServiceNow, Raises Price Target to $236",140197929,,NOW,Benzinga,Bernstein  analyst Peter Weed   maintains ServiceNow (NYSE:NOW) with a Market Perform and raises the price target from $226 to $236.,https://finnhub.io/api/news?id=8542d410e5ed852f024c0e80a8bc2f0f182748204b708bec7796a6dbca340886
company,1778073845,SaaSpocalypse Doesn't Make Sense Any More,140192936,https://static.seekingalpha.com/cdn/s3/uploads/getty_images/1491434261/image_1491434261.jpg?io=getty-c-w1536,NOW,SeekingAlpha,"Buy IGV (iShares Tech-Software ETF) to diversify software exposure, reduce single-stock risk, and capture an AI-driven SaaS rerating amid volatilityâread...",https://finnhub.io/api/news?id=4ef8d1deb690f31a78b6e4bfb7b8c9912afa2373a29c8f379d09ea7f0ecc343e
company,1778073360,C1Secure Launches SmartAI Ops as the Operational Companion to ServiceNow AI Control Tower,140189971,https://s.yimg.com/rz/stage/p/yahoo_finance_en-US_h_p_finance_2.png,NOW,Yahoo,"C1Secure, the ServiceNow 2026 AMS Breakthrough Transformation Partner of the Year, today announced the availability of SmartAI Ops at ServiceNow Knowledge 2026. SmartAI Ops is purpose-built as a workspace companion to ServiceNow AI Control Tower, extending enterprise AI governance with continuous operational and economic visibility across every AI system running on ServiceNow.",https://finnhub.io/api/news?id=0f9719070dbfb03453d6e41e817154c05c16aafd90b29c9d58a9414127c65445
company,1778069655,"Jensen Huang on why ‘agentic’ will rewire a $50 trillion economy: ‘operated by robots, managed by more robots, and the entire factory is a robot’",140193721,https://s.yimg.com/rz/stage/p/yahoo_finance_en-US_h_p_finance_2.png,NOW,Yahoo,The Nvidia CEO keeps showing up at ServiceNow's annual conference. The reason why explains the next decade of the AI economy.,https://finnhub.io/api/news?id=6d16d814fe5280afc7cf2b2450633e68d5fc0fd8ac674751c604e58c0b74a870
company,1778066800,ServiceNow CEO on AI: Agents have picked up work that would have been done by other people,140192554,https://image.cnbcfm.com/api/v1/image/108302995-17780782981778078295-45747323179-1080pnbcnews.jpg?v=1778078297&w=1920&h=1080,NOW,CNBC,CNBC's Jon Fortt joins 'Squawk on the Street' to report on his conversation with ServiceNow CEO Bill McDermott.,https://finnhub.io/api/news?id=0e862d035f68fee1898c88c372fa504d77941aaa17118c5b16da76447c38d61e
company,1778053008,"Bill McDermott, ServiceNow CEO: A Fortt Knox Update",140209738,https://image.cnbcfm.com/api/v1/image/108302835-260505-mcdermott.jpg?v=1778067256&w=1920&h=1080,NOW,CNBC,"ServiceNow CEO Bill McDermott tells Jon Fortt at Knowledge 2026 that the gap between Wall Street and ServiceNow's fundamentals is the entry point of a generation: $2B repurchased in Q1, no 10b5-1 sales at the board or executive level, six $1B-plus business lines, rule-of-56 headed to 60. His pitch: ServiceNow as the AI control tower governing OpenAI, Anthropic, and Gemini agents inside the enterprise. Doubling the company in the next few years.",https://finnhub.io/api/news?id=447a35434e9a6d139a024e14a9e45cf53bf5cf0b11bd53b40a37e4a5548d1d57
company,1778036756,"ServiceNow, Inc. (NOW) Analyst/Investor Day - Slideshow",140185631,https://static.seekingalpha.com/assets/og_image_1200-29b2bfe1a595477db6826bd2126c63ac2091efb7ec76347a8e7f81ba17e3de6c.png,NOW,SeekingAlpha,"2026-05-06. The following slide deck was published by ServiceNow, Inc.",https://finnhub.io/api/news?id=a353a5de952eae309a9ddeedac4e09d9669346209f67c019c05a1f64db557e9e
company,1778031837,"Transcript : ServiceNow, Inc. - Analyst/Investor Day",140185087,,NOW,Finnhub,"Presenter SpeechDarren Yip Welcome to ServiceNow's Financial Analyst Day 2026. Thank you for joining us today. Before we begin, I want to remind everyone that today's event will be webcast and...",https://finnhub.io/api/news?id=f1487cf159053653fe5486478b645d9bfb120125350e050db20e7daab864bce0
