category,datetime,headline,id,image,related,source,summary,url
company,1780433100,2 Stocks to Buy Now for a Lifetime of Passive Income -- Starting Immediately,140506245,https://s.yimg.com/rz/stage/p/yahoo_finance_en-US_h_p_finance_2.png,O,Yahoo,"These are ""set-it-and-forget-it"" investments you don't have to think too much about.",https://finnhub.io/api/news?id=06bd49b415803936a369f674eec6146e38cd541748d7168c3544fad65caac22e
company,1780411829,Realty Income in a Roth IRA: The Smartest Way to Own This Monthly Dividend Machine,140500677,https://s.yimg.com/rz/stage/p/yahoo_finance_en-US_h_p_finance_2.png,O,Yahoo,"At the 24% federal bracket, a $250,000 position in Realty Income (NYSE: O) throws off roughly $13,150 a year at the current 5.3% yield. Held in a taxable brokerage, about $3,156 of that goes straight to the IRS every year. Held in a Roth, zero does. That is the entire premise of this article. Why ... Realty Income in a Roth IRA: The Smartest Way to Own This Monthly Dividend Machine",https://finnhub.io/api/news?id=8ba8fe9e8ab8da5f9d8fcb960c07641313b2dedc5b123f8bacf1c3a0612cd8f5
company,1780406566,"A $720,000 Income Portfolio That Pays Like a Part-Time Consulting Practice Without the Client Acquisition Grind",140499369,https://s.yimg.com/rz/stage/p/yahoo_finance_en-US_h_p_finance_2.png,O,Yahoo,"A $720,000 annual income is the kind of figure most people associate with a senior consultant’s billing target rather than a passive portfolio output. Yet for a 62-year-old weighing part-time work against living off invested capital, that figure is the right frame. Ten billable hours a week at $150 across 50 weeks produces a fraction ... A $720,000 Income Portfolio That Pays Like a Part-Time Consulting Practice Without the Client Acquisition Grind",https://finnhub.io/api/news?id=82edff24d895ead68f718131d45bd42148b9d40ef456ab3984278021c930be9a
company,1780394957,Assessing Realty Income (O) Valuation After Recent Share Price Pullback And Mixed Undervaluation Signals,140498479,https://s.yimg.com/rz/stage/p/yahoo_finance_en-US_h_p_finance_2.png,O,Yahoo,"Short term share performance check Realty Income (O) has seen the stock decline 2.8% over the past day and 4% over the past week, extending a fall of about 6.7% over the past month and 10.5% in the past 3 months. See our latest analysis for Realty Income. The recent pullback extends a weaker run in the share price, but the year-to-date share price return of 3.9% and 1-year total shareholder return of 11.1% suggest overall momentum has been steadier for long-term holders. If Realty Income has...",https://finnhub.io/api/news?id=be5c1625aa692e060346b19ea316ce475d639b5c742a36d40d0ac05202a0009a
company,1780392695,Collect Growing Monthly Income For Your Financial Fortress: Realty Income,140498994,,O,SeekingAlpha,,https://finnhub.io/api/news?id=98ca7cffee77fe90ba878cee856a5586a53b4d99bc3d7ce842273a1cf45246d8
