category,datetime,headline,id,image,related,source,summary,url
company,1778083020,Palo Alto Networks Trades at Premium Valuation: How to Play the Stock,140193684,https://s.yimg.com/rz/stage/p/yahoo_finance_en-US_h_p_finance_2.png,PANW,Yahoo,"PANW trades at a premium valuation as acquisition costs, EPS pressure and rising cybersecurity competition weigh on near-term prospects.",https://finnhub.io/api/news?id=0409b045fd969386735d536b94eb49dfeff07c764f24516af0ac4196b1e6bedd
company,1778082516,BTIG Just Got Bullish on Palo Alto Networks: Price Target Climbs to $216 on Improving Channel Checks,140191345,https://s.yimg.com/rz/stage/p/yahoo_finance_en-US_h_p_finance_2.png,PANW,Yahoo,"One of Wall Street’s top firms just put its stamp of approval on cybersecurity leader Palo Alto Networks (NASDAQ:PANW). On May 6, 2026, BTIG raised its PANW stock price target to $216 from $200 and reiterated a Buy rating, citing a fresh round of channel checks with partners and customer contacts that came back “constructive ... BTIG Just Got Bullish on Palo Alto Networks: Price Target Climbs to $216 on Improving Channel Checks",https://finnhub.io/api/news?id=1b413ce09179271a9a56257a89b147c16227f4546a344e71c95438b87c47a3b6
company,1778080880,Palo Alto Is Buying Portkey. That Makes PANW Stock Even More of a Bet on AI Agents.,140197427,https://s.yimg.com/rz/stage/p/yahoo_finance_en-US_h_p_finance_2.png,PANW,Yahoo,"Cybersecurity giant Palo Alto Networks is eyeing AI gateway startup Portkey. But will this acquisition meaningfully lift PANW stock, or take time to show results?",https://finnhub.io/api/news?id=106802dc3f9c312b6bdf324d06921556a054ebf7c26673b64c2bc49bfd895c93
company,1778075285,Palo Alto To Rally Around 20%? Here Are 10 Top Analyst Forecasts For Wednesday,140195731,https://cdn.benzinga.com/files/images/story/2026/05/06/Palo-Alto-Networks-Inc-.jpeg?width=2048&height=1536,PANW,Benzinga,Summary: Wall Street analysts changed outlook on top names; Stifel cut price target for Leidos; Bernstein slashed Bellring Brands PT; Morgan Stanley raised PT for Cummins; Rothschild upgraded Monster Beverage; Cantor Fitzgerald raised AMD PT; RBC Capital raised UDR PT; Barclays raised ON PT; Guggenheim increased PT for Sphere Entertainment Co.,https://finnhub.io/api/news?id=6ccfff744ef8420684cb0bf8dce5b30a50abfa75f9fe541b2d775b20eb3a6893
company,1778075285,This large-cap stock is the latest addition to BTIG Top Picks focus list,140189925,https://s.yimg.com/rz/stage/p/yahoo_finance_en-US_h_p_finance_2.png,PANW,Yahoo,"Investing.com -- BTIG has added a new large-cap stock to its Top Picks focus list and raised the price target to $216 from $200, citing fresh channel checks that point to durable demand and accelerating momentum behind the cybersecurity company's platform strategy.",https://finnhub.io/api/news?id=10b956e2d6b7d032af0ce385d17cbef279df26438d0c89744faf7b668edc9e06
company,1778073845,SaaSpocalypse Doesn't Make Sense Any More,140192936,https://static.seekingalpha.com/cdn/s3/uploads/getty_images/1491434261/image_1491434261.jpg?io=getty-c-w1536,PANW,SeekingAlpha,"Buy IGV (iShares Tech-Software ETF) to diversify software exposure, reduce single-stock risk, and capture an AI-driven SaaS rerating amid volatilityâread...",https://finnhub.io/api/news?id=4ef8d1deb690f31a78b6e4bfb7b8c9912afa2373a29c8f379d09ea7f0ecc343e
company,1778068920,"Netwrix Builds Out Leadership Bench with CTO, VP of Engineering, and Head of Americas Channel",140189926,https://s.yimg.com/rz/stage/p/yahoo_finance_en-US_h_p_finance_2.png,PANW,Yahoo,"Netwrix, a recognized leader in identity and data security solutions, today announced the appointment of Avesta Hojjati as Chief Technology Officer, Marcin Gierlak as Vice President of Engineering and Kraków Site Leader, and Natalie Tomlin as Head of Channel for North America.",https://finnhub.io/api/news?id=6bd8f01aff6b910f3ddf078075fea6e0f3cf30a88203e08e9569af60b6c38f81
company,1778063706,"Truist Securities Reiterates Buy on Palo Alto Networks, Raises Price Target to $220",140192684,,PANW,Benzinga,Truist Securities  analyst Junaid Siddiqui   reiterates Palo Alto Networks (NASDAQ:PANW) with a Buy and raises the price target from $205 to $220.,https://finnhub.io/api/news?id=d4d79b924614a3b2e4c3d9a6b3e555b6cb3480593573f4c9c96bd0b88b860605
company,1778055203,Did Armadin’s Offensive AI Partnership Just Shift Palo Alto Networks' (PANW) Investment Narrative?,140186874,https://s.yimg.com/rz/stage/p/yahoo_finance_en-US_h_p_finance_2.png,PANW,Yahoo,"In recent days, Armadin announced a strategic partnership with Palo Alto Networks’ Unit 42 Frontier AI Defense, adding autonomous AI-driven external attack assessments that simulate real-world exploitation across internet-facing assets and cloud resources. This move highlights how Palo Alto Networks is embedding offensive-style AI capabilities into its services to help enterprises understand and remediate their most exploitable AI-era cyber risks. We’ll now explore how this Armadin...",https://finnhub.io/api/news?id=beea21d88247a0f2c56bf9c1c5ee88e03212419494262bf8489d91be91747b58
company,1778047804,"BTIG Maintains Buy on Palo Alto Networks, Raises Price Target to $216",140192685,,PANW,Benzinga,BTIG  analyst Gray Powell   maintains Palo Alto Networks (NASDAQ:PANW) with a Buy and raises the price target from $200 to $216.,https://finnhub.io/api/news?id=2983943028ea13ddf102fbf987f13751033027faa2420e74d9e0388ca9ec38dc
company,1778044500,Brown Advisory Large-Cap Sustainable Growth Strategy Q1 2026 Portfolio Activity,140186612,https://static.seekingalpha.com/cdn/s3/uploads/getty_images/1359134494/image_1359134494.jpg?io=getty-c-w1536,PANW,SeekingAlpha,Monolithic Power Systems climbed during the quarter due to strong quarterly results as well as a favorable outlook associated with demand trends.,https://finnhub.io/api/news?id=ea13588a3dfb329629d95f970dba65fb15f6a18a6f72b00d0a6f5501df0f7cd7
company,1778039420,Nancy Pelosi Portfolio Back In Spotlight As Former House Speaker Reportedly Rakes In Cool $3 Million From Stock Market In One Week,140190786,https://cdn.benzinga.com/files/images/story/2026/05/06/shutterstock-2530140203.jpeg?width=2048&height=1536,PANW,Benzinga,"Fresh scrutiny of Nancy Pelosi&#39;s market activity follows reports of a roughly $3 million weekly gain, intensifying debate over lawmakers&#39; stock trading as tech-heavy portfolios drive outsized returns.",https://finnhub.io/api/news?id=93754284369bf380ab1821b1ea990aba42bd739fdd21446ed3ca4ff1e3ee7663
