category,datetime,headline,id,image,related,source,summary,url
company,1778084474,"Prudential Financial, Inc. (PRU) Q1 2026 Earnings Call Transcript",140196020,https://static.seekingalpha.com/assets/og_image_1200-29b2bfe1a595477db6826bd2126c63ac2091efb7ec76347a8e7f81ba17e3de6c.png,PRU,SeekingAlpha,"Prudential Financial, Inc. (PRU) Q1 2026 Earnings Call May 6, 2026 11:00 AM EDTCompany ParticipantsTina Madon - Global Head of Investor RelationsAndrew...",https://finnhub.io/api/news?id=3b44070051a53ce5a016b6f888eee7f0eed5ba1dd5af5b333920857f995916ab
company,1778083259,"Prudential Financial, Inc. 2026 Q1 - Results - Earnings Call Presentation",140195609,https://static.seekingalpha.com/assets/og_image_1200-29b2bfe1a595477db6826bd2126c63ac2091efb7ec76347a8e7f81ba17e3de6c.png,PRU,SeekingAlpha,"2026-05-06. The following slide deck was published by Prudential Financial, Inc.",https://finnhub.io/api/news?id=76e1ae111d6fcd4f9f767582ac573c53737e2ca58cd013cc889c3f48a9db92fc
company,1778079000,PRU Q1 Earnings & Revenues Top Estimates on Solid Investment Spread,140191713,https://s.yimg.com/rz/stage/p/yahoo_finance_en-US_h_p_finance_2.png,PRU,Yahoo,"Prudential Financial's Q1 results reflect higher asset management fees, new business growth and improved net investment spread results.",https://finnhub.io/api/news?id=fa68f53eb53a696a0cf11e75074babd0b682e25b367c73c3663104b76c1eba5b
company,1778071815,"Transcript : Prudential Financial, Inc., Q1 2026 Earnings Call, May 06, 2026",140192350,,PRU,Finnhub,"Presentation Operator MessageOperator Ladies and gentlemen, thank you for standing by, and welcome to Prudential's Quarterly Earnings Conference Call. [Operator Instructions] As a reminder, this...",https://finnhub.io/api/news?id=7ee08bddd83288d6ac3efccc68ce843bc09212203c693c09e901b11a6d1bc451
company,1778070600,"Prudential Financial, Inc. Q1 2026 Earnings Call Summary",140193818,https://s.yimg.com/rz/stage/p/yahoo_finance_en-US_h_p_finance_2.png,PRU,Yahoo,"Moby summary of Prudential Financial, Inc.'s Q1 2026 earnings call",https://finnhub.io/api/news?id=c7101fbfd8d31db24e4bd87e154171b7c8b424cd9bb6aec44e236f15766f4c55
company,1778069502,Prudential Financial Q1 2026 Earnings Call Transcript,140197910,https://cdn.benzinga.com/files/images/story/2025/11/06/movers_3.jpg?width=2048&height=1536,PRU,Benzinga, ,https://finnhub.io/api/news?id=2ebc14fd21eafa87596025d8aa6547cfa7eb86412ab472d37ac4c2ffc407eb7f
company,1778067120,"Barclays Maintains Underweight on Prudential Financial, Raises Price Target to $90",140197911,,PRU,Benzinga,Barclays  analyst Alex Scott   maintains Prudential Financial (NYSE:PRU) with a Underweight and raises the price target from $89 to $90.,https://finnhub.io/api/news?id=4a9936cec979e3a93f6d9b07fb9d7b5bfad10beeda26e9f286d9a0855c449713
company,1778058878,Prudential Financial Q1 2026 profit falls 15.6% after Japanese sales suspension,140186953,https://s.yimg.com/rz/stage/p/yahoo_finance_en-US_h_p_finance_2.png,PRU,Yahoo,After-tax adjusted operating income increased by 7.6% to $1.28bn from $1.19bn a year earlier.,https://finnhub.io/api/news?id=bc69fae025e283538c41c788dab59707684fab22ada7154a82e5c4a3bccba660
company,1778032409,Prudential Financial: Solid Q1 Despite Japan Challenges,140185180,https://static.seekingalpha.com/cdn/s3/uploads/getty_images/2241775608/image_2241775608.jpg?io=getty-c-w1536,PRU,SeekingAlpha,"Prudential Financial had solid results despite the Japan problems, a secure dividend, and a modest buyback. Read why PRU stock is a Buy.",https://finnhub.io/api/news?id=14a92df959221dc686c67ba8ac4ebd6557aa5942754eff4117f3d746aec226fa
