category,datetime,headline,id,image,related,source,summary,url
company,1778079388,"Citigroup Maintains Buy on Rockwell Automation, Raises Price Target to $500",140198996,,ROK,Benzinga,Citigroup  analyst Andrew Kaplowitz   maintains Rockwell Automation (NYSE:ROK) with a Buy and raises the price target from $466 to $500.,https://finnhub.io/api/news?id=897193e8ecfa955a3c1f8a39fbdf8e60f9b6fe2f37ae4da88f2ec5d3334f8f46
company,1777034850,"X-Energy IPO Opens For Trade At $30.11/Share; IPO Priced At $23/Share On 44,254,659 Shares",139983169,,ROK,Benzinga,,https://finnhub.io/api/news?id=975af2f337d72d70b61a69fd97e5afeca128898f530aa00c65a97c1b2b4f3894
company,1778077701,Rockwell Automation Analysts Raise Their Forecasts Following Upbeat Q2 Results,140198998,https://cdn.benzinga.com/files/images/story/2026/05/06/Rockwell-Automation--Inc-.jpeg?width=2048&height=1536,ROK,Benzinga,"Rockwell Automation (NYSE:ROK) reported better-than-expected Q2 results, raised FY26 guidance. Analysts have increased price targets for ROK.",https://finnhub.io/api/news?id=7d6a973c5382c86294b41a9801957a690a236b9ebe7413f6926187a1f9404484
company,1778073477,Why Rockwell Automation (ROK) Is Up 8.6% After Raising 2026 Guidance On Strong Q2 Results,140190042,https://s.yimg.com/rz/stage/p/yahoo_finance_en-US_h_p_finance_2.png,ROK,Yahoo,"In its fiscal second quarter ended March 31, 2026, Rockwell Automation reported sales of US$2,239 million and net income of US$350 million, both higher than a year earlier, and raised its full-year revenue and earnings guidance after beating analyst expectations. The quarter also featured double-digit growth in orders and strong performance from intelligent devices and software, reinforcing management’s focus on higher-margin automation and digital solutions across sectors such as data...",https://finnhub.io/api/news?id=feb8164bf1dd0aa1ade5ef327709e0fcb75684a18ee347e076f948e2deb9a6a0
company,1778072427,Rockwell Automation: Benefiting From The AI Data Center Surge,140192523,https://static.seekingalpha.com/cdn/s3/uploads/getty_images/1594292118/image_1594292118.jpg?io=getty-c-w1536,ROK,SeekingAlpha,"Rockwell Automation (ROK) Q2 2026 earnings beat: EPS $3.30, revenue $2.24B; raised guidance on AI/data center demand. Here's what investors need to know about the company.",https://finnhub.io/api/news?id=d63eb88b4d49c9692344ee5f2d74d2081d3f3e7dd4fc2517cba279d7b01e39cc
company,1778067342,"Barclays Maintains Overweight on Rockwell Automation, Raises Price Target to $480",140198999,,ROK,Benzinga,Barclays  analyst Julian Mitchell   maintains Rockwell Automation (NYSE:ROK) with a Overweight and raises the price target from $400 to $480.,https://finnhub.io/api/news?id=f2d7bfe3e6f5c5144fc686b77a49f98f3fe1c302a8dd5ce5fb3ad12b3a876ceb
company,1778062149,"Wells Fargo Maintains Equal-Weight on Rockwell Automation, Raises Price Target to $440",140199000,,ROK,Benzinga,Wells Fargo  analyst Joseph O&#39;Dea   maintains Rockwell Automation (NYSE:ROK) with a Equal-Weight and raises the price target from $360 to $440.,https://finnhub.io/api/news?id=aca54e64b74768788eee6f90a405186c04dee7b499f495e946470ce9ce99726e
company,1778058309,"Keybanc Maintains Overweight on Rockwell Automation, Raises Price Target to $510",140199001,,ROK,Benzinga,Keybanc  analyst Ken Newman   maintains Rockwell Automation (NYSE:ROK) with a Overweight and raises the price target from $470 to $510.,https://finnhub.io/api/news?id=028ab5f766040d16145e378bca2e73a00dd2a417de8f202aff434009ac10376a
company,1778057744,Jim Cramer's top 10 things to watch in the stock market Wednesday,140192629,https://image.cnbcfm.com/api/v1/image/108248910-1767724217022-gettyimages-2254260723-CES_2026.jpeg?v=1776434430&w=1920&h=1080,ROK,CNBC,Stocks are set for another big day on reports about a potential Iran war agreement and more big AI news. ,https://finnhub.io/api/news?id=7f8f32d0f302ae7dd86e5fdf6c1d2f1f93c595dc496e592a836e7330a42baf45
