category,datetime,headline,id,image,related,source,summary,url
company,1780435057,Visa’s Expanded AI-Powered Receivables Hub Might Change The Case For Investing In Visa (V),140506238,https://s.yimg.com/rz/stage/p/yahoo_finance_en-US_h_p_finance_2.png,V,Yahoo,"In late May 2026, Visa announced an expansion of its Visa Commercial Solutions Hub by integrating Visa Accounts Receivable Manager, giving eligible issuers built-in, AI-powered virtual card processing and reconciliation across 69 geographies at no additional cost, subject to terms and availability. Early users report very large efficiency gains, including sharply shorter payment cycles and highly automated virtual card processing, highlighting how Visa is trying to remove long-standing...",https://finnhub.io/api/news?id=e20f5f2ce17e645e95f83f8cb08cafdbae87f48487ab873effba52bf0d1c5bd9
company,1780434376,"Western Union, Visa, PayPal, Meta: why major payments giants are racing to Solana",140506212,https://s.yimg.com/rz/stage/p/yahoo_finance_en-US_h_p_finance_2.png,V,Yahoo,"Kyle Samani, co-founder of Forward, breaks down his latest deal on the main stage at Solana, a minority stake in Henri, a reinsurance RWA yielding 12-13%, funded by a Galaxy debt facility at 3.5%. He makes the case for why Solana has quietly become the dominant chain for institutional payments, tokenized equities, and real world assets. From Western Union and Visa to Meta and PayPal, the biggest names in finance are all building on the same rails. Plus, why he thinks most altcoins are bleeding out, Ethereum L2s are in trouble, and why this bear market might be the best investing opportunity in crypto right now.",https://finnhub.io/api/news?id=f6b81c39de3b71bfdc644bedf1fbf8ea48690994a1d383bc63eb312f23b3f0a7
company,1780434018,Tracking Jeremy Grantham's GMO Capital Portfolio - Q1 2026 Update,140508339,https://static.seekingalpha.com/cdn/s3/uploads/getty_images/186805810/image_186805810.jpg?io=getty-c-w1536,V,SeekingAlpha,"GMOâs $39B 13F shows shifts into quality large-cap tech & healthcareâadding Microsoft, Broadcom, Salesforce while trimming Lam, Wells Fargo. See more.",https://finnhub.io/api/news?id=6348ce27d58f95fda929e273b69a03104e78a5d032b601f3f1146cce1660706e
company,1780430134,Payment sovereignty and the relationship with cash,140504248,https://s.yimg.com/rz/stage/p/yahoo_finance_en-US_h_p_finance_2.png,V,Yahoo,"Neil Martin explains why digital rails and cash must work together, if the National Payments Vision goal of enabling consumers and businesses to have genuine choice in how they pay, is to be realised",https://finnhub.io/api/news?id=6e36dd13f4e6f97c881f0cb35f91a9bba5facb4a8fce274c5bbfd8d1946c598e
company,1780427403,Top dow jones movers in Tuesday's session,140503591,https://www.chartmill.com/images/uploads/CM_Top_Movers_Small_free_2b4ff2fc22.webp,V,ChartMill,Stay updated with the movements of the dow jones index one hour before the close of the markets on Tuesday. Discover which stocks are leading as top gainers and losers in today's session.,https://finnhub.io/api/news?id=f3aa7355cabb85adb09e05122b406e9457a685b6944d1d51ba3e62a0a6270345
company,1780418402,Uncover the latest developments among dow jones stocks in today's session.,140501253,https://www.chartmill.com/images/uploads/CM_Top_Movers_Small_free_2b4ff2fc22.webp,V,ChartMill,Stay informed about the performance of the dow jones index in the middle of the day on Tuesday. Uncover the top gainers and losers in today's session for valuable insights.,https://finnhub.io/api/news?id=5df21e6ee982416bda0e46a33083d8a689c8f81625dab5b8bddf92028372e679
company,1780415220,Can Mastercard's TIPS Pilot Improve Cross-Border Payment Efficiency?,140502443,https://s.yimg.com/rz/stage/p/yahoo_finance_en-US_h_p_finance_2.png,V,Yahoo,"MA tests instant euro-krona payments on TIPS, validating atomic settlement and end-to-end cross-border processing.",https://finnhub.io/api/news?id=3365cc5cf63b318e3a9777a300e3b868deb52eaf957e6e765688b2825cc12390
company,1780415106,Nubank swipes Visa vet for CFO amid US push,140506240,https://s.yimg.com/rz/stage/p/yahoo_finance_en-US_h_p_finance_2.png,V,Yahoo,"Shares of the Brazilian neobank’s parent slumped Tuesday, one day after it announced its long-time CFO was stepping down.",https://finnhub.io/api/news?id=608dd1b3c0246e8954f28e243aaaf9c87834d3eec3111a9c803d28d6df534cd0
company,1780414197,"Tariff-Driven Inflation Is Trapping Mortgage Rates, and the Fed Can’t Fix It with Rate Cuts",140500458,https://s.yimg.com/rz/stage/p/yahoo_finance_en-US_h_p_finance_2.png,V,Yahoo,"On a recent Rich Habits Podcast segment, market commentator Ron Santella put it bluntly: “The playbook from last week hasn’t changed. It’s actually gotten more entrenched. Higher for longer is the base case.” For households waiting on a refinance or a first home purchase, he was even more direct: “Today’s report tells you it’s not ... Tariff-Driven Inflation Is Trapping Mortgage Rates, and the Fed Can’t Fix It with Rate Cuts",https://finnhub.io/api/news?id=2a86f1a3d8ca7ca23d559742727b77d2fcaf21f243132a2fbdff96e2ce2ec4a3
company,1780413189,Why Is IBM Up 30% In A Week? An Old Trump Clip May Have Something To Do With It,140506117,https://cdn.benzinga.com/files/images/story/2026/06/02/Dusseldorf--North-Rhine-westphalia--Germ_0.jpeg?width=2048&height=1536,V,Benzinga,Trump&#39;s praise of IBM CEO helped power stock&#39;s biggest weekly move in years. IBM&#39;s $10B quantum investment &amp; AI initiatives also driving growth.,https://finnhub.io/api/news?id=3bb688eb1b69e28514af851aca8a68c0dfc69e69fca2d923cb98c2797e15d5e2
company,1780412913,Nu Holdings Shares Down 22% As It Names New CFO For US Push,140500459,https://s.yimg.com/rz/stage/p/yahoo_finance_en-US_h_p_finance_2.png,V,Yahoo,Visa veteran Rob Livingston joins as CFO as Nubank prepares for planned US banking expansion.,https://finnhub.io/api/news?id=2ef18d8942a8bdcf1d4d93fd6ba615bf1a0565845747f878483326d7813bca5f
company,1780406963,Why Is Nu Holdings Stock Falling Tuesday?,140503160,https://cdn.benzinga.com/files/images/story/2026/06/02/Nu-Holdings-Ltd-.jpeg?width=2048&height=1536,V,Benzinga,"Nu Holdings stock falls 9% after BofA cuts its price target to $10, contrasting with UBS and Wall Street&#39;s broader consensus Buy rating.",https://finnhub.io/api/news?id=53934a32621ef0a515e42e1ac12660185549a8a7eff1f4a7ee96c183ebb03bc2
company,1780404497,Nubank downgraded to “underperform” at BofA on CFO exit and leadership turnover,140499227,https://s.yimg.com/rz/stage/p/yahoo_finance_en-US_h_p_finance_2.png,V,Yahoo,"Investing.com -- BofA Securities downgraded Nubank to “underperform” from “neutral” rating, cutting its price objective to $10 from $16, after the Brazilian neobank announced chief financial officer Guilherme Lago would step down effective July 13, adding to a string of senior leadership departures the broker said had become ""harder to ignore.""",https://finnhub.io/api/news?id=afe0a58efe77b502a2c68dfe3768c38b797a3146927a3ffcef165dc12fa1a895
company,1780398947,Does Nubank’s New Visa-Veteran CFO Reshape the Strategic Playbook for Nu Holdings (NU)?,140498384,https://s.yimg.com/rz/stage/p/yahoo_finance_en-US_h_p_finance_2.png,V,Yahoo,"Nubank has announced that Rob Livingston, a former senior executive at Visa and Capital One, will assume the role of Chief Financial Officer on July 13, 2026, succeeding longtime CFO Guilherme Lago, who shifted to a Special Advisor position and will continue to support the finance and strategy function. This handover marks a shift from a finance leader who oversaw Nubank’s evolution into a large digital banking platform to an incoming CFO with deep global payments and credit experience...",https://finnhub.io/api/news?id=506d32f08d8de66a4100bc1b25e6cc08cd53ed5e0a05926690ac237ad613b408
company,1780398000,Plot Raises $10M to Scale Social Video Intelligence for Marketing Teams at Fortune 500 Brands,140498385,https://s.yimg.com/rz/stage/p/yahoo_finance_en-US_h_p_finance_2.png,V,Yahoo,"Plot, the social video intelligence platform trusted by Visa, Mastercard, PepsiCo, Fenty Beauty, Benefit Cosmetics, and CAVA, today announced $10M in new funding to meet enterprise demand for its expanding platform. The seed round brings Plot's total raised to $14M and was co-led by XYZ Venture Capital and Mischief Ventures, with participation from Seven Seven Six and Acme Capital.",https://finnhub.io/api/news?id=aa294bcfa9a9b3d5262e95905814ae022d6cfc14350c6f2d11899ac946256133
company,1780396500,How Your Income Stacks Up Against the Top 10% of American Earners,140498386,https://s.yimg.com/rz/stage/p/yahoo_finance_en-US_h_p_finance_2.png,V,Yahoo,"Age, location, and financial habits influence whether or not you're in the top 10% of earners.",https://finnhub.io/api/news?id=7db277503412fabb47b9dd3917f2274cfe7bc7ccd5b4042badb617231e104d1f
company,1780392600,Why I Stopped Buying VOO And QQQ - And What I Am Buying Instead,140498997,https://static.seekingalpha.com/cdn/s3/uploads/getty_images/1339056712/image_1339056712.jpg?io=getty-c-w1536,V,SeekingAlpha,VOO & QQQ pause: S&P 500 valuations and concentration risk look extreme. Click here to read more on my analysis of the funds.,https://finnhub.io/api/news?id=647734a3d1b509bdd65090738d1aa5aad02b037b5f54ac5df9bfa6b874c99f9c
company,1780390675,PayPal: I Invite The Bulls To Go Over Some Accounting Basics,140498875,https://static.seekingalpha.com/cdn/s3/uploads/getty_images/1936795114/image_1936795114.jpg?io=getty-c-w1536,V,SeekingAlpha,PayPal (PYPL) FQ1 2026: Hold rating despite an earnings beat as margins and cash flow concerns linger.,https://finnhub.io/api/news?id=21365f4127e08ba7a55e1729ab19d73eae261259fcda105901f58c7c71da233c
company,1780387892,NU Stock Slips Premarket: BofA Sees Trouble Ahead As Key Executive Hands Over The Reins,140497769,https://s.yimg.com/rz/stage/p/yahoo_finance_en-US_h_p_finance_2.png,V,Yahoo,BofA Securities downgraded Nu Holdings to ‘Underperform’ from ‘Neutral’ and cut its price target to $10 from $16.,https://finnhub.io/api/news?id=ad0fc79e05b05fbb21e4dc054c75c6aa999ddf76dad36c460b196d0281d7b0a7
company,1780377268,Top 25 High-Growth Dividend Stocks For June 2026,140497573,https://static.seekingalpha.com/cdn/s3/uploads/getty_images/2214049905/image_2214049905.jpg?io=getty-c-w1536,V,SeekingAlpha,The June 2026 Top 25 High-Growth Dividend Stocks list targets quality companies trading ~30% below intrinsic value with a 1.50% average yield. Read what investors need to know.,https://finnhub.io/api/news?id=b3b1f8b42130efb97523aa4091791acfb7766363501645a11579014d00e93ec9
company,1780369918,Visa Expands B2B Automation And Fan Commerce To Support Long Term Story,140496219,https://s.yimg.com/rz/stage/p/yahoo_finance_en-US_h_p_finance_2.png,V,Yahoo,"Visa (NYSE:V) has integrated Visa Accounts Receivable Manager into its Commercial Solutions Hub, aiming to streamline virtual card adoption and automate payments and reconciliation for issuers and suppliers. Visa also announced a collaboration with Men in Blazers Media Network to create soccer focused City Guides that connect local small businesses with fans during major sporting events. Visa, trading at about $322.77, has seen its share price decline 6.8% year to date and 10.9% over the...",https://finnhub.io/api/news?id=b34a94bac4d6222d14855bbb03c9f838345ce82374cadb4772c79dbd2ff95015
